Year,Month,Day,Time,End Year,End Month,End Day,End Time,Display Date,Headline,Text,Media,Media Credit,Media Caption,Media Thumbnail,Type,Group,Background
2018,3,3,,,,,,March 3 2018,Aliquam eius labore tempora quiquia etincidunt.,Adipisci sit amet amet aliquam. Aliquam consectetur dolore adipisci quisquam etincidunt sit quisquam. Quiquia aliquam etincidunt adipisci tempora voluptatem magnam. Quaerat est magnam numquam tempora numquam. Adipisci est dolore consectetur aliquam quisquam magnam non. Dolorem consectetur quaerat adipisci quaerat eius est. Porro tempora quiquia sed non. Tempora voluptatem voluptatem numquam ut voluptatem.,https://picsum.photos/723/?random,,Voluptatem adipisci non dolor quaerat quisquam neque dolore.,,,,
2009,9,13,,,,,,September 13 2009,Non porro modi quiquia eius ipsum tempora.,Magnam sed eius voluptatem porro. Adipisci eius dolore modi dolor. Dolor dolor quisquam voluptatem porro. Neque eius quiquia consectetur est magnam sed quiquia. Velit dolorem neque dolore est adipisci consectetur.,https://picsum.photos/724/?random,,Velit quaerat neque magnam dolore.,,,,
2004,3,8,,,,,,March 8 2004,Dolore amet dolor neque etincidunt labore sed adipisci.,Modi ipsum consectetur amet eius quiquia tempora. Voluptatem modi eius velit aliquam numquam dolore adipisci. Dolorem neque quiquia adipisci. Ipsum non ipsum non modi. Velit sed quisquam etincidunt. Modi labore ipsum dolor dolore.,https://picsum.photos/725/?random,,Amet est eius tempora dolore ipsum.,,,,
1987,9,14,,,,,,September 14 1987,Modi numquam ipsum neque quisquam sit.,Porro adipisci dolor sit. Amet velit labore labore non dolore eius sit. Etincidunt etincidunt ut modi neque sit. Magnam consectetur neque non magnam ut dolorem dolor. Magnam aliquam velit amet. Dolorem voluptatem modi non. Etincidunt labore quisquam quiquia eius.,https://picsum.photos/726/?random,,Consectetur porro tempora quaerat.,,,,
1992,7,11,,,,,,July 11 1992,Sed quaerat numquam porro.,Sed non magnam quisquam. Etincidunt non numquam ipsum. Quaerat neque voluptatem dolor labore modi. Aliquam magnam non labore non eius quiquia neque. Est velit consectetur magnam consectetur consectetur.,https://picsum.photos/727/?random,,Ipsum non non ipsum etincidunt consectetur dolore quisquam.,,,,
2012,7,9,,,,,,July 9 2012,Modi adipisci quaerat amet consectetur modi consectetur.,Amet dolorem ut quiquia numquam aliquam. Neque ut magnam modi voluptatem velit. Porro est porro labore dolorem non. Quisquam quisquam sed porro. Quiquia sit numquam sit numquam quiquia. Consectetur porro labore consectetur. Dolor dolore dolorem eius dolorem. Eius neque dolor amet consectetur sed non. Ut modi sit numquam voluptatem labore.,https://picsum.photos/728/?random,,Voluptatem dolorem numquam ut ut etincidunt porro.,,,,
1990,3,11,,,,,,March 11 1990,Dolorem velit non voluptatem dolorem.,Labore aliquam est porro quaerat adipisci dolore. Sed est consectetur neque. Amet ut consectetur dolor ipsum porro magnam numquam. Numquam quiquia quaerat quisquam tempora sed. Dolore dolorem consectetur labore amet velit ut modi. Aliquam velit sit neque consectetur dolorem quiquia. Ut voluptatem modi labore. Tempora tempora amet dolorem tempora tempora numquam ut. Labore dolor amet tempora non.,https://picsum.photos/729/?random,,Sit non amet labore.,,,,
2001,11,13,,,,,,November 13 2001,Labore est numquam est tempora.,Voluptatem sit ut velit quisquam magnam est. Neque magnam ut modi sed ut quiquia est. Magnam adipisci etincidunt neque. Adipisci non sed labore modi quiquia. Ipsum quisquam aliquam quiquia sed quaerat voluptatem est. Amet consectetur quisquam voluptatem quaerat.,https://picsum.photos/730/?random,,Sed quiquia dolore quiquia aliquam.,,,,
1985,11,16,,,,,,November 16 1985,Eius est voluptatem sit sit amet sed sed.,Velit porro numquam aliquam. Quaerat eius amet non consectetur quaerat. Sit dolor eius aliquam. Quiquia quisquam quisquam neque etincidunt tempora ipsum. Non sit neque porro quisquam magnam. Modi quiquia aliquam eius consectetur sit. Numquam amet quaerat voluptatem. Quaerat quisquam tempora est.,https://picsum.photos/731/?random,,Magnam sit ipsum dolor ut.,,,,
2009,1,13,,,,,,January 13 2009,Velit adipisci porro sed magnam.,Amet aliquam eius labore sed quiquia consectetur porro. Modi voluptatem tempora numquam ipsum modi. Porro adipisci labore neque dolorem. Aliquam labore sed numquam voluptatem dolor adipisci. Etincidunt velit tempora est modi voluptatem dolorem. Amet dolore eius ut.,https://picsum.photos/732/?random,,Magnam porro amet magnam neque sit.,,,,
2002,3,25,,,,,,March 25 2002,Sit aliquam modi quiquia consectetur ut est.,Porro porro dolorem est ut. Sed sed eius magnam voluptatem dolorem etincidunt ipsum. Porro adipisci adipisci ipsum est labore quisquam voluptatem. Quaerat dolorem etincidunt est quaerat numquam voluptatem. Tempora modi aliquam numquam amet ipsum adipisci ut. Non quisquam neque est non amet porro. Dolor labore ut sit quiquia magnam consectetur non.,https://picsum.photos/733/?random,,Porro sit magnam modi.,,,,
2005,4,14,,,,,,April 14 2005,Non sit etincidunt sed etincidunt numquam dolorem voluptatem.,Velit labore numquam modi quaerat voluptatem dolore dolore. Eius quisquam quiquia quiquia. Modi ipsum ipsum sit magnam adipisci amet labore. Modi tempora dolore etincidunt dolore non. Labore quisquam sed dolorem dolor neque velit. Consectetur quiquia neque adipisci eius tempora. Est consectetur quaerat ipsum. Est quaerat etincidunt ut est etincidunt quisquam. Dolore porro dolorem ipsum. Est porro non velit.,https://picsum.photos/734/?random,,Quiquia numquam velit consectetur.,,,,
1985,12,18,,,,,,December 18 1985,Modi sed labore sit.,Numquam quaerat labore consectetur ipsum modi voluptatem velit. Ut dolorem velit labore sit adipisci. Dolorem dolor aliquam consectetur consectetur quiquia numquam. Est dolor dolorem est labore aliquam. Eius voluptatem labore magnam magnam modi. Quaerat sit modi sed labore eius ipsum dolorem. Quaerat voluptatem ipsum etincidunt est. Adipisci quaerat dolor tempora. Quiquia eius non sed modi numquam amet dolor.,https://picsum.photos/735/?random,,Dolor quiquia tempora est.,,,,
1998,3,28,,,,,,March 28 1998,Dolor non eius porro aliquam.,Adipisci quaerat amet sit aliquam neque. Est tempora ipsum non porro quaerat dolorem. Adipisci labore voluptatem velit consectetur velit amet. Sit dolorem consectetur labore. Quaerat porro quiquia porro. Etincidunt aliquam ipsum voluptatem. Quaerat modi quiquia dolorem quiquia numquam. Consectetur tempora magnam sit velit. Est magnam etincidunt quisquam voluptatem. Voluptatem porro quisquam quisquam ut est.,https://picsum.photos/736/?random,,Quisquam est modi modi consectetur.,,,,
1981,1,20,,,,,,January 20 1981,Ut ut magnam adipisci ut modi numquam.,Amet quaerat porro ut consectetur magnam. Neque adipisci tempora consectetur. Magnam amet porro modi quaerat ut. Ut quiquia sit tempora. Magnam neque dolor neque. Velit sit consectetur est quisquam ut. Ipsum neque consectetur eius.,https://picsum.photos/737/?random,,Quisquam quiquia eius neque magnam.,,,,
2010,4,1,,,,,,April 1 2010,Sit eius tempora amet.,Porro quaerat ut ut porro adipisci sed etincidunt. Dolore consectetur labore est porro quaerat. Numquam est voluptatem ipsum quaerat porro. Modi aliquam non quiquia quiquia consectetur numquam dolore. Tempora est quisquam modi ipsum etincidunt sed. Dolorem adipisci numquam quaerat eius porro. Adipisci aliquam est voluptatem sed sit. Etincidunt dolore ut quiquia voluptatem est labore voluptatem. Neque ut sit neque dolorem labore amet. Numquam etincidunt adipisci consectetur porro aliquam etincidunt.,https://picsum.photos/738/?random,,Eius neque quaerat dolor adipisci aliquam.,,,,
1981,10,26,,,,,,October 26 1981,Modi quisquam ipsum aliquam magnam non labore etincidunt.,Voluptatem quisquam labore eius dolorem. Numquam magnam sed dolore magnam adipisci. Modi neque modi numquam dolorem dolor. Consectetur eius porro numquam sit aliquam. Sed voluptatem neque voluptatem neque voluptatem. Amet aliquam voluptatem porro etincidunt eius.,https://picsum.photos/739/?random,,Dolore neque est labore dolorem.,,,,
1980,6,27,,,,,,June 27 1980,Est dolor modi sit quaerat quaerat tempora.,Amet labore sit modi velit voluptatem numquam dolor. Aliquam velit sit aliquam porro numquam etincidunt. Magnam etincidunt ipsum dolor labore aliquam. Quaerat magnam sit non sit. Neque aliquam magnam voluptatem adipisci.,https://picsum.photos/740/?random,,Adipisci est quiquia tempora ipsum.,,,,
1997,3,24,,,,,,March 24 1997,Voluptatem labore eius consectetur.,Dolorem quiquia adipisci adipisci numquam. Quiquia dolore aliquam voluptatem labore porro. Labore amet velit ipsum non consectetur. Quaerat ut sit labore dolor. Magnam tempora amet velit quaerat neque.,https://picsum.photos/741/?random,,Est sit non consectetur etincidunt modi quiquia.,,,,
2007,2,23,,,,,,February 23 2007,Aliquam adipisci ut consectetur non.,Amet aliquam sit magnam consectetur eius. Dolorem dolorem neque etincidunt magnam. Quaerat quiquia dolore sed. Dolor ipsum eius eius dolore. Non dolore dolore tempora labore.,https://picsum.photos/742/?random,,Dolorem labore porro velit est.,,,,
1991,2,21,,,,,,February 21 1991,Quisquam labore modi est est dolore sit eius.,Adipisci dolore modi est quiquia. Labore velit velit est quaerat labore. Adipisci est quaerat sit adipisci. Sit neque dolore numquam velit quaerat neque sit. Quaerat quaerat quiquia eius porro quisquam dolore ut. Etincidunt quisquam adipisci porro non dolorem adipisci magnam. Numquam quiquia numquam eius dolorem quaerat sed adipisci. Voluptatem non ipsum sit porro sit ut aliquam. Quiquia voluptatem ipsum dolor quisquam neque quiquia dolor.,https://picsum.photos/743/?random,,Tempora etincidunt aliquam voluptatem etincidunt voluptatem.,,,,
2014,7,16,,,,,,July 16 2014,Non dolorem dolore quisquam porro dolorem velit aliquam.,Etincidunt numquam porro labore dolorem. Etincidunt dolore adipisci numquam voluptatem labore numquam. Sed etincidunt dolor quiquia quisquam aliquam voluptatem etincidunt. Porro dolore dolor adipisci. Quisquam quiquia modi etincidunt dolor numquam amet est.,https://picsum.photos/744/?random,,Dolor adipisci dolorem eius ipsum eius velit.,,,,
2011,9,30,,,,,,September 30 2011,Est magnam numquam eius.,Quaerat numquam magnam ipsum quiquia aliquam. Non velit amet labore velit aliquam. Voluptatem numquam dolorem modi voluptatem dolor. Modi magnam quiquia ipsum aliquam numquam. Etincidunt ipsum modi ut dolor etincidunt.,https://picsum.photos/745/?random,,Neque neque porro labore etincidunt est.,,,,
2007,10,26,,,,,,October 26 2007,Velit dolor non quaerat magnam.,Dolor magnam quaerat quiquia tempora dolor. Sed dolor non ut dolore dolore amet tempora. Sed modi sed aliquam numquam eius sit. Dolor magnam aliquam quisquam porro porro. Voluptatem quiquia est magnam numquam aliquam etincidunt dolor. Ipsum dolor eius ut dolore amet modi. Consectetur modi aliquam amet ipsum modi tempora. Porro est ipsum aliquam amet velit.,https://picsum.photos/746/?random,,Quaerat sed labore dolor etincidunt.,,,,
2016,11,18,,,,,,November 18 2016,Numquam dolor porro voluptatem est non.,Sit voluptatem numquam sit velit voluptatem numquam. Est magnam amet magnam modi modi amet numquam. Non neque quisquam etincidunt labore voluptatem. Est ut quaerat sed ut dolor quaerat eius. Etincidunt sed numquam quaerat. Tempora non quiquia consectetur. Labore quaerat tempora porro ut velit eius. Ut quaerat quiquia modi sit ut neque.,https://picsum.photos/747/?random,,Ipsum sed consectetur sed sed.,,,,
1982,2,28,,,,,,February 28 1982,Aliquam non etincidunt est labore dolor dolorem ipsum.,Modi voluptatem sit est. Neque non ipsum consectetur neque numquam etincidunt. Ut modi voluptatem neque quiquia. Quisquam est porro magnam adipisci numquam amet neque. Sit labore sit sit non. Quisquam tempora dolorem amet tempora est dolore.,https://picsum.photos/748/?random,,Tempora aliquam voluptatem quiquia.,,,,
1999,7,14,,,,,,July 14 1999,Amet non magnam dolore porro magnam non.,Eius modi sed quiquia. Aliquam tempora sit etincidunt. Porro dolorem magnam voluptatem. Voluptatem magnam velit labore voluptatem eius. Quaerat porro adipisci neque aliquam voluptatem dolorem. Consectetur non porro neque consectetur etincidunt dolor dolor. Magnam modi voluptatem consectetur adipisci.,https://picsum.photos/749/?random,,Eius non sit magnam quiquia consectetur quiquia.,,,,
1982,3,10,,,,,,March 10 1982,Etincidunt sed velit dolorem quiquia quiquia numquam dolore.,Aliquam modi porro voluptatem est quiquia. Modi magnam porro aliquam. Aliquam magnam modi voluptatem aliquam neque magnam. Magnam neque quaerat amet modi quiquia. Numquam sed consectetur quaerat sit sit sed dolore. Eius dolorem amet numquam quaerat dolorem quaerat. Quaerat quisquam aliquam etincidunt adipisci non. Labore quaerat quiquia eius.,https://picsum.photos/750/?random,,Porro ut labore porro labore voluptatem.,,,,
2007,4,12,,,,,,April 12 2007,Consectetur labore non dolore amet porro.,Dolor sed sit voluptatem labore amet. Adipisci numquam ipsum velit quisquam quiquia. Quisquam consectetur sed adipisci eius amet adipisci amet. Adipisci aliquam dolore tempora. Ut ut non tempora ipsum. Tempora ut sed velit. Sed labore modi sit consectetur adipisci. Sit porro ipsum dolor sed.,https://picsum.photos/751/?random,,Aliquam etincidunt aliquam tempora ut.,,,,
2015,8,13,,,,,,August 13 2015,Eius magnam etincidunt consectetur.,Quaerat velit sed modi sed quisquam. Dolor porro dolor porro. Eius eius tempora adipisci voluptatem. Dolorem etincidunt ut sed quaerat est sit ut. Adipisci etincidunt consectetur numquam quiquia. Etincidunt consectetur modi adipisci dolor labore. Tempora modi labore voluptatem dolorem numquam quiquia velit.,https://picsum.photos/752/?random,,Quaerat dolore quaerat sed.,,,,
1995,10,5,,,,,,October 5 1995,Dolore amet sed non quiquia.,Modi non dolor est labore dolorem. Velit tempora etincidunt sed amet. Etincidunt quiquia neque quisquam. Modi est numquam velit voluptatem dolorem sed. Numquam aliquam voluptatem etincidunt quiquia sed quiquia quiquia. Modi labore numquam magnam modi non dolor. Aliquam numquam quisquam neque magnam ipsum adipisci. Sit quaerat magnam ut consectetur neque. Modi dolor etincidunt magnam.,https://picsum.photos/753/?random,,Etincidunt quaerat sed neque numquam.,,,,
1988,9,16,,,,,,September 16 1988,Etincidunt aliquam dolorem non dolorem porro etincidunt quisquam.,Ipsum dolorem ipsum porro numquam ipsum. Voluptatem labore quiquia eius labore. Adipisci labore est quiquia quaerat. Amet neque quiquia voluptatem labore. Tempora quiquia dolore adipisci neque velit eius. Velit modi voluptatem dolorem amet velit. Consectetur aliquam ut sed amet voluptatem dolorem.,https://picsum.photos/754/?random,,Sed quiquia quiquia labore neque sed eius.,,,,
2009,7,19,,,,,,July 19 2009,Sed dolore quisquam numquam modi sed quisquam labore.,Eius adipisci numquam dolor ut dolorem aliquam. Tempora sit eius dolorem magnam labore dolore. Neque ipsum amet labore numquam consectetur. Dolore modi etincidunt adipisci quiquia. Neque consectetur quiquia sed sit adipisci est. Dolore dolor ipsum quaerat aliquam porro voluptatem ipsum. Modi eius amet adipisci quisquam sit adipisci. Dolore voluptatem ipsum adipisci. Consectetur magnam quaerat dolor labore.,https://picsum.photos/755/?random,,Tempora magnam dolore neque amet.,,,,
2007,4,13,,,,,,April 13 2007,Dolorem ipsum dolorem consectetur dolor.,Quaerat adipisci quisquam magnam. Dolore modi modi tempora quaerat. Est labore velit eius labore adipisci numquam. Dolor dolore sit aliquam non quisquam. Est ipsum velit dolore quisquam non ipsum. Magnam est eius velit velit etincidunt adipisci est. Sed dolore consectetur dolor eius. Amet magnam modi amet. Amet dolor dolor amet neque aliquam ut sed. Ipsum numquam quiquia adipisci consectetur dolorem ut non.,https://picsum.photos/756/?random,,Quisquam numquam numquam ipsum porro consectetur dolore neque.,,,,
2016,11,17,,,,,,November 17 2016,Sed consectetur modi consectetur quiquia non velit sit.,Ut ut ut dolore magnam est. Voluptatem dolorem labore labore voluptatem. Porro dolore sit sit ut. Dolore tempora sit quaerat tempora sit amet adipisci. Aliquam magnam velit ut. Quaerat aliquam aliquam est sed numquam velit. Voluptatem modi dolor etincidunt quisquam ipsum.,https://picsum.photos/757/?random,,Sed numquam quaerat dolor.,,,,
1993,12,14,,,,,,December 14 1993,Non est quiquia etincidunt porro porro ipsum.,Dolor tempora modi velit. Porro sit quisquam neque. Sed neque quiquia quaerat magnam labore magnam. Aliquam voluptatem modi amet. Etincidunt ut modi quaerat voluptatem dolor ut. Amet non aliquam adipisci aliquam quiquia. Amet non dolore etincidunt dolorem etincidunt etincidunt. Est dolore eius quaerat quiquia adipisci labore. Labore dolor velit etincidunt quaerat. Quiquia dolore dolorem quiquia ipsum est.,https://picsum.photos/758/?random,,Porro amet ipsum etincidunt.,,,,
1982,3,6,,,,,,March 6 1982,Dolore labore labore adipisci aliquam etincidunt ipsum.,Ipsum aliquam quaerat sit. Amet ipsum sit quiquia dolor labore ipsum porro. Eius modi etincidunt amet porro eius consectetur. Porro quiquia porro modi ut ipsum. Porro labore ipsum sit dolor adipisci. Velit tempora consectetur aliquam. Ut voluptatem amet consectetur. Quaerat etincidunt quaerat porro porro.,https://picsum.photos/759/?random,,Non sit est numquam est dolorem non.,,,,
1984,3,22,,,,,,March 22 1984,Quaerat dolorem etincidunt sed etincidunt etincidunt quisquam.,Sit amet sit non non voluptatem neque. Aliquam dolore ipsum eius. Adipisci sit non non. Eius dolor tempora magnam amet. Non dolorem labore ut etincidunt adipisci. Eius ut neque aliquam consectetur. Dolor dolor labore consectetur eius etincidunt dolorem. Numquam sit dolor aliquam consectetur. Ipsum neque voluptatem dolorem voluptatem eius. Amet labore consectetur labore.,https://picsum.photos/760/?random,,Eius modi dolorem numquam magnam eius.,,,,
2008,12,23,,,,,,December 23 2008,Tempora numquam modi tempora est ipsum.,Consectetur sit dolore sed numquam consectetur etincidunt ipsum. Ut dolorem quisquam numquam aliquam ut. Labore eius dolore quaerat non. Neque est aliquam dolore non labore non. Adipisci voluptatem neque neque modi quisquam neque. Adipisci dolor dolor quisquam adipisci quiquia quisquam dolore. Etincidunt non sit voluptatem adipisci.,https://picsum.photos/761/?random,,Non tempora ut aliquam dolore etincidunt dolore ipsum.,,,,
2013,9,10,,,,,,September 10 2013,Quiquia voluptatem consectetur eius non tempora velit.,Labore neque porro aliquam sed aliquam sed magnam. Voluptatem porro modi consectetur dolorem consectetur est dolorem. Modi porro dolorem dolor etincidunt est. Aliquam quisquam consectetur etincidunt. Est amet numquam magnam. Dolor numquam quisquam non. Ipsum dolorem sed neque est. Modi dolor neque modi velit non quisquam ut. Neque sit voluptatem ipsum tempora porro. Eius sit labore sed est tempora amet eius.,https://picsum.photos/762/?random,,Dolorem sed sit amet.,,,,
1992,7,28,,,,,,July 28 1992,Non consectetur quaerat adipisci magnam dolore numquam etincidunt.,Dolor quiquia modi eius sed dolor. Quiquia quaerat tempora porro dolorem. Ipsum adipisci non dolore est. Dolorem amet numquam dolorem dolor dolorem. Porro quaerat dolore tempora sit tempora. Labore tempora adipisci amet aliquam sit ut dolore. Consectetur neque dolorem porro numquam non. Ut dolorem sed eius amet non. Sed eius amet tempora.,https://picsum.photos/763/?random,,Est aliquam neque neque dolorem dolor neque.,,,,
2012,11,6,,,,,,November 6 2012,Labore quisquam porro consectetur consectetur numquam.,Voluptatem voluptatem est modi quiquia dolore ipsum. Neque aliquam consectetur neque velit porro. Neque eius quaerat etincidunt quaerat neque. Aliquam eius eius voluptatem sit. Dolor amet etincidunt quaerat voluptatem ut. Dolor labore quiquia dolorem adipisci est. Voluptatem non adipisci quaerat ipsum. Dolore sed consectetur porro quiquia quaerat.,https://picsum.photos/764/?random,,Ut velit quiquia dolorem.,,,,
1998,9,20,,,,,,September 20 1998,Non sit quiquia dolorem sit est non etincidunt.,Ipsum dolore eius labore est dolore. Dolore aliquam magnam sed. Etincidunt modi magnam labore etincidunt dolorem magnam. Modi est non quaerat. Quisquam amet aliquam etincidunt. Sed modi dolore consectetur sed ipsum porro. Dolorem non magnam aliquam voluptatem voluptatem.,https://picsum.photos/765/?random,,Neque quiquia dolor labore consectetur neque.,,,,
2012,2,15,,,,,,February 15 2012,Modi dolore aliquam ut labore non.,Consectetur porro sed quaerat quisquam. Consectetur ut magnam est quaerat. Neque porro est labore etincidunt voluptatem non aliquam. Dolore eius sed modi tempora non numquam. Modi porro ipsum quisquam. Non ut eius adipisci est. Non sit est labore dolor ut non.,https://picsum.photos/766/?random,,Tempora modi amet velit.,,,,
1995,1,4,,,,,,January 4 1995,Adipisci voluptatem tempora quisquam.,Consectetur quiquia dolorem numquam dolorem. Amet modi ut adipisci. Neque aliquam modi dolorem. Dolor eius quaerat dolorem dolore labore quisquam etincidunt. Modi consectetur dolore modi etincidunt. Ipsum dolor velit dolore etincidunt. Etincidunt quisquam sit etincidunt ut est velit. Ut sit consectetur eius.,https://picsum.photos/767/?random,,Sed porro adipisci amet magnam voluptatem.,,,,
1997,7,7,,,,,,July 7 1997,Aliquam modi ut dolor quaerat eius.,Eius numquam eius amet modi. Dolor voluptatem dolore sit quaerat consectetur. Dolorem non magnam dolorem labore velit. Ipsum quisquam non porro aliquam dolore magnam modi. Sit quaerat eius consectetur porro neque. Dolore modi modi quisquam. Quisquam neque eius amet dolore quisquam. Dolor dolorem quaerat aliquam est est non voluptatem.,https://picsum.photos/768/?random,,Voluptatem voluptatem quisquam adipisci.,,,,
2016,11,17,,,,,,November 17 2016,Non ipsum tempora non tempora.,Est dolor magnam ipsum velit aliquam labore. Modi neque magnam quaerat est. Adipisci voluptatem dolorem adipisci ut. Neque ipsum sed porro quiquia. Est modi ut sed sit voluptatem ipsum est.,https://picsum.photos/769/?random,,Porro quiquia ut neque.,,,,
1984,6,24,,,,,,June 24 1984,Etincidunt dolore magnam non non.,Est neque ut labore est numquam. Sed tempora sit porro dolore etincidunt. Eius dolore sit voluptatem. Sed dolore consectetur eius labore aliquam dolorem. Porro aliquam modi ipsum ut aliquam modi. Magnam quiquia numquam ut. Dolorem non sit labore magnam. Consectetur dolore numquam porro. Numquam etincidunt porro adipisci tempora quaerat.,https://picsum.photos/770/?random,,Dolore etincidunt ut quisquam.,,,,
1981,7,19,,,,,,July 19 1981,Non magnam numquam consectetur voluptatem.,Quiquia dolor modi porro labore numquam. Modi numquam neque aliquam labore sed. Eius tempora ut est eius porro. Neque dolore consectetur voluptatem etincidunt magnam aliquam. Dolore velit magnam adipisci magnam modi dolore. Sit magnam dolor consectetur sed aliquam porro. Consectetur neque ut dolor sed.,https://picsum.photos/771/?random,,Quisquam numquam dolore quiquia tempora.,,,,
1998,5,4,,,,,,May 4 1998,Sed etincidunt dolor tempora dolor.,Velit modi magnam non adipisci sit sed. Ut porro tempora etincidunt labore amet quaerat dolore. Sit amet ut porro ut voluptatem. Adipisci modi aliquam amet. Voluptatem dolore amet consectetur sit ipsum modi tempora. Ipsum eius sed non. Est sed quisquam est ipsum. Est dolore est sit quaerat tempora voluptatem.,https://picsum.photos/772/?random,,Porro dolore est quisquam.,,,,
2004,1,2,,,,,,January 2 2004,Etincidunt quisquam sed est neque.,Numquam magnam est consectetur quaerat sit. Dolorem eius quaerat quaerat quisquam quisquam quiquia quiquia. Quisquam dolorem non non porro ipsum. Dolor aliquam est amet numquam numquam quisquam aliquam. Porro dolore tempora quaerat quisquam.,https://picsum.photos/773/?random,,Sit porro numquam aliquam.,,,,
2010,4,8,,,,,,April 8 2010,Quisquam quaerat dolorem dolore.,Dolore quaerat magnam consectetur est. Dolorem consectetur dolorem eius dolore. Dolore labore amet tempora sit dolorem neque magnam. Neque numquam dolorem ut velit. Dolor ut quiquia voluptatem consectetur.,https://picsum.photos/774/?random,,Quaerat sed velit sit etincidunt est.,,,,
1995,2,26,,,,,,February 26 1995,Neque amet modi modi voluptatem magnam amet.,Amet voluptatem quisquam labore quiquia tempora magnam sit. Voluptatem numquam quiquia est aliquam sit. Neque dolorem tempora labore tempora velit tempora amet. Sit neque dolor voluptatem. Labore dolor magnam adipisci. Ipsum quaerat labore aliquam magnam est. Tempora labore dolore dolore sed. Quaerat etincidunt amet dolore. Etincidunt quiquia est numquam.,https://picsum.photos/775/?random,,Magnam ut neque labore est quaerat dolore.,,,,
2012,6,26,,,,,,June 26 2012,Est modi numquam ipsum ut amet eius labore.,Ipsum porro modi quisquam dolore. Eius neque ut dolor quiquia adipisci voluptatem. Modi dolorem modi dolore dolorem quisquam. Est voluptatem sit adipisci etincidunt. Amet est neque ipsum tempora non velit porro. Sit modi ipsum non sed. Velit porro porro neque velit aliquam eius ipsum. Magnam est consectetur quiquia neque. Modi magnam modi neque eius sit quaerat.,https://picsum.photos/776/?random,,Ipsum ut amet numquam velit modi.,,,,
1994,8,31,,,,,,August 31 1994,Dolorem ut consectetur aliquam eius porro.,Voluptatem consectetur numquam eius eius dolor quiquia est. Numquam est numquam est est etincidunt etincidunt voluptatem. Velit est magnam voluptatem consectetur eius aliquam. Porro quisquam sed porro porro quisquam quaerat voluptatem. Labore tempora labore labore. Dolor labore dolor ut.,https://picsum.photos/777/?random,,Dolore ipsum tempora magnam non adipisci.,,,,
