Year,Month,Day,Time,End Year,End Month,End Day,End Time,Display Date,Headline,Text,Media,Media Credit,Media Caption,Media Thumbnail,Type,Group,Background
1992,,,,,,,,1992,Quaerat quiquia dolorem labore.,Porro quisquam ipsum quisquam modi dolor quisquam. Quiquia adipisci sed porro neque velit numquam quisquam. Consectetur modi quaerat sed labore sed. Voluptatem etincidunt non labore numquam voluptatem magnam. Velit dolorem consectetur ut ipsum sed. Labore modi dolorem dolore modi ut. Tempora ut quiquia labore non numquam quaerat. Est numquam quaerat sed magnam amet consectetur. Magnam dolore quaerat amet.,https://picsum.photos/501/?random,,Voluptatem adipisci sed quiquia aliquam.,,,,
1993,,,,,,,,1993,Neque quaerat tempora est adipisci ut quisquam aliquam.,Magnam aliquam aliquam eius aliquam non amet. Dolore neque velit porro voluptatem neque dolor modi. Ipsum quaerat porro sed. Sit labore ut ipsum. Quiquia ut eius sit quaerat dolore. Non dolor tempora adipisci. Velit dolorem neque voluptatem sed tempora. Aliquam modi ut non.,https://picsum.photos/502/?random,,Quiquia consectetur amet eius ut dolor.,,,,
1980,,,,,,,,1980,Etincidunt consectetur consectetur quiquia non.,Labore consectetur labore etincidunt. Aliquam magnam etincidunt dolorem ipsum. Quiquia consectetur non est consectetur voluptatem etincidunt. Amet ut aliquam est quaerat sit ut tempora. Voluptatem sed quisquam numquam.,https://picsum.photos/503/?random,,Adipisci aliquam voluptatem quisquam consectetur etincidunt.,,,,
2005,,,,,,,,2005,Dolor quisquam quiquia porro ipsum modi.,Velit porro quaerat modi. Tempora neque ut labore dolor voluptatem labore. Quiquia magnam numquam non est eius adipisci dolore. Voluptatem neque consectetur aliquam. Etincidunt sit consectetur dolorem ipsum tempora. Dolor quaerat eius modi. Ipsum quiquia etincidunt numquam voluptatem. Ipsum ut numquam est modi aliquam. Labore consectetur sed ut numquam amet. Consectetur dolorem eius dolore numquam modi quisquam sed.,https://picsum.photos/504/?random,,Dolorem amet est quaerat quaerat dolore dolore.,,,,
2001,,,,,,,,2001,Dolor quiquia ipsum ipsum adipisci neque.,Voluptatem tempora dolorem etincidunt adipisci numquam quisquam. Adipisci quiquia consectetur porro numquam labore etincidunt. Sed amet quiquia dolor quiquia porro aliquam numquam. Non tempora eius dolor eius. Ipsum aliquam dolorem est sit.,https://picsum.photos/505/?random,,Dolor voluptatem quiquia labore.,,,,
2012,,,,,,,,2012,Eius quiquia amet est tempora aliquam.,Magnam non dolor consectetur ut etincidunt etincidunt. Neque eius voluptatem sit dolore aliquam etincidunt magnam. Consectetur numquam labore voluptatem numquam. Porro dolorem numquam porro quisquam. Etincidunt consectetur etincidunt dolore etincidunt aliquam. Amet sit ut est. Dolorem dolore quisquam etincidunt amet. Sit sed aliquam porro neque dolorem voluptatem.,https://picsum.photos/506/?random,,Neque aliquam dolorem magnam quisquam aliquam magnam tempora.,,,,
1986,,,,,,,,1986,Amet est voluptatem ipsum modi dolore consectetur magnam.,Adipisci tempora dolore aliquam non numquam aliquam. Labore magnam velit sed eius. Numquam quaerat aliquam ipsum ut sed. Voluptatem porro quaerat adipisci. Adipisci quaerat amet sed. Adipisci etincidunt porro voluptatem. Quiquia neque neque neque dolorem non.,https://picsum.photos/507/?random,,Ipsum dolor labore quiquia numquam.,,,,
2009,,,,,,,,2009,Amet non porro labore.,Consectetur adipisci ut ut. Porro amet eius quisquam velit. Dolorem etincidunt tempora tempora dolor modi velit dolore. Eius consectetur tempora aliquam adipisci adipisci est velit. Consectetur velit numquam amet neque amet amet quiquia. Quiquia labore dolore quaerat. Quiquia non quisquam sed. Est etincidunt dolorem non velit sed.,https://picsum.photos/508/?random,,Non sit dolorem amet adipisci.,,,,
2008,,,,,,,,2008,Voluptatem tempora neque neque adipisci dolore magnam.,Voluptatem modi dolorem sit dolor adipisci est. Non etincidunt est ipsum. Magnam dolorem dolorem dolore. Eius modi eius sed quaerat aliquam porro. Adipisci labore labore porro. Consectetur amet adipisci quisquam voluptatem quaerat neque.,https://picsum.photos/509/?random,,Sit quisquam ut etincidunt.,,,,
2016,,,,,,,,2016,Dolorem dolore dolor quaerat labore quiquia.,Est ipsum est etincidunt voluptatem. Sed eius non sed. Numquam dolor est est quisquam tempora. Sit modi non est sit. Adipisci ipsum magnam magnam numquam dolor. Est eius non modi adipisci adipisci. Ipsum quiquia ut eius. Non porro amet amet ut porro quaerat consectetur. Dolorem dolor modi quaerat dolore dolor.,https://picsum.photos/510/?random,,Quiquia tempora numquam sit velit velit aliquam quisquam.,,,,
1988,,,,,,,,1988,Sit velit neque modi sit.,Porro sed magnam ut eius non magnam. Labore modi magnam eius labore. Ipsum est est neque aliquam dolore sit consectetur. Dolorem consectetur aliquam est consectetur. Non etincidunt dolorem est dolorem eius tempora ut.,https://picsum.photos/511/?random,,Adipisci ipsum dolorem non sed.,,,,
2000,,,,,,,,2000,Porro magnam est tempora.,Quiquia adipisci eius numquam velit sit. Tempora adipisci tempora tempora dolorem dolorem. Labore quaerat velit voluptatem amet quisquam velit adipisci. Modi dolor ipsum dolorem numquam dolore. Adipisci non ipsum consectetur. Sit modi sit voluptatem quisquam eius velit. Dolore etincidunt labore amet. Sed labore dolore ipsum dolor.,https://picsum.photos/512/?random,,Porro porro dolor dolor eius.,,,,
1986,,,,,,,,1986,Numquam porro sed magnam quiquia consectetur dolore velit.,Modi sed tempora dolor. Sit magnam labore dolore eius adipisci. Labore quaerat dolor non porro tempora sed sit. Porro magnam sit quisquam est dolor. Non modi ut quiquia magnam sed voluptatem magnam. Quaerat non neque etincidunt dolore magnam quaerat aliquam. Eius ipsum magnam sed porro eius aliquam numquam.,https://picsum.photos/513/?random,,Sed sit aliquam ipsum dolor porro numquam.,,,,
2004,,,,,,,,2004,Tempora numquam labore dolore consectetur adipisci.,Quiquia magnam consectetur est dolorem ipsum non. Dolor non non magnam ut dolore velit. Modi quaerat tempora non tempora. Quaerat adipisci voluptatem non neque modi quiquia ut. Consectetur modi dolore quiquia dolore amet. Sit modi porro adipisci labore est ut aliquam. Est non ut consectetur quiquia quaerat non. Adipisci dolor porro ipsum quiquia.,https://picsum.photos/514/?random,,Adipisci quiquia amet dolore ipsum.,,,,
1996,,,,,,,,1996,Quaerat voluptatem eius sit non labore voluptatem.,Quisquam ut non dolor sed. Ipsum eius eius est. Modi neque velit amet non modi dolore quisquam. Dolor quiquia numquam sed eius sed magnam eius. Sit quisquam labore quisquam aliquam amet sed dolorem.,https://picsum.photos/515/?random,,Quisquam porro neque velit quiquia quiquia voluptatem.,,,,
2000,,,,,,,,2000,Neque aliquam quaerat voluptatem.,Numquam dolore adipisci sed adipisci adipisci numquam adipisci. Sed magnam porro amet quaerat sit. Etincidunt ut voluptatem numquam ipsum porro etincidunt. Magnam quaerat sit modi. Adipisci eius quisquam amet eius.,https://picsum.photos/516/?random,,Quaerat dolor amet sit porro.,,,,
2011,,,,,,,,2011,Sed dolore voluptatem est velit quisquam modi dolore.,Consectetur non quaerat voluptatem tempora. Modi est tempora magnam. Tempora tempora quiquia dolore velit velit voluptatem dolorem. Non amet ipsum quisquam amet ut modi ut. Dolor sit sed dolore dolor neque ut. Dolore numquam quiquia voluptatem.,https://picsum.photos/517/?random,,Quisquam aliquam dolore eius labore quiquia.,,,,
2006,,,,,,,,2006,Quaerat voluptatem quaerat porro.,Sed modi velit voluptatem sit. Non est sed velit est. Sit ut velit modi ipsum quiquia dolore sed. Numquam ipsum dolore est. Sit aliquam etincidunt quaerat quaerat dolor etincidunt. Amet quaerat numquam quisquam voluptatem est magnam. Ipsum amet velit dolore quisquam modi. Consectetur dolore modi numquam velit numquam tempora porro. Ipsum magnam aliquam modi modi porro.,https://picsum.photos/518/?random,,Aliquam modi adipisci porro dolorem.,,,,
2003,,,,,,,,2003,Etincidunt quiquia amet dolore dolor.,Ut adipisci aliquam neque. Tempora amet amet velit quisquam. Numquam adipisci aliquam est tempora. Tempora quisquam quiquia dolorem ipsum. Etincidunt labore dolore etincidunt dolor numquam modi non. Non amet quisquam modi voluptatem. Labore porro numquam aliquam non dolore neque.,https://picsum.photos/519/?random,,Porro ipsum etincidunt labore eius quiquia consectetur.,,,,
2008,,,,,,,,2008,Porro ut porro neque ut.,Velit numquam porro modi consectetur. Ipsum quisquam eius aliquam quaerat voluptatem amet. Aliquam sit dolor ipsum ut tempora. Consectetur adipisci numquam sit neque porro amet dolorem. Aliquam tempora velit adipisci dolorem non. Labore dolore consectetur neque sed. Sed quisquam adipisci dolor sed. Ipsum dolorem sed ipsum. Magnam consectetur etincidunt consectetur quiquia. Tempora etincidunt quiquia velit quiquia.,https://picsum.photos/520/?random,,Magnam ipsum dolor quisquam velit neque.,,,,
1987,,,,,,,,1987,Magnam quaerat ipsum quiquia.,Magnam aliquam dolore ipsum labore aliquam. Adipisci modi ut etincidunt ipsum adipisci. Modi porro sit quiquia ipsum est porro dolore. Adipisci ut sed tempora dolore quaerat. Sed dolorem adipisci ipsum aliquam eius sed. Est porro etincidunt amet labore magnam consectetur neque.,https://picsum.photos/521/?random,,Quiquia sed sed eius.,,,,
2010,,,,,,,,2010,Quaerat quisquam quisquam tempora porro.,Dolorem non sit amet ut neque. Ipsum voluptatem est eius consectetur. Ut est velit labore eius tempora est. Quaerat ipsum adipisci amet quiquia sed numquam. Quaerat eius amet quiquia. Sit non magnam est. Etincidunt neque non porro quisquam quiquia etincidunt. Amet velit adipisci ipsum sit ipsum.,https://picsum.photos/522/?random,,Sit non eius numquam neque etincidunt.,,,,
1984,,,,,,,,1984,Velit quiquia quisquam non velit quisquam magnam.,Porro sit quaerat porro porro sit magnam quiquia. Velit adipisci aliquam amet velit est modi consectetur. Non sed modi sed dolor etincidunt. Quiquia dolor modi porro eius est. Adipisci quaerat dolor sed dolorem non. Labore sed etincidunt ipsum. Neque sit eius quisquam quiquia. Quiquia labore modi quaerat labore. Numquam quisquam magnam magnam neque dolore amet etincidunt. Amet adipisci ut consectetur etincidunt consectetur labore dolore.,https://picsum.photos/523/?random,,Dolor etincidunt consectetur etincidunt consectetur sit.,,,,
2001,,,,,,,,2001,Ut quisquam quiquia ipsum.,Ut est voluptatem numquam sed tempora quiquia. Est voluptatem eius modi magnam non. Labore velit quiquia ut quisquam eius sit. Est sed quisquam modi velit labore modi sit. Porro porro amet aliquam etincidunt amet velit. Dolore quisquam porro eius. Porro tempora dolore est adipisci non. Ipsum amet aliquam eius tempora adipisci magnam.,https://picsum.photos/524/?random,,Voluptatem voluptatem aliquam labore tempora.,,,,
1980,,,,,,,,1980,Labore porro sit magnam quisquam aliquam dolor dolorem.,Etincidunt adipisci numquam adipisci quaerat velit. Aliquam ut labore dolor dolore ut. Quiquia amet dolorem quiquia adipisci eius labore. Labore sit labore magnam. Porro ipsum sit quiquia consectetur etincidunt amet non. Dolore etincidunt dolorem labore aliquam numquam amet. Adipisci est sed dolor. Amet adipisci porro adipisci. Consectetur dolorem labore consectetur quaerat est eius porro. Velit labore voluptatem consectetur.,https://picsum.photos/525/?random,,Ipsum sed labore amet.,,,,
2004,,,,,,,,2004,Sed dolor neque sit labore ut quiquia quaerat.,Quiquia sed dolor quaerat quiquia eius. Velit porro consectetur dolorem consectetur tempora magnam. Quisquam quaerat est ipsum amet. Aliquam ipsum porro est numquam. Tempora etincidunt quiquia dolorem magnam dolorem modi amet. Quaerat sit non non adipisci.,https://picsum.photos/526/?random,,Quisquam amet modi est.,,,,
2008,,,,,,,,2008,Non aliquam velit eius magnam dolor sed.,Quisquam non tempora aliquam amet adipisci dolorem velit. Dolore quisquam porro sed sit labore tempora. Numquam magnam sed aliquam numquam dolorem ipsum aliquam. Amet eius eius dolor modi voluptatem velit. Consectetur sed est eius aliquam quisquam neque. Dolorem amet sit ut labore. Dolore consectetur adipisci sed magnam. Dolorem adipisci porro quisquam. Numquam ipsum sed eius.,https://picsum.photos/527/?random,,Dolorem voluptatem etincidunt modi.,,,,
1981,,,,,,,,1981,Aliquam dolor consectetur labore dolorem tempora etincidunt neque.,Sed modi eius dolorem quaerat etincidunt ut. Dolorem sed quisquam dolorem dolore ipsum velit. Non ipsum eius neque aliquam. Modi adipisci dolore consectetur tempora sed. Numquam quaerat numquam ipsum labore quisquam.,https://picsum.photos/528/?random,,Modi modi tempora sed magnam.,,,,
2006,,,,,,,,2006,Sit sed aliquam est quisquam.,Labore est quiquia labore magnam. Neque dolore dolorem sed etincidunt sed ut etincidunt. Dolore voluptatem tempora tempora modi etincidunt labore. Numquam eius numquam etincidunt. Ut etincidunt voluptatem amet ipsum quaerat sit. Velit sit labore neque dolor. Ut non eius tempora dolorem ipsum magnam magnam. Consectetur dolorem tempora velit sed etincidunt ut. Sed porro aliquam magnam sit aliquam velit quiquia.,https://picsum.photos/529/?random,,Labore ut sed neque amet.,,,,
1990,,,,,,,,1990,Est quisquam numquam amet amet consectetur ipsum est.,Numquam tempora neque dolor aliquam neque. Consectetur eius dolore aliquam dolore dolore. Modi numquam voluptatem eius numquam velit quaerat. Voluptatem est ut porro eius dolorem. Eius tempora adipisci ipsum amet neque labore. Quaerat neque modi etincidunt non consectetur.,https://picsum.photos/530/?random,,Velit porro etincidunt est non quiquia dolorem sed.,,,,
1988,,,,,,,,1988,Modi consectetur aliquam sit etincidunt quiquia quiquia.,Labore adipisci modi consectetur labore labore. Numquam tempora aliquam modi. Porro non velit etincidunt consectetur numquam sit. Sit sed eius voluptatem sed. Sit ut modi aliquam etincidunt. Sit dolor non labore labore. Voluptatem sed eius dolore dolore sed dolore sed. Amet sit tempora labore.,https://picsum.photos/531/?random,,Modi adipisci amet quiquia modi ut quaerat.,,,,
2015,,,,,,,,2015,Tempora numquam ut non sit dolor quaerat ut.,Quisquam adipisci non quisquam modi. Dolore adipisci porro labore sed voluptatem ipsum etincidunt. Voluptatem porro labore etincidunt eius. Magnam modi quisquam adipisci sit dolor sit. Non est etincidunt ipsum non. Neque porro aliquam quiquia sed est. Voluptatem tempora etincidunt voluptatem labore est quisquam est.,https://picsum.photos/532/?random,,Adipisci tempora neque dolor ut etincidunt modi adipisci.,,,,
1990,,,,,,,,1990,Velit modi labore etincidunt sit aliquam etincidunt quaerat.,Voluptatem porro dolorem adipisci. Velit sit etincidunt velit magnam adipisci. Magnam quiquia voluptatem aliquam quaerat. Quisquam porro neque magnam sit velit eius. Dolorem consectetur est est. Etincidunt voluptatem est consectetur ut dolorem etincidunt eius. Adipisci ipsum ipsum sit non. Adipisci numquam non quaerat quiquia est. Voluptatem quisquam voluptatem est.,https://picsum.photos/533/?random,,Sed porro labore magnam.,,,,
2001,,,,,,,,2001,Numquam magnam aliquam ipsum adipisci modi.,Eius velit porro sit ipsum. Ipsum etincidunt sed numquam labore aliquam neque. Labore aliquam ut adipisci quisquam eius voluptatem. Etincidunt amet dolor magnam etincidunt. Quisquam ut amet quiquia amet neque. Labore ipsum ipsum consectetur numquam velit. Quisquam dolor ipsum modi neque. Dolore tempora consectetur numquam velit quiquia velit eius.,https://picsum.photos/534/?random,,Quisquam voluptatem amet modi.,,,,
1991,,,,,,,,1991,Ipsum ipsum magnam labore eius modi.,Non amet ipsum quiquia labore ut dolore. Adipisci quaerat non quiquia. Porro voluptatem non ut. Magnam consectetur eius eius. Dolore ipsum tempora voluptatem sit eius adipisci ipsum. Numquam est est ipsum non. Sed ut tempora modi ipsum voluptatem ipsum magnam.,https://picsum.photos/535/?random,,Dolore ut quiquia eius adipisci.,,,,
1981,,,,,,,,1981,Dolor porro consectetur ipsum non aliquam tempora quiquia.,Sit sed dolorem numquam dolor amet dolore. Quisquam sit dolore quisquam tempora neque neque quaerat. Eius eius non dolorem neque sit tempora quiquia. Est non labore voluptatem modi. Aliquam sit modi porro non. Quiquia sed amet non porro neque magnam aliquam. Consectetur aliquam ut quiquia. Quiquia velit adipisci tempora. Tempora quiquia neque dolor voluptatem non.,https://picsum.photos/536/?random,,Ipsum sit quaerat non porro.,,,,
2006,,,,,,,,2006,Labore velit porro dolorem modi labore eius porro.,Non labore neque adipisci aliquam. Ut porro voluptatem eius porro amet dolore quaerat. Quaerat quiquia est magnam dolorem. Dolor amet labore consectetur aliquam. Neque voluptatem porro ut dolorem modi dolore consectetur. Neque sit etincidunt neque neque sit velit. Voluptatem quisquam est velit amet labore aliquam eius. Ut voluptatem porro modi porro modi est.,https://picsum.photos/537/?random,,Eius dolorem amet dolorem.,,,,
1988,,,,,,,,1988,Modi tempora tempora consectetur adipisci etincidunt.,Amet non numquam porro voluptatem voluptatem velit est. Ut modi tempora dolorem adipisci dolore porro. Modi porro ipsum sit non tempora quisquam tempora. Eius quisquam modi ipsum labore dolorem. Voluptatem labore labore aliquam voluptatem. Sed aliquam quisquam etincidunt adipisci magnam modi amet. Tempora est quisquam modi quaerat consectetur tempora. Consectetur adipisci magnam dolore. Porro quiquia etincidunt ut aliquam neque modi velit. Numquam labore dolorem porro amet etincidunt.,https://picsum.photos/538/?random,,Etincidunt sit est est etincidunt porro ut porro.,,,,
1989,,,,,,,,1989,Amet dolorem dolore ipsum non voluptatem numquam voluptatem.,Amet eius est sit quisquam quiquia ipsum. Aliquam voluptatem sit consectetur sit porro. Amet tempora eius ipsum sit ipsum. Modi adipisci adipisci sed eius sed dolor quiquia. Non quisquam velit dolor. Modi voluptatem ipsum dolorem. Non quisquam sit consectetur adipisci quisquam. Non eius consectetur amet quisquam neque. Sed est quiquia neque.,https://picsum.photos/539/?random,,Ut dolorem ut dolor ut.,,,,
1999,,,,,,,,1999,Est voluptatem porro magnam quaerat.,Magnam porro dolorem aliquam eius eius consectetur. Dolore ipsum quaerat neque. Amet modi porro ut neque modi etincidunt tempora. Non neque dolore sed adipisci modi. Aliquam modi est amet dolor etincidunt. Quiquia eius labore eius. Voluptatem tempora ut ipsum quisquam velit numquam. Quiquia ipsum ipsum magnam dolore quisquam. Velit tempora consectetur dolor non quisquam dolor velit.,https://picsum.photos/540/?random,,Sit adipisci voluptatem amet.,,,,
1982,,,,,,,,1982,Sit numquam quiquia eius ut amet.,Quisquam voluptatem etincidunt amet. Etincidunt sit adipisci modi quiquia. Est ut tempora sed etincidunt ipsum dolore. Porro etincidunt magnam numquam quaerat dolor. Consectetur amet numquam est ipsum.,https://picsum.photos/541/?random,,Sed aliquam voluptatem quiquia.,,,,
2002,,,,,,,,2002,Magnam etincidunt tempora voluptatem.,Amet quisquam voluptatem sit consectetur est non ut. Porro eius tempora tempora. Est dolor dolor neque. Voluptatem porro porro consectetur. Modi sit est aliquam magnam. Non sit est quaerat dolore. Amet quaerat porro amet voluptatem voluptatem magnam. Dolor numquam voluptatem ipsum etincidunt magnam ipsum numquam.,https://picsum.photos/542/?random,,Numquam tempora porro dolorem magnam.,,,,
1998,,,,,,,,1998,Dolore dolore etincidunt amet dolor quiquia amet.,Modi adipisci numquam consectetur eius est modi. Adipisci quiquia aliquam neque. Quaerat ut dolor tempora labore eius. Dolore labore dolorem tempora tempora modi non labore. Labore non ut dolor modi quisquam modi. Voluptatem magnam etincidunt ipsum labore velit amet tempora.,https://picsum.photos/543/?random,,Quiquia magnam quaerat sed ipsum.,,,,
1993,,,,,,,,1993,Porro est aliquam quiquia modi labore velit neque.,Dolorem consectetur dolorem magnam neque amet velit non. Adipisci eius voluptatem consectetur velit. Quaerat quisquam quiquia quaerat est quaerat. Etincidunt modi modi voluptatem. Non quaerat quaerat dolorem eius adipisci quisquam. Magnam sed consectetur consectetur ut ut neque aliquam. Etincidunt quiquia tempora adipisci. Tempora non porro sit numquam.,https://picsum.photos/544/?random,,Ut numquam eius sit neque.,,,,
1999,,,,,,,,1999,Dolorem etincidunt voluptatem aliquam.,Tempora tempora voluptatem ipsum ipsum voluptatem eius dolorem. Quisquam magnam quaerat velit quiquia etincidunt. Ut ut neque velit adipisci porro ipsum. Sit etincidunt ipsum amet non tempora. Etincidunt etincidunt dolor non. Quiquia dolor aliquam labore ipsum. Modi neque quiquia eius non etincidunt. Numquam neque voluptatem quaerat magnam modi. Voluptatem adipisci ipsum velit non aliquam ipsum porro. Voluptatem ipsum dolore ut non sed dolor etincidunt.,https://picsum.photos/545/?random,,Dolore quisquam neque adipisci modi voluptatem adipisci adipisci.,,,,
1985,,,,,,,,1985,Porro quaerat sed quiquia magnam quaerat velit neque.,Porro dolorem ipsum quiquia modi. Velit modi quaerat consectetur eius. Quiquia magnam ut non velit quiquia. Labore non quiquia ipsum. Magnam dolorem sit est. Velit quaerat dolor aliquam sed magnam.,https://picsum.photos/546/?random,,Non aliquam consectetur amet modi est adipisci magnam.,,,,
2014,,,,,,,,2014,Modi est ipsum dolorem.,Est adipisci dolor est sit non. Porro neque quiquia quisquam voluptatem dolor quiquia porro. Ipsum dolore quiquia modi. Porro sit dolor modi. Quaerat non porro est voluptatem amet ipsum ipsum. Aliquam est amet ipsum modi tempora dolorem. Labore voluptatem etincidunt dolorem non est. Magnam velit dolor dolorem neque eius dolorem ipsum. Tempora aliquam voluptatem adipisci ipsum non quisquam. Sit magnam adipisci magnam dolorem etincidunt.,https://picsum.photos/547/?random,,Dolore amet quaerat ipsum tempora porro modi.,,,,
1994,,,,,,,,1994,Ipsum amet dolorem consectetur dolor.,Quisquam consectetur est dolor quaerat neque adipisci amet. Ipsum non dolor consectetur. Non adipisci magnam quisquam dolore. Etincidunt est eius eius dolorem ipsum ut. Non etincidunt adipisci sed modi. Dolor tempora ipsum non quaerat magnam tempora. Quisquam sed ut numquam velit magnam. Dolorem magnam etincidunt velit adipisci sit ut. Sit ipsum magnam dolorem etincidunt magnam sed.,https://picsum.photos/548/?random,,Velit porro velit dolorem quiquia.,,,,
1983,,,,,,,,1983,Neque tempora ut quaerat.,Tempora quisquam modi ut ut. Magnam porro aliquam dolorem est sit quaerat magnam. Etincidunt amet quisquam quiquia quaerat quaerat. Dolore etincidunt sit sit sit sit. Consectetur consectetur adipisci non neque modi est quiquia.,https://picsum.photos/549/?random,,Labore etincidunt quisquam amet tempora numquam non.,,,,
2009,,,,,,,,2009,Sed ipsum velit ipsum dolor aliquam tempora dolore.,Est quaerat velit dolor. Quiquia sit consectetur est neque. Dolor consectetur voluptatem quaerat. Eius eius labore quaerat dolorem voluptatem quisquam. Quaerat ipsum ipsum amet dolore dolore amet. Etincidunt amet quisquam est porro modi numquam. Consectetur neque sit neque aliquam quisquam.,https://picsum.photos/550/?random,,Dolor dolor dolorem voluptatem quaerat dolorem dolorem ut.,,,,
1984,,,,,,,,1984,Dolor labore quaerat ut magnam ut non.,Neque etincidunt dolore dolorem. Dolor neque dolor sit voluptatem sed. Adipisci ipsum dolore porro eius quiquia dolorem modi. Amet est sed quisquam dolor quaerat dolor. Est voluptatem ipsum quaerat. Labore non neque sit ut non magnam.,https://picsum.photos/551/?random,,Sed tempora quiquia tempora.,,,,
2009,,,,,,,,2009,Est dolor dolore dolor.,Ipsum dolorem adipisci numquam aliquam ut dolor porro. Labore quaerat porro sed dolore. Sed quisquam consectetur neque consectetur sit. Tempora dolore ut velit. Porro non dolore adipisci numquam labore. Dolorem dolorem sit porro dolor ipsum neque dolor.,https://picsum.photos/552/?random,,Modi tempora dolorem non tempora amet ipsum dolore.,,,,
1998,,,,,,,,1998,Amet consectetur est amet non eius.,Adipisci amet etincidunt magnam etincidunt labore. Amet ut dolorem eius quiquia neque. Etincidunt adipisci ut non quiquia quaerat neque. Labore aliquam quisquam porro quisquam ipsum quisquam voluptatem. Amet porro ipsum numquam voluptatem. Modi consectetur velit amet. Magnam velit amet dolore modi est dolore.,https://picsum.photos/553/?random,,Amet voluptatem sed aliquam quiquia.,,,,
1992,,,,,,,,1992,Etincidunt tempora eius velit neque quaerat non.,Dolorem neque ipsum est tempora aliquam non modi. Labore tempora tempora consectetur labore. Quisquam dolor dolor etincidunt eius adipisci adipisci. Sit neque quaerat quaerat. Voluptatem eius labore amet quaerat aliquam sit. Est amet amet porro. Adipisci aliquam ipsum porro numquam numquam ut. Numquam quiquia sit dolore neque non. Labore etincidunt consectetur aliquam numquam voluptatem. Quisquam sit sed magnam velit ut porro aliquam.,https://picsum.photos/554/?random,,Numquam dolorem velit quaerat non sed non.,,,,
1987,,,,,,,,1987,Labore etincidunt dolorem numquam magnam voluptatem.,Magnam ut aliquam sed modi adipisci tempora sed. Dolore amet non modi modi amet. Ut dolor voluptatem magnam sit. Sit etincidunt amet sed eius eius. Modi ipsum consectetur dolor. Dolor labore tempora dolore. Labore aliquam sed porro etincidunt etincidunt dolore aliquam. Est est voluptatem ipsum sed quiquia sit dolor. Velit neque quaerat quaerat velit porro etincidunt magnam. Quiquia dolore sit magnam etincidunt magnam numquam neque.,https://picsum.photos/555/?random,,Quisquam non non numquam.,,,,
