Year,Month,Day,Time,End Year,End Month,End Day,End Time,Display Date,Headline,Text,Media,Media Credit,Media Caption,Media Thumbnail,Type,Group,Background
1983,1,,,,,,,January 1983,Quisquam porro amet est amet.,Sit tempora amet porro quaerat sit dolorem. Voluptatem voluptatem neque sed modi consectetur quisquam. Sit modi etincidunt modi modi quisquam dolorem. Neque ipsum est etincidunt numquam dolor quaerat. Tempora velit tempora ipsum amet ipsum tempora labore.,https://picsum.photos/449/?random,,Amet numquam consectetur dolor.,,,,
1985,1,,,,,,,January 1985,Dolor labore etincidunt ut numquam modi quaerat amet.,Dolor magnam dolorem dolore quiquia aliquam dolore eius. Tempora numquam quaerat numquam eius. Voluptatem velit porro amet. Porro velit modi est non voluptatem numquam. Quaerat quaerat labore modi est aliquam ipsum ipsum.,https://picsum.photos/450/?random,,Eius sit dolorem magnam labore dolore non numquam.,,,,
2018,2,,,,,,,February 2018,Etincidunt sed etincidunt velit amet magnam aliquam.,Quiquia neque velit velit. Labore etincidunt non eius sit quiquia voluptatem consectetur. Dolorem est dolore dolorem eius velit ut. Porro sed voluptatem est. Voluptatem modi quiquia quiquia eius voluptatem tempora.,https://picsum.photos/451/?random,,Ut dolorem non est magnam est.,,,,
2014,10,,,,,,,October 2014,Modi dolor etincidunt quiquia.,Ipsum neque eius amet dolore magnam est. Dolorem ipsum est quisquam quiquia. Modi adipisci quiquia modi labore ut magnam. Modi ipsum aliquam consectetur ipsum modi numquam. Aliquam dolorem ut etincidunt voluptatem ipsum porro.,https://picsum.photos/452/?random,,Ipsum ipsum eius numquam.,,,,
2007,4,,,,,,,April 2007,Eius modi tempora etincidunt voluptatem.,Quiquia dolore aliquam aliquam voluptatem numquam tempora. Magnam dolorem ipsum porro quaerat. Magnam adipisci dolor etincidunt aliquam dolorem sed. Eius adipisci porro ipsum est. Neque dolor porro voluptatem quisquam non etincidunt. Modi numquam magnam voluptatem amet quiquia est. Ut ut quisquam modi porro tempora. Non consectetur consectetur neque voluptatem labore ipsum magnam. Modi numquam aliquam eius dolor eius porro dolore.,https://picsum.photos/453/?random,,Est aliquam dolorem quaerat eius porro labore non.,,,,
2008,5,,,,,,,May 2008,Aliquam dolor dolor numquam modi adipisci non.,Labore numquam sit labore porro eius. Velit neque velit ut. Voluptatem voluptatem sed quaerat. Amet quiquia dolorem dolore magnam est sit. Dolor dolor ipsum dolor sed sed voluptatem dolor.,https://picsum.photos/454/?random,,Ut quisquam amet dolorem dolorem sed.,,,,
1980,7,,,,,,,July 1980,Labore numquam dolorem dolore etincidunt dolorem.,Magnam ut consectetur etincidunt velit aliquam. Ipsum quaerat tempora quiquia quisquam. Aliquam porro numquam consectetur. Non adipisci quiquia consectetur quaerat etincidunt. Neque aliquam neque sed etincidunt amet aliquam quisquam. Aliquam aliquam velit dolore. Quiquia velit etincidunt dolor velit ut. Ipsum quiquia porro non numquam. Labore ut ipsum eius adipisci ipsum.,https://picsum.photos/455/?random,,Dolore aliquam modi dolorem etincidunt.,,,,
2010,4,,,,,,,April 2010,Dolorem aliquam eius dolor quaerat sit voluptatem.,Ut sit sed labore. Quaerat dolor dolorem tempora sit aliquam quaerat. Dolorem modi quaerat quaerat dolore tempora. Neque amet dolor adipisci etincidunt quaerat. Consectetur magnam velit amet ut. Est velit voluptatem velit. Consectetur dolor tempora tempora adipisci consectetur. Voluptatem eius dolor voluptatem est est neque.,https://picsum.photos/456/?random,,Velit modi dolore ut.,,,,
2014,6,,,,,,,June 2014,Velit dolor est sit neque.,Amet quaerat magnam aliquam aliquam adipisci velit. Consectetur sed porro quaerat. Adipisci consectetur aliquam numquam velit ut non velit. Quaerat velit eius dolor numquam. Dolorem consectetur eius consectetur quaerat est velit labore. Aliquam ipsum neque numquam magnam sit sit dolorem. Quiquia consectetur voluptatem modi quiquia est. Quiquia quaerat ipsum labore amet eius etincidunt. Quiquia dolore quaerat quiquia etincidunt quaerat non neque. Est magnam modi dolore numquam modi neque.,https://picsum.photos/457/?random,,Neque eius aliquam quaerat amet.,,,,
2011,4,,,,,,,April 2011,Quaerat porro magnam non sed ipsum.,Quaerat magnam etincidunt neque magnam sed sed porro. Velit ut numquam numquam sit aliquam labore adipisci. Quaerat sit amet quaerat quisquam numquam non. Sed magnam est etincidunt sit. Dolore labore velit non numquam. Quaerat porro non amet porro sit.,https://picsum.photos/458/?random,,Eius adipisci eius eius.,,,,
2011,5,,,,,,,May 2011,Etincidunt dolore sed modi labore modi dolore dolor.,Magnam amet magnam quiquia aliquam aliquam ut neque. Est dolorem labore dolorem eius etincidunt voluptatem. Adipisci non ut labore porro non. Dolorem numquam ut tempora sed labore est. Quaerat voluptatem modi dolore. Dolorem sit sit dolore velit. Non voluptatem non quaerat ut adipisci quaerat. Numquam quiquia dolorem aliquam neque non aliquam est. Quisquam numquam est numquam neque velit eius.,https://picsum.photos/459/?random,,Aliquam quiquia voluptatem porro est eius dolore modi.,,,,
2014,8,,,,,,,August 2014,Magnam eius dolor amet eius dolorem.,Aliquam voluptatem eius dolorem quisquam quaerat labore dolorem. Amet eius dolore consectetur. Ut aliquam dolorem eius dolor consectetur sed. Sit amet labore porro quiquia. Magnam neque numquam quaerat quiquia. Quisquam labore aliquam labore non. Etincidunt dolor labore sed tempora ut. Quaerat dolore numquam sed dolorem quisquam neque dolorem. Labore eius eius numquam etincidunt dolore.,https://picsum.photos/460/?random,,Porro quaerat velit quisquam dolorem.,,,,
1980,2,,,,,,,February 1980,Velit eius sed labore.,Quaerat porro est non. Magnam est quiquia quisquam adipisci. Dolorem ut velit aliquam ipsum non. Modi aliquam adipisci consectetur labore aliquam modi. Dolorem est sit aliquam voluptatem dolore voluptatem. Consectetur dolor voluptatem sit neque. Velit quiquia est quisquam dolore. Numquam est sit voluptatem tempora. Eius tempora modi consectetur magnam. Etincidunt adipisci magnam dolore.,https://picsum.photos/461/?random,,Numquam aliquam labore ut dolor numquam voluptatem.,,,,
2001,11,,,,,,,November 2001,Porro ut dolore modi sit.,Dolore velit ut est consectetur sit sed est. Dolor neque tempora numquam etincidunt consectetur numquam. Consectetur dolor quisquam aliquam est ut. Ut quisquam etincidunt sed adipisci adipisci. Velit etincidunt consectetur porro adipisci quiquia. Non eius est non ut est ipsum. Ipsum modi aliquam quiquia numquam tempora ut dolore.,https://picsum.photos/462/?random,,Voluptatem quiquia consectetur ut magnam ipsum eius.,,,,
2011,7,,,,,,,July 2011,Velit consectetur eius dolor adipisci.,Quaerat sit dolor aliquam modi velit labore dolore. Non amet amet dolorem. Tempora eius est voluptatem. Ut numquam amet magnam aliquam dolore. Etincidunt dolorem non ipsum velit etincidunt aliquam. Labore voluptatem eius quisquam. Quisquam etincidunt dolore voluptatem. Sed velit aliquam magnam quiquia. Ut ut consectetur sed quiquia non numquam. Numquam ut tempora eius numquam.,https://picsum.photos/463/?random,,Dolor ipsum neque magnam modi consectetur tempora modi.,,,,
1980,6,,,,,,,June 1980,Aliquam adipisci ipsum quaerat.,Dolor magnam ut ut velit dolorem consectetur. Velit dolor etincidunt quisquam quiquia velit labore. Voluptatem ipsum quiquia sed tempora neque quisquam. Aliquam quaerat non adipisci. Numquam ut eius dolorem magnam voluptatem sit. Amet consectetur porro quisquam etincidunt ut.,https://picsum.photos/464/?random,,Est adipisci adipisci quisquam adipisci.,,,,
2015,11,,,,,,,November 2015,Ut dolorem quiquia dolore.,Amet non dolorem quiquia porro quaerat tempora neque. Quiquia quaerat voluptatem numquam numquam. Quaerat dolor neque non tempora magnam ut velit. Consectetur neque velit numquam quiquia quiquia adipisci eius. Quiquia numquam porro eius porro. Dolor velit quisquam eius quisquam velit sed eius. Etincidunt labore etincidunt numquam dolore quisquam labore dolorem. Neque ipsum est eius sed modi numquam.,https://picsum.photos/465/?random,,Consectetur quiquia dolore quisquam porro.,,,,
1992,2,,,,,,,February 1992,Magnam est amet labore dolore voluptatem numquam neque.,Magnam neque dolorem modi velit. Quiquia aliquam porro ipsum non ut labore. Porro labore labore ipsum eius magnam ut dolore. Magnam eius quiquia numquam aliquam consectetur est. Ipsum tempora dolorem amet numquam dolorem. Non labore amet labore dolorem eius ut labore. Modi sed adipisci numquam tempora eius.,https://picsum.photos/466/?random,,Non dolor porro velit porro neque.,,,,
1989,12,,,,,,,December 1989,Ut est amet ipsum est.,Quaerat magnam tempora neque. Dolore tempora neque neque quiquia est tempora. Tempora modi non quisquam consectetur labore neque modi. Dolore dolor quaerat tempora modi aliquam adipisci. Tempora dolore porro voluptatem modi dolor consectetur. Ut eius sed neque dolor porro dolore.,https://picsum.photos/467/?random,,Eius dolorem adipisci adipisci dolor dolorem aliquam consectetur.,,,,
2008,5,,,,,,,May 2008,Dolorem amet numquam adipisci.,Labore ut numquam dolore. Quaerat tempora sit sed modi neque aliquam sed. Dolorem labore sed adipisci labore. Dolor dolor sit modi non quiquia. Velit dolore aliquam aliquam dolor velit est. Amet etincidunt dolore ipsum velit dolor etincidunt etincidunt. Magnam sit labore dolorem eius adipisci. Ut quaerat ipsum sit numquam neque quisquam. Modi porro quiquia sed amet modi velit.,https://picsum.photos/468/?random,,Labore non labore voluptatem quisquam.,,,,
1995,11,,,,,,,November 1995,Eius porro numquam velit.,Modi tempora est modi velit. Est dolorem non quiquia. Numquam ut magnam quaerat dolor sed. Sed ipsum quaerat ut ipsum. Velit non aliquam labore amet ut dolorem neque.,https://picsum.photos/469/?random,,Tempora sit quisquam ut.,,,,
2007,1,,,,,,,January 2007,Dolor sed quaerat quisquam modi dolor non.,Adipisci non etincidunt quisquam. Quiquia aliquam labore ut modi. Quaerat quiquia labore modi etincidunt quiquia est. Sed etincidunt quiquia ut modi. Sed consectetur quiquia dolore non ipsum quaerat. Porro dolore quiquia amet ut est velit dolor. Consectetur neque consectetur tempora dolore.,https://picsum.photos/470/?random,,Voluptatem velit voluptatem sit quiquia quisquam.,,,,
2012,6,,,,,,,June 2012,Quiquia magnam quaerat consectetur neque neque dolor aliquam.,Sed modi labore quiquia quisquam voluptatem dolorem. Etincidunt quiquia tempora labore eius numquam. Est etincidunt ipsum neque labore quisquam magnam sit. Porro numquam dolore sit porro quiquia. Magnam sit etincidunt magnam amet consectetur velit.,https://picsum.photos/471/?random,,Dolore porro dolorem adipisci.,,,,
1994,9,,,,,,,September 1994,Ipsum quisquam aliquam quaerat velit.,Non eius est porro labore. Modi amet modi sit adipisci adipisci. Quiquia etincidunt voluptatem modi quiquia sit. Magnam velit tempora dolor porro. Aliquam quisquam eius ipsum aliquam voluptatem velit dolorem. Dolore est numquam dolorem est tempora modi. Sed quiquia magnam eius dolore. Amet dolor non quisquam quisquam aliquam. Ipsum non numquam dolorem amet dolore tempora.,https://picsum.photos/472/?random,,Quiquia numquam adipisci sed sed.,,,,
1986,9,,,,,,,September 1986,Consectetur aliquam ut numquam dolore.,Magnam non sed quaerat modi velit porro. Adipisci numquam etincidunt quaerat neque. Amet ut modi dolore consectetur etincidunt. Dolor voluptatem adipisci eius. Sit sit adipisci ut est neque magnam magnam. Labore neque sit labore dolor. Dolore aliquam numquam non aliquam ut est modi.,https://picsum.photos/473/?random,,Quisquam velit modi voluptatem adipisci neque.,,,,
1996,5,,,,,,,May 1996,Non aliquam quaerat porro etincidunt magnam.,Velit ut voluptatem ipsum modi. Modi quaerat dolor adipisci. Magnam non voluptatem amet ut. Velit neque etincidunt neque. Tempora dolor labore aliquam magnam. Dolore magnam consectetur eius. Neque velit velit neque aliquam non voluptatem quisquam. Aliquam non aliquam labore quaerat velit labore. Non ut amet quaerat dolor quiquia dolor.,https://picsum.photos/474/?random,,Magnam quiquia amet dolorem.,,,,
2006,2,,,,,,,February 2006,Amet voluptatem sed etincidunt dolore dolorem magnam.,Consectetur neque dolorem non eius dolore numquam. Est quiquia quisquam non. Numquam amet labore voluptatem. Amet adipisci magnam consectetur voluptatem est. Voluptatem porro est eius est. Dolor dolor quaerat quisquam non quaerat aliquam. Aliquam porro quaerat tempora adipisci. Dolore tempora velit voluptatem. Sit dolorem sed ut quisquam ipsum. Ut consectetur porro quisquam aliquam.,https://picsum.photos/475/?random,,Etincidunt amet etincidunt sit.,,,,
2002,7,,,,,,,July 2002,Amet eius dolor velit voluptatem sit.,Velit ipsum amet dolor dolore. Dolore quisquam eius adipisci. Modi est eius voluptatem neque non. Ipsum voluptatem aliquam numquam ut sit. Eius neque etincidunt dolore modi. Tempora ut non labore non porro. Porro tempora quisquam sed.,https://picsum.photos/476/?random,,Tempora numquam quiquia voluptatem dolore consectetur est.,,,,
1984,5,,,,,,,May 1984,Aliquam quiquia dolor dolorem eius.,Quisquam voluptatem labore non quaerat ut. Amet dolorem aliquam adipisci velit labore dolorem consectetur. Quaerat sit eius porro consectetur. Aliquam est sit ipsum magnam quaerat. Voluptatem tempora etincidunt quaerat modi neque magnam. Neque ipsum dolorem aliquam adipisci non adipisci porro. Porro porro etincidunt dolore non tempora labore. Etincidunt magnam velit adipisci etincidunt magnam quaerat.,https://picsum.photos/477/?random,,Magnam numquam sit sit modi adipisci tempora.,,,,
2017,7,,,,,,,July 2017,Amet sit numquam eius labore.,Eius quiquia neque ut quisquam voluptatem numquam eius. Dolore etincidunt amet velit etincidunt quiquia velit. Voluptatem modi dolore eius quisquam labore dolor modi. Voluptatem sit est porro eius quiquia modi quisquam. Voluptatem est dolorem dolor quisquam eius voluptatem. Velit adipisci voluptatem dolor. Quaerat sed dolor porro numquam. Neque quiquia etincidunt tempora non. Ut aliquam labore ut dolorem consectetur labore labore.,https://picsum.photos/478/?random,,Consectetur non modi consectetur dolorem numquam.,,,,
2011,8,,,,,,,August 2011,Adipisci consectetur dolor numquam etincidunt tempora tempora.,Magnam est quiquia quiquia porro voluptatem quaerat modi. Etincidunt dolorem amet dolorem dolor sed labore quaerat. Dolor voluptatem aliquam etincidunt. Eius etincidunt consectetur modi. Ipsum quisquam eius amet ut. Ut modi quiquia neque quiquia. Aliquam dolorem porro magnam neque velit quisquam. Modi porro amet consectetur ipsum ut. Adipisci ipsum quaerat dolor est ut ipsum sit. Labore ut etincidunt modi ut voluptatem velit.,https://picsum.photos/479/?random,,Ipsum aliquam consectetur dolorem.,,,,
1985,10,,,,,,,October 1985,Amet adipisci amet ipsum.,Quisquam velit modi dolore ut modi. Labore labore dolorem velit aliquam dolore dolor. Quaerat neque porro labore ipsum dolore dolorem. Quiquia etincidunt adipisci eius. Dolor porro sed voluptatem sit quiquia. Labore sit sed consectetur dolor ut aliquam ut. Quaerat neque consectetur ut eius. Amet ut tempora quisquam velit quisquam adipisci porro.,https://picsum.photos/480/?random,,Numquam magnam amet porro numquam.,,,,
1992,4,,,,,,,April 1992,Dolore quisquam dolore dolore tempora consectetur quiquia porro.,Modi aliquam modi voluptatem quaerat. Dolorem modi non dolorem quiquia neque. Neque sed dolore dolore dolor sit est. Labore eius magnam adipisci ipsum numquam quiquia. Consectetur labore quiquia numquam sed sed numquam. Tempora neque dolore ipsum dolorem quiquia labore. Dolor aliquam etincidunt magnam ut amet dolorem numquam. Tempora magnam magnam non magnam sed tempora. Est sit dolore dolorem sit dolorem aliquam. Magnam modi sed labore quiquia quisquam.,https://picsum.photos/481/?random,,Velit velit dolore non consectetur ipsum.,,,,
1992,2,,,,,,,February 1992,Sit etincidunt consectetur dolor.,Amet quaerat sed quaerat eius quisquam quiquia. Est adipisci tempora voluptatem. Adipisci dolore quaerat porro dolor dolore. Ipsum eius ut eius quiquia. Porro ipsum adipisci aliquam.,https://picsum.photos/482/?random,,Porro velit eius numquam.,,,,
2017,6,,,,,,,June 2017,Ipsum est quisquam velit voluptatem modi.,Quiquia eius est labore quisquam amet. Modi aliquam porro magnam eius dolorem. Dolor neque porro sed voluptatem etincidunt. Quisquam ut quisquam non neque sit dolore consectetur. Porro etincidunt dolore amet ut voluptatem dolor neque. Sit adipisci tempora labore neque porro aliquam.,https://picsum.photos/483/?random,,Porro neque voluptatem non est quaerat quiquia sit.,,,,
2011,6,,,,,,,June 2011,Porro labore numquam labore labore quaerat neque.,Sed labore ut aliquam. Adipisci adipisci numquam eius. Adipisci quisquam eius numquam dolor voluptatem. Numquam consectetur modi non. Consectetur ut non dolorem consectetur quiquia voluptatem est. Aliquam quaerat ut etincidunt.,https://picsum.photos/484/?random,,Est ipsum dolorem quaerat non ut.,,,,
1990,5,,,,,,,May 1990,Non tempora quaerat sed velit dolor etincidunt.,Numquam voluptatem consectetur dolor sed. Adipisci quiquia est velit dolor eius. Eius dolorem amet quisquam ipsum modi sed. Consectetur quisquam dolor sit quiquia quiquia etincidunt sit. Amet modi ipsum non etincidunt modi modi. Numquam amet tempora dolor quaerat.,https://picsum.photos/485/?random,,Sed dolore aliquam est non.,,,,
1998,10,,,,,,,October 1998,Dolor sit labore modi quaerat.,Magnam magnam amet aliquam dolor ipsum labore. Porro labore est sit. Modi consectetur eius voluptatem quiquia ipsum. Consectetur tempora porro quisquam labore ipsum magnam neque. Labore eius modi tempora quisquam. Magnam adipisci non consectetur ut. Voluptatem tempora porro quiquia.,https://picsum.photos/486/?random,,Dolorem est numquam quisquam neque.,,,,
2004,12,,,,,,,December 2004,Aliquam ut ipsum dolore etincidunt labore dolor amet.,Dolore dolorem etincidunt adipisci porro. Modi dolorem velit quisquam velit. Numquam tempora tempora numquam dolor etincidunt magnam. Eius est dolorem neque ut. Non magnam non modi modi voluptatem porro. Sit ipsum ipsum labore dolorem. Ut amet porro labore sed sed est non. Ut modi numquam non tempora.,https://picsum.photos/487/?random,,Voluptatem porro etincidunt adipisci consectetur sit magnam ipsum.,,,,
1988,7,,,,,,,July 1988,Sed magnam quisquam aliquam quiquia.,Eius voluptatem voluptatem ut. Ipsum voluptatem est non ipsum. Dolor eius porro dolorem dolore ipsum porro dolor. Quisquam consectetur velit dolor voluptatem magnam. Voluptatem dolore quisquam ipsum eius dolore. Dolore dolorem modi voluptatem ipsum quaerat. Tempora sed sed eius. Sed neque neque quiquia est dolore consectetur. Labore dolorem etincidunt labore non modi porro. Porro quaerat ut voluptatem.,https://picsum.photos/488/?random,,Neque sit magnam est.,,,,
1989,3,,,,,,,March 1989,Consectetur dolor modi dolor.,Tempora adipisci adipisci dolore quiquia etincidunt labore ut. Labore amet tempora non labore etincidunt porro. Dolor labore tempora est. Aliquam sed porro sed. Amet magnam aliquam velit non dolor magnam. Quiquia adipisci dolorem adipisci ut adipisci est. Sit dolore velit quiquia non non velit. Labore velit neque dolorem dolore. Est sed consectetur etincidunt ut.,https://picsum.photos/489/?random,,Velit numquam ipsum porro amet ipsum est.,,,,
2015,5,,,,,,,May 2015,Consectetur modi adipisci numquam voluptatem dolorem.,Etincidunt velit modi velit ut sed. Velit sed tempora tempora porro adipisci. Non quiquia velit eius amet quaerat. Quaerat adipisci adipisci modi adipisci neque. Quiquia ut non sit sit etincidunt labore magnam. Est non aliquam voluptatem etincidunt. Numquam eius neque labore ipsum. Dolore porro sed tempora non consectetur magnam dolore.,https://picsum.photos/490/?random,,Quaerat adipisci tempora porro aliquam eius.,,,,
1988,12,,,,,,,December 1988,Numquam ipsum tempora sed adipisci sed adipisci.,Labore dolore eius adipisci dolor est velit. Tempora quiquia eius adipisci magnam. Sed consectetur quisquam neque est magnam eius non. Sed quaerat neque numquam aliquam ut. Labore dolor adipisci quaerat eius. Etincidunt amet voluptatem dolorem porro non.,https://picsum.photos/491/?random,,Velit magnam non quaerat.,,,,
2006,2,,,,,,,February 2006,Sit tempora sed etincidunt numquam.,Etincidunt modi sit amet dolor dolore sit non. Dolorem eius eius dolorem quisquam. Magnam amet quiquia sit adipisci porro. Sit labore magnam voluptatem est velit adipisci. Dolor porro consectetur numquam porro sit consectetur porro. Porro eius quisquam etincidunt quaerat non voluptatem. Neque numquam aliquam numquam amet quisquam tempora. Amet ut amet modi quiquia numquam sed.,https://picsum.photos/492/?random,,Quiquia est modi neque numquam sed.,,,,
2008,6,,,,,,,June 2008,Ipsum magnam etincidunt porro sit quaerat ut neque.,Eius etincidunt quaerat porro magnam est etincidunt adipisci. Ipsum velit modi labore est eius magnam. Numquam numquam adipisci eius consectetur tempora. Non voluptatem aliquam aliquam adipisci. Etincidunt labore sit consectetur porro sed sit amet. Quaerat sed dolor ut. Magnam dolore ipsum modi modi sed etincidunt quisquam.,https://picsum.photos/493/?random,,Est dolor labore numquam adipisci quiquia.,,,,
1988,10,,,,,,,October 1988,Ipsum adipisci etincidunt quiquia ut adipisci.,Quisquam porro aliquam dolorem. Sit voluptatem modi velit numquam eius. Non dolor etincidunt sed magnam adipisci etincidunt. Sed tempora tempora labore est dolorem adipisci velit. Tempora ipsum dolore etincidunt adipisci etincidunt etincidunt. Dolore numquam tempora adipisci velit voluptatem quisquam dolor.,https://picsum.photos/494/?random,,Dolorem numquam quiquia consectetur quisquam.,,,,
1987,9,,,,,,,September 1987,Ipsum magnam dolorem sit magnam quisquam adipisci.,Ipsum aliquam quaerat magnam quiquia etincidunt. Voluptatem tempora quaerat eius numquam ipsum. Adipisci aliquam magnam sed velit amet. Consectetur labore quiquia aliquam dolor ipsum ut neque. Amet dolorem sit dolor. Quaerat voluptatem adipisci modi. Sed porro neque consectetur. Dolor neque tempora dolor porro dolore. Velit porro voluptatem adipisci sed aliquam porro.,https://picsum.photos/495/?random,,Sit ipsum neque eius.,,,,
2008,6,,,,,,,June 2008,Sed quisquam modi quaerat sit modi voluptatem.,Non velit dolore dolorem quaerat labore non. Magnam modi sit velit non velit dolor ut. Labore numquam numquam ut. Consectetur dolore aliquam sed voluptatem. Ut consectetur etincidunt eius magnam ipsum. Ipsum consectetur adipisci porro adipisci voluptatem quisquam.,https://picsum.photos/496/?random,,Velit aliquam dolor quisquam amet numquam modi.,,,,
1981,12,,,,,,,December 1981,Porro ut porro velit etincidunt non eius eius.,Dolorem modi magnam dolore non. Voluptatem sed amet velit. Est adipisci sed non modi modi tempora dolor. Ipsum quaerat dolore quaerat numquam ut. Sed magnam dolore neque. Eius labore quaerat tempora. Etincidunt aliquam consectetur modi quiquia magnam sed non.,https://picsum.photos/497/?random,,Ut ipsum velit porro.,,,,
1985,3,,,,,,,March 1985,Amet sed sit amet numquam etincidunt aliquam dolor.,Adipisci modi quisquam sed quisquam adipisci. Quiquia ipsum est quaerat quiquia porro tempora. Adipisci ipsum voluptatem dolorem ipsum neque sed. Dolor etincidunt neque sed. Quisquam eius neque adipisci tempora est consectetur. Amet modi non non magnam. Adipisci dolor consectetur ipsum labore. Eius labore modi adipisci quaerat modi eius neque. Dolorem non magnam aliquam adipisci velit dolore aliquam. Tempora aliquam quiquia tempora aliquam sed.,https://picsum.photos/498/?random,,Consectetur dolorem est dolore sed.,,,,
2012,7,,,,,,,July 2012,Amet dolorem dolorem porro non labore modi porro.,Adipisci dolore consectetur voluptatem quisquam numquam quisquam. Non ut porro dolorem ipsum magnam dolor porro. Quiquia est modi magnam ut eius. Etincidunt aliquam neque quaerat etincidunt non. Aliquam velit non neque numquam numquam. Porro adipisci est etincidunt dolore quiquia quisquam ipsum. Consectetur sed quisquam sit magnam. Sed dolore dolorem non tempora. Dolore porro porro velit modi voluptatem labore. Aliquam porro est voluptatem numquam etincidunt.,https://picsum.photos/499/?random,,Aliquam consectetur ipsum est.,,,,
2004,10,,,,,,,October 2004,Dolore ut non dolore dolorem ut est non.,Quisquam ipsum voluptatem tempora numquam velit. Ut modi neque labore voluptatem voluptatem. Sit dolorem ipsum quiquia amet dolore dolor. Magnam quaerat quaerat quisquam sit. Magnam dolore quisquam ipsum. Quisquam sit porro dolor magnam quisquam modi. Dolore quisquam amet voluptatem velit. Dolore dolorem magnam aliquam etincidunt. Quiquia non ipsum est.,https://picsum.photos/500/?random,,Non quisquam porro consectetur amet labore quiquia.,,,,
1997,2,,,,,,,February 1997,Labore dolor aliquam labore.,Porro magnam porro quiquia dolore dolore sed magnam. Porro neque aliquam porro non neque tempora. Aliquam numquam sed voluptatem sed est non. Sit voluptatem aliquam modi tempora quisquam ipsum quiquia. Consectetur sed labore non magnam modi quiquia. Non adipisci sit consectetur dolor porro.,https://picsum.photos/501/?random,,Non dolore ut eius adipisci.,,,,
2010,1,,,,,,,January 2010,Eius ut sit dolorem numquam est.,Porro sed dolorem ut sit amet dolorem numquam. Dolor magnam neque modi. Quaerat aliquam modi dolor aliquam. Labore sed porro tempora amet consectetur. Voluptatem quiquia adipisci ut etincidunt voluptatem.,https://picsum.photos/502/?random,,Aliquam adipisci ut velit voluptatem ipsum dolorem.,,,,
1996,10,,,,,,,October 1996,Dolorem adipisci dolorem quisquam.,Consectetur amet ut quiquia. Modi dolor neque non. Amet ut modi magnam numquam quaerat amet. Sed velit labore consectetur porro dolore. Non adipisci modi amet ipsum modi ut.,https://picsum.photos/503/?random,,Consectetur quiquia labore non labore.,,,,
