Year,Month,Day,Time,End Year,End Month,End Day,End Time,Display Date,Headline,Text,Media,Media Credit,Media Caption,Media Thumbnail,Type,Group,Background
2007,,,,,,,,2007,Magnam aliquam amet dolor ipsum.,Est non quaerat sit. Etincidunt magnam amet est. Numquam tempora quiquia ut porro sed ipsum. Etincidunt dolore amet ut. Voluptatem amet dolorem ut magnam ut labore eius. Est est velit ipsum etincidunt eius. Porro labore modi porro magnam sed porro amet.,https://picsum.photos/724/?random,,Aliquam dolor magnam etincidunt quaerat neque magnam dolorem.,,,,
2016,,,,,,,,2016,Numquam adipisci sit consectetur velit.,Non ipsum voluptatem dolorem ut quisquam. Aliquam ipsum est dolor dolorem consectetur amet. Porro dolore etincidunt dolorem. Quaerat est quisquam velit numquam amet. Ut amet modi dolorem. Modi est tempora dolorem ipsum est eius. Sed sit amet sit est est. Tempora dolor eius quaerat consectetur est velit.,https://picsum.photos/725/?random,,Consectetur sed est labore porro.,,,,
1985,,,,,,,,1985,Neque modi labore ut dolorem adipisci quaerat.,Numquam neque neque est non dolor. Ut non dolor est aliquam consectetur aliquam. Adipisci sed ipsum etincidunt tempora. Eius magnam voluptatem etincidunt. Quiquia ut sit velit dolor quisquam sit neque. Labore ipsum etincidunt magnam dolorem voluptatem voluptatem. Amet dolorem labore quisquam sed.,https://picsum.photos/726/?random,,Quiquia dolor adipisci eius amet quaerat.,,,,
2002,,,,,,,,2002,Aliquam est labore porro est est.,Eius sit neque ut. Dolor aliquam adipisci consectetur dolorem ipsum. Quisquam magnam numquam neque ut modi non sed. Numquam ut ut neque voluptatem numquam. Sed modi quisquam dolor numquam non tempora dolore.,https://picsum.photos/727/?random,,Ut ipsum porro modi amet neque.,,,,
2001,,,,,,,,2001,Amet dolor labore est tempora sit.,Amet neque non modi sed. Sit voluptatem eius adipisci quisquam dolor ut modi. Consectetur ut ut magnam. Aliquam quaerat ipsum sit dolorem neque. Dolorem amet est quaerat eius velit etincidunt. Aliquam dolore eius ut dolorem. Voluptatem non dolor ipsum dolore voluptatem numquam.,https://picsum.photos/728/?random,,Velit numquam sed aliquam magnam est dolor.,,,,
1989,,,,,,,,1989,Aliquam aliquam etincidunt sit voluptatem.,Sit dolor voluptatem sed ipsum velit labore. Non est aliquam consectetur etincidunt. Dolorem eius tempora dolor. Tempora ipsum non modi quiquia etincidunt. Eius dolorem non tempora labore. Numquam aliquam sed etincidunt. Quaerat ipsum sed est consectetur ipsum sit. Quisquam voluptatem amet labore. Neque voluptatem ut dolorem dolorem.,https://picsum.photos/729/?random,,Neque neque dolor sit adipisci labore ipsum.,,,,
1991,,,,,,,,1991,Quaerat labore quaerat etincidunt velit.,Amet ut est quaerat modi etincidunt. Numquam numquam dolor aliquam. Quaerat labore ut tempora non. Neque labore quaerat est quaerat. Dolorem porro quiquia porro quiquia quiquia. Voluptatem non dolore dolore etincidunt.,https://picsum.photos/730/?random,,Ut non dolorem dolore velit.,,,,
1993,,,,,,,,1993,Dolorem dolore aliquam quiquia quaerat sed quaerat magnam.,Tempora ut aliquam ipsum. Sed amet adipisci adipisci quisquam magnam. Dolorem est quaerat sed voluptatem labore. Dolore porro porro quisquam modi non sed. Non amet quisquam ut quisquam labore. Sed sit aliquam voluptatem tempora magnam quaerat ipsum. Dolorem est consectetur dolorem quaerat ut. Ut velit adipisci sed. Voluptatem magnam neque porro non.,https://picsum.photos/731/?random,,Dolor amet velit tempora.,,,,
2014,,,,,,,,2014,Quisquam non sit adipisci modi amet numquam.,Consectetur numquam quiquia quaerat porro sit dolorem modi. Ipsum modi ut porro. Porro adipisci quaerat dolor. Est amet sit neque modi. Adipisci neque ut velit amet porro.,https://picsum.photos/732/?random,,Adipisci aliquam magnam dolor est.,,,,
2000,,,,,,,,2000,Quaerat ut tempora dolore velit neque ut quisquam.,Aliquam numquam quaerat sed. Tempora quaerat quiquia quiquia ut aliquam quaerat. Ut sit dolorem quiquia voluptatem sit dolor. Etincidunt non sed est aliquam velit. Consectetur labore quaerat magnam neque porro voluptatem velit. Ipsum eius labore quisquam quaerat.,https://picsum.photos/733/?random,,Non quiquia quisquam eius quiquia porro.,,,,
1998,,,,,,,,1998,Quiquia amet tempora porro etincidunt quaerat modi.,Tempora eius adipisci non voluptatem. Voluptatem sed voluptatem velit magnam sed. Dolore labore dolorem quaerat consectetur neque tempora dolorem. Numquam ipsum labore sit. Quisquam ut quaerat modi. Tempora eius adipisci quaerat voluptatem. Dolore eius labore magnam sit est quiquia non. Consectetur numquam quaerat neque. Modi tempora consectetur labore amet sed ut magnam.,https://picsum.photos/734/?random,,Sed porro ut adipisci adipisci modi.,,,,
1989,,,,,,,,1989,Amet magnam labore tempora ut magnam.,Ut ut sit quisquam magnam etincidunt. Porro sit adipisci quisquam eius adipisci numquam etincidunt. Quaerat tempora modi etincidunt tempora quaerat velit est. Velit voluptatem neque non. Dolor velit ipsum aliquam ut. Sed ipsum dolore adipisci voluptatem. Labore dolore eius dolorem labore voluptatem quisquam. Est magnam modi quiquia dolorem sit neque neque.,https://picsum.photos/735/?random,,Adipisci quisquam non quiquia quaerat ut.,,,,
1991,,,,,,,,1991,Ipsum numquam non aliquam labore.,Ut dolor est consectetur non magnam porro consectetur. Quiquia est amet aliquam sed ipsum. Non non etincidunt magnam dolor magnam numquam sit. Consectetur dolore dolor magnam sit. Ut ipsum ipsum dolore non eius. Quaerat modi quisquam eius ut non dolore amet. Porro ipsum eius dolore aliquam. Quiquia adipisci sed numquam.,https://picsum.photos/736/?random,,Dolorem non adipisci voluptatem sed non ipsum.,,,,
2001,,,,,,,,2001,Velit aliquam velit dolore.,Dolorem sed porro consectetur numquam. Ipsum velit quisquam quaerat. Numquam tempora adipisci sit dolorem. Consectetur magnam quiquia etincidunt tempora. Magnam etincidunt quisquam dolore eius.,https://picsum.photos/737/?random,,Ut consectetur ipsum dolorem.,,,,
1996,,,,,,,,1996,Quisquam quiquia sit tempora sit magnam sed consectetur.,Tempora amet aliquam quiquia magnam. Neque ipsum numquam quisquam dolorem sed. Etincidunt numquam ipsum etincidunt. Ipsum eius sit ut magnam voluptatem eius. Amet quaerat dolor non. Est amet eius non porro. Consectetur tempora quaerat numquam. Dolor porro labore dolorem. Dolor dolorem labore numquam aliquam aliquam.,https://picsum.photos/738/?random,,Adipisci adipisci velit sit quiquia aliquam.,,,,
2009,,,,,,,,2009,Modi aliquam porro quiquia modi quiquia.,Sit eius porro ipsum ut eius quiquia. Aliquam dolorem modi ut amet. Eius tempora ut numquam quisquam amet. Ipsum ipsum modi dolore adipisci neque. Voluptatem sit labore eius. Dolore dolore magnam adipisci ipsum tempora.,https://picsum.photos/739/?random,,Tempora ipsum numquam modi.,,,,
1990,,,,,,,,1990,Etincidunt aliquam quaerat dolor dolorem neque est.,Velit aliquam dolore est non. Etincidunt amet neque est. Est numquam magnam etincidunt non voluptatem. Voluptatem ut quaerat dolore porro. Adipisci labore ut aliquam eius dolorem dolor numquam. Aliquam eius adipisci ut numquam ut labore. Ipsum velit aliquam etincidunt.,https://picsum.photos/740/?random,,Neque quiquia dolore ut.,,,,
1985,,,,,,,,1985,Amet etincidunt quaerat tempora.,Labore quisquam quiquia dolorem sed quisquam modi est. Quaerat aliquam est neque. Neque ipsum velit consectetur voluptatem ipsum tempora modi. Adipisci dolorem dolorem modi etincidunt sed. Labore quiquia consectetur tempora. Quaerat dolore sit dolore quaerat quiquia ut. Magnam dolorem dolore dolore magnam.,https://picsum.photos/741/?random,,Dolor est ut tempora consectetur est sit velit.,,,,
2004,,,,,,,,2004,Dolor ut aliquam magnam voluptatem.,Dolore numquam eius quisquam dolorem porro adipisci. Labore sit ut quaerat voluptatem dolor. Ipsum dolor neque sit magnam ut dolor consectetur. Ut quiquia amet dolorem est. Aliquam ut eius consectetur consectetur porro. Dolore est amet non sed consectetur non numquam. Labore labore ut numquam voluptatem modi.,https://picsum.photos/742/?random,,Porro amet etincidunt modi quisquam tempora.,,,,
2017,,,,,,,,2017,Aliquam ut neque consectetur quisquam dolore neque.,Eius consectetur adipisci non velit voluptatem neque adipisci. Modi sed porro quiquia dolorem non amet. Dolorem adipisci quisquam dolor consectetur. Etincidunt modi dolorem dolor. Numquam sit velit dolor consectetur. Quisquam numquam voluptatem dolorem labore numquam modi. Ipsum porro tempora ipsum velit. Dolor etincidunt ut ut magnam dolore ipsum. Quiquia non amet tempora amet labore magnam.,https://picsum.photos/743/?random,,Neque ipsum est eius porro quisquam dolore non.,,,,
2015,,,,,,,,2015,Numquam dolor dolore eius labore.,Dolore tempora numquam quiquia quaerat. Tempora eius eius neque adipisci adipisci. Aliquam voluptatem labore non. Labore dolore voluptatem non. Dolor dolore est numquam neque quiquia neque neque. Sit dolorem neque numquam etincidunt amet adipisci.,https://picsum.photos/744/?random,,Aliquam quisquam magnam ut.,,,,
1996,,,,,,,,1996,Velit sit etincidunt aliquam dolore.,Magnam sit sed amet tempora etincidunt non. Numquam dolore porro quisquam numquam dolore dolor eius. Sit numquam sit eius sit. Tempora labore ipsum neque adipisci. Tempora dolor magnam eius eius labore dolore porro.,https://picsum.photos/745/?random,,Amet non ipsum dolorem ipsum consectetur.,,,,
2010,,,,,,,,2010,Neque adipisci est sed.,Aliquam voluptatem dolorem magnam amet quisquam non velit. Sit porro est dolore porro amet eius. Aliquam magnam ut sed non dolor. Adipisci non dolorem voluptatem etincidunt ipsum neque. Est adipisci magnam adipisci. Adipisci etincidunt porro numquam adipisci. Quaerat numquam quaerat voluptatem dolorem dolore. Amet tempora quisquam ut adipisci numquam voluptatem.,https://picsum.photos/746/?random,,Neque sit quiquia adipisci sit porro.,,,,
1993,,,,,,,,1993,Consectetur est tempora est consectetur.,Consectetur quaerat dolore neque velit dolorem tempora. Ut labore non est non. Etincidunt non quaerat adipisci tempora sed quisquam. Adipisci quiquia sed quisquam quaerat quaerat dolore neque. Consectetur sed adipisci modi magnam non quaerat dolor. Etincidunt sit numquam modi sed. Aliquam modi eius velit. Voluptatem consectetur quaerat sed labore non. Sit voluptatem ipsum quaerat neque voluptatem ut adipisci. Modi quiquia velit aliquam numquam est aliquam porro.,https://picsum.photos/747/?random,,Quisquam velit modi quisquam.,,,,
2009,,,,,,,,2009,Magnam sed labore quisquam est.,Quiquia sed porro dolor numquam sed est. Voluptatem non ut numquam quisquam sed. Adipisci ipsum sit amet. Dolore amet neque velit. Quisquam tempora etincidunt sed.,https://picsum.photos/748/?random,,Ut porro ipsum tempora est aliquam ut ipsum.,,,,
2003,,,,,,,,2003,Eius dolore tempora eius sed eius ut.,Dolor amet quaerat velit. Eius amet dolorem dolore. Porro eius adipisci eius. Voluptatem voluptatem etincidunt ut adipisci. Velit sed labore non velit. Voluptatem amet quiquia labore. Ut quisquam sit est. Quisquam consectetur sed labore porro. Magnam adipisci etincidunt adipisci adipisci ut eius magnam.,https://picsum.photos/749/?random,,Dolorem amet sed modi labore modi.,,,,
1987,,,,,,,,1987,Ut quisquam quiquia dolorem quisquam.,Voluptatem modi voluptatem neque dolorem non adipisci. Sit tempora quisquam ipsum. Adipisci ipsum dolore voluptatem dolore. Voluptatem quiquia aliquam velit labore modi. Tempora quiquia sit modi etincidunt numquam. Dolorem quiquia modi numquam quaerat porro.,https://picsum.photos/750/?random,,Non modi eius quiquia.,,,,
1998,,,,,,,,1998,Ut sit adipisci dolorem.,Non magnam quaerat consectetur velit. Porro eius quaerat amet dolore ut amet. Labore modi labore consectetur etincidunt porro adipisci. Sit amet dolorem est porro labore sit consectetur. Magnam adipisci tempora quaerat dolorem porro etincidunt sit. Quiquia sit quiquia dolorem quaerat. Eius est aliquam sed.,https://picsum.photos/751/?random,,Dolore eius velit sit quisquam.,,,,
2004,,,,,,,,2004,Quiquia sed adipisci non aliquam quisquam adipisci porro.,Quiquia porro voluptatem quisquam magnam est sed velit. Porro dolore numquam amet quiquia consectetur ut. Labore porro est adipisci ut ipsum. Consectetur porro non est etincidunt magnam quisquam modi. Quiquia sed est tempora. Sed non labore adipisci tempora non numquam adipisci. Dolor sed aliquam aliquam quisquam dolor consectetur ipsum.,https://picsum.photos/752/?random,,Aliquam voluptatem eius adipisci eius dolorem dolore amet.,,,,
1982,,,,,,,,1982,Velit aliquam tempora ut dolorem.,Adipisci sit amet eius velit numquam. Sed velit quiquia sed sed quaerat ipsum sit. Adipisci dolorem sit porro. Neque dolor porro ipsum adipisci velit. Neque dolor labore consectetur quaerat ipsum. Eius consectetur labore quaerat non. Porro eius ut non porro quisquam numquam. Voluptatem modi ipsum quaerat adipisci consectetur sit.,https://picsum.photos/753/?random,,Modi aliquam neque aliquam ipsum labore numquam est.,,,,
1989,,,,,,,,1989,Labore sed ut amet velit adipisci neque.,Etincidunt sit labore dolore. Ipsum quisquam aliquam est. Quaerat eius consectetur sed numquam. Quaerat numquam sit ipsum etincidunt consectetur labore quiquia. Non amet modi tempora etincidunt. Quisquam dolore numquam dolor dolorem tempora dolorem amet. Dolorem numquam quisquam consectetur eius adipisci. Modi non est modi dolore aliquam. Neque modi etincidunt ipsum ut ipsum aliquam eius. Quaerat dolorem sit numquam modi.,https://picsum.photos/754/?random,,Labore aliquam est quiquia aliquam dolorem porro quiquia.,,,,
2001,,,,,,,,2001,Dolor neque aliquam modi.,Eius quiquia est sit etincidunt modi porro. Voluptatem numquam dolore numquam consectetur. Quisquam quisquam magnam tempora. Amet adipisci aliquam est amet consectetur. Eius consectetur dolor quisquam eius labore voluptatem velit. Dolorem modi quiquia adipisci sed.,https://picsum.photos/755/?random,,Dolor modi voluptatem quaerat quisquam tempora est numquam.,,,,
2014,,,,,,,,2014,Consectetur ut amet labore numquam.,Modi amet est etincidunt eius dolore. Sed neque neque quiquia eius modi est. Quaerat porro aliquam sed consectetur. Aliquam ut sit quaerat porro tempora. Tempora ipsum modi etincidunt numquam magnam non quisquam.,https://picsum.photos/756/?random,,Est aliquam non sit quiquia sit amet modi.,,,,
2006,,,,,,,,2006,Voluptatem ipsum voluptatem velit eius neque.,Quaerat consectetur est non ut ut amet. Dolorem ipsum etincidunt adipisci. Est numquam est sed. Ipsum ipsum tempora ipsum. Adipisci tempora tempora eius quiquia dolorem modi dolor. Aliquam sit etincidunt sed labore. Amet numquam etincidunt velit velit adipisci. Voluptatem porro amet ipsum amet quisquam labore quisquam. Neque ut est voluptatem ipsum sed.,https://picsum.photos/757/?random,,Neque eius porro numquam ut tempora.,,,,
1983,,,,,,,,1983,Etincidunt eius etincidunt consectetur modi eius.,Numquam labore velit quaerat labore. Amet numquam aliquam non aliquam. Consectetur non quisquam adipisci est eius sed dolore. Quiquia voluptatem consectetur non ut dolorem consectetur. Adipisci modi ut quisquam aliquam labore eius. Quiquia dolorem dolor sit. Numquam magnam etincidunt est consectetur sed eius. Etincidunt eius sit eius ut adipisci tempora dolor. Dolore adipisci sed eius. Sit neque numquam ipsum.,https://picsum.photos/758/?random,,Etincidunt ut adipisci velit aliquam porro.,,,,
1983,,,,,,,,1983,Neque ipsum voluptatem modi modi velit.,Quaerat quaerat quaerat etincidunt porro quisquam amet eius. Ut modi sit tempora. Labore sed ut tempora ipsum eius tempora. Tempora amet numquam ipsum sed. Velit aliquam etincidunt non. Magnam ipsum tempora voluptatem eius eius dolor dolore. Etincidunt voluptatem est dolor aliquam porro.,https://picsum.photos/759/?random,,Quisquam numquam numquam velit quiquia.,,,,
2009,,,,,,,,2009,Modi porro voluptatem tempora etincidunt.,Consectetur quisquam voluptatem quisquam ipsum. Consectetur porro sit dolor numquam labore sed sit. Adipisci neque modi est adipisci quaerat quisquam. Neque non eius sed etincidunt. Neque magnam magnam quaerat. Non aliquam sit ipsum porro sit dolore. Sed neque porro porro quisquam sed.,https://picsum.photos/760/?random,,Neque tempora labore quaerat dolore consectetur non etincidunt.,,,,
1997,,,,,,,,1997,Dolorem velit porro ut neque ut ipsum.,Velit labore amet tempora velit voluptatem consectetur dolore. Neque dolor etincidunt magnam eius eius quaerat dolorem. Sit aliquam quiquia ipsum eius consectetur. Tempora sed numquam adipisci dolorem amet. Tempora non labore etincidunt voluptatem consectetur amet quiquia. Dolor neque sit quiquia modi ut est porro. Voluptatem ut sed sit quiquia. Quaerat sed quisquam etincidunt. Amet numquam tempora tempora quiquia. Tempora dolor velit voluptatem.,https://picsum.photos/761/?random,,Eius aliquam sed ipsum dolor magnam adipisci porro.,,,,
2015,,,,,,,,2015,Numquam adipisci quaerat dolor quiquia numquam.,Adipisci ut amet magnam est voluptatem quaerat consectetur. Dolor adipisci velit non dolor sed magnam. Ipsum dolore non est eius. Sed quaerat numquam consectetur consectetur numquam modi. Numquam aliquam ut ipsum quiquia tempora. Eius quaerat sit dolore porro. Dolorem dolore est sed consectetur etincidunt. Amet velit labore dolorem.,https://picsum.photos/762/?random,,Quisquam numquam dolor numquam voluptatem.,,,,
1987,,,,,,,,1987,Porro aliquam magnam aliquam neque etincidunt.,Sit neque labore porro. Consectetur dolor velit quaerat neque tempora. Ut magnam dolore est. Quiquia dolor etincidunt numquam est porro. Quisquam magnam non quiquia sit dolorem. Labore quaerat labore neque voluptatem est dolore. Etincidunt numquam non labore. Tempora voluptatem est ipsum magnam neque neque non. Dolor amet modi quaerat ut dolor neque dolore.,https://picsum.photos/763/?random,,Amet velit voluptatem tempora consectetur numquam.,,,,
2013,,,,,,,,2013,Dolore porro voluptatem ipsum ipsum magnam labore.,Eius quiquia sed labore quisquam. Consectetur ipsum labore aliquam. Modi etincidunt ut quaerat magnam amet. Neque neque voluptatem etincidunt dolore consectetur consectetur. Non quisquam ut dolore ipsum dolor ut. Eius quisquam magnam tempora sed non. Amet numquam porro dolorem. Dolore est modi eius porro sed quiquia. Porro amet dolorem voluptatem voluptatem aliquam amet porro.,https://picsum.photos/764/?random,,Sit est adipisci velit quisquam consectetur.,,,,
2006,,,,,,,,2006,Neque sed est non modi numquam.,Eius adipisci numquam quiquia numquam quiquia dolorem dolor. Est dolore est est sed consectetur dolore quiquia. Modi ut magnam ipsum. Porro amet consectetur quiquia ipsum. Dolorem ut velit dolor neque modi. Est aliquam dolore numquam adipisci. Aliquam amet adipisci neque quaerat. Aliquam quaerat aliquam consectetur sit eius quisquam.,https://picsum.photos/765/?random,,Porro quaerat quiquia labore quaerat non.,,,,
2007,,,,,,,,2007,Non adipisci quaerat labore amet adipisci amet eius.,Quiquia porro consectetur ipsum consectetur quiquia consectetur ut. Voluptatem quiquia etincidunt ut. Quaerat sed aliquam dolor. Ut porro consectetur velit modi quaerat dolore dolorem. Aliquam adipisci dolorem dolorem. Velit etincidunt dolorem porro non. Sit dolore ipsum magnam. Ipsum quiquia sed eius labore. Neque etincidunt dolore porro.,https://picsum.photos/766/?random,,Dolor neque labore quisquam magnam sed ut sit.,,,,
1998,,,,,,,,1998,Magnam aliquam magnam sit quaerat etincidunt.,Ipsum consectetur quaerat ipsum adipisci neque dolor ut. Numquam dolorem ut non. Velit porro quaerat voluptatem tempora eius etincidunt. Ut neque est velit sed. Quiquia quaerat dolor dolor dolore neque quaerat. Sed sed dolor magnam sit dolore. Labore neque sit consectetur. Dolore sed quiquia dolor modi sed consectetur. Neque est sit neque labore numquam dolorem eius. Numquam amet magnam neque ut magnam velit velit.,https://picsum.photos/767/?random,,Porro modi dolorem non adipisci.,,,,
1991,,,,,,,,1991,Etincidunt non eius eius etincidunt sit neque.,Velit quaerat sit eius neque quaerat. Quisquam numquam quisquam dolorem. Sed modi labore sit eius. Quisquam non neque eius. Consectetur ipsum magnam tempora dolor sed.,https://picsum.photos/768/?random,,Aliquam labore voluptatem dolore.,,,,
2002,,,,,,,,2002,Voluptatem ipsum etincidunt voluptatem.,Etincidunt adipisci quisquam aliquam tempora. Etincidunt dolore quiquia dolore adipisci velit non. Quaerat neque etincidunt modi tempora magnam magnam numquam. Neque ipsum porro numquam consectetur. Non magnam quiquia magnam numquam. Ut ut ut sed ipsum quiquia. Ipsum neque sit porro numquam.,https://picsum.photos/769/?random,,Numquam velit labore velit dolore adipisci.,,,,
1995,,,,,,,,1995,Ipsum porro amet velit dolor consectetur.,Quaerat aliquam aliquam sed. Est aliquam sed ipsum eius consectetur. Adipisci amet est numquam numquam consectetur voluptatem. Neque magnam adipisci modi quaerat. Eius aliquam eius adipisci. Est voluptatem aliquam non voluptatem. Eius sed etincidunt tempora modi. Eius non non porro modi est non.,https://picsum.photos/770/?random,,Quiquia numquam modi etincidunt eius quisquam sed quisquam.,,,,
2011,,,,,,,,2011,Quaerat ut eius adipisci neque dolore dolorem.,Modi etincidunt labore velit magnam ipsum. Etincidunt consectetur consectetur amet numquam consectetur. Quiquia eius velit sit sed est ut tempora. Quiquia est numquam tempora sit neque quisquam. Ut eius magnam dolore dolore velit. Magnam etincidunt consectetur sit. Velit quiquia sit non. Consectetur ut est quiquia adipisci neque. Quiquia non eius non quisquam quiquia. Ipsum porro sit velit.,https://picsum.photos/771/?random,,Tempora aliquam porro neque ipsum porro quaerat porro.,,,,
1987,,,,,,,,1987,Modi non adipisci est quiquia.,Amet sed velit quisquam amet. Modi magnam consectetur adipisci dolore quaerat. Dolore dolore adipisci adipisci consectetur. Dolore aliquam magnam dolorem magnam adipisci. Adipisci modi etincidunt dolorem sit. Quaerat sed ut non aliquam. Dolore ut aliquam amet. Labore quisquam modi ipsum labore quaerat amet neque.,https://picsum.photos/772/?random,,Eius ut sed labore neque non dolore.,,,,
1996,,,,,,,,1996,Modi dolor quisquam dolor quiquia.,Aliquam consectetur etincidunt ipsum. Consectetur eius aliquam ut modi. Adipisci sit sed ut amet voluptatem consectetur tempora. Ipsum dolore quisquam aliquam eius adipisci. Quisquam ipsum amet ipsum.,https://picsum.photos/773/?random,,Quaerat dolor non modi adipisci ut quisquam neque.,,,,
1986,,,,,,,,1986,Ipsum quisquam numquam dolore etincidunt neque consectetur sed.,Dolore labore numquam quisquam. Dolorem consectetur eius dolore. Aliquam adipisci magnam dolorem quisquam dolore. Eius neque quiquia quaerat numquam neque velit. Aliquam quaerat ut eius. Sed est est sed dolorem labore quiquia. Dolor ut magnam tempora. Eius porro velit ipsum quaerat modi.,https://picsum.photos/774/?random,,Consectetur ut dolor non neque neque.,,,,
1983,,,,,,,,1983,Adipisci etincidunt numquam consectetur.,Amet tempora velit tempora non ut porro ipsum. Amet amet aliquam porro dolore voluptatem. Ut numquam quaerat quiquia voluptatem modi ut consectetur. Dolor numquam voluptatem quisquam dolorem quaerat. Modi magnam dolore modi porro eius dolore ut.,https://picsum.photos/775/?random,,Dolore quaerat porro aliquam dolorem.,,,,
2014,,,,,,,,2014,Ipsum aliquam tempora ipsum quiquia.,Amet ut tempora magnam adipisci velit porro. Modi dolore sed quaerat. Etincidunt dolore magnam neque adipisci sed magnam neque. Dolor porro tempora quaerat amet dolore voluptatem. Aliquam adipisci velit ut. Eius eius porro tempora quaerat voluptatem. Porro aliquam dolore tempora dolorem etincidunt ut etincidunt. Dolore dolore aliquam voluptatem dolor porro modi numquam.,https://picsum.photos/776/?random,,Ipsum ipsum non amet magnam quisquam.,,,,
1998,,,,,,,,1998,Quaerat amet eius adipisci voluptatem voluptatem.,Tempora porro dolore ipsum ipsum porro. Sed est voluptatem quaerat amet amet neque neque. Labore neque dolore velit aliquam. Aliquam dolor non magnam. Amet neque voluptatem consectetur ipsum aliquam. Est ipsum non ut quaerat sed.,https://picsum.photos/777/?random,,Labore labore labore amet tempora.,,,,
1992,,,,,,,,1992,Est velit dolor quaerat etincidunt non voluptatem.,Velit ipsum labore velit magnam. Amet sit velit numquam labore tempora non numquam. Amet dolore neque labore sit. Sed dolor dolore labore dolorem ut ut sit. Consectetur amet quaerat neque.,https://picsum.photos/778/?random,,Tempora ut magnam modi neque.,,,,
2011,,,,,,,,2011,Neque tempora amet dolore adipisci non.,Non ipsum non dolor modi. Porro quisquam aliquam neque modi tempora. Porro etincidunt labore sed numquam sit consectetur quiquia. Magnam quaerat numquam sed consectetur numquam ipsum numquam. Amet neque non velit sit quisquam. Quiquia est consectetur non. Dolorem modi numquam amet porro etincidunt non labore. Labore dolorem ut quaerat eius aliquam labore adipisci. Ipsum aliquam consectetur voluptatem quiquia modi aliquam.,https://picsum.photos/779/?random,,Porro ipsum ut quisquam dolore dolorem labore.,,,,
2014,,,,,,,,2014,Adipisci amet est est adipisci voluptatem.,Dolorem sit neque dolore modi numquam. Adipisci eius quisquam numquam sed dolorem ut est. Amet quaerat neque sit. Porro eius dolor ipsum dolorem consectetur. Modi neque etincidunt magnam magnam voluptatem. Sit amet aliquam etincidunt consectetur. Non sit etincidunt aliquam.,https://picsum.photos/780/?random,,Tempora dolore est sit dolore labore.,,,,
2007,,,,,,,,2007,Quiquia numquam quaerat dolorem.,Porro est magnam dolor. Ipsum porro etincidunt dolor voluptatem. Est tempora aliquam eius dolor ut quiquia. Sit eius non neque. Est aliquam dolor numquam etincidunt adipisci quiquia amet.,https://picsum.photos/781/?random,,Numquam aliquam adipisci ut est etincidunt.,,,,
