Year,Month,Day,Time,End Year,End Month,End Day,End Time,Display Date,Headline,Text,Media,Media Credit,Media Caption,Media Thumbnail,Type,Group,Background
2001,9,,,,,,,September 2001,Neque quiquia magnam sit dolor est tempora.,Sed dolorem dolorem porro. Quisquam magnam tempora aliquam ut consectetur. Dolorem magnam sed magnam. Ut consectetur consectetur magnam. Quaerat modi aliquam modi magnam quaerat. Modi amet etincidunt non dolor. Dolore ut etincidunt ut aliquam etincidunt eius consectetur. Neque dolorem etincidunt eius tempora tempora dolore consectetur. Magnam magnam voluptatem est dolorem adipisci dolor dolor.,https://picsum.photos/722/?random,,Neque modi neque dolorem amet velit labore porro.,,,,
2011,3,,,,,,,March 2011,Dolorem sed modi labore ut dolore quaerat consectetur.,Aliquam dolorem numquam velit adipisci adipisci quisquam. Dolore porro magnam dolorem. Amet est labore magnam aliquam dolor eius. Magnam etincidunt quisquam dolorem. Est quaerat tempora non dolor amet amet. Velit etincidunt adipisci numquam tempora modi labore. Quaerat labore velit dolore velit porro.,https://picsum.photos/723/?random,,Dolorem consectetur amet ipsum ut non sit.,,,,
2015,12,,,,,,,December 2015,Quisquam adipisci voluptatem dolorem adipisci.,Ut sit non amet neque neque modi. Ipsum etincidunt dolore etincidunt numquam ipsum sed voluptatem. Eius porro labore modi. Ipsum porro dolor voluptatem sed. Ipsum sed adipisci non. Eius ipsum est velit neque. Quiquia ut quiquia eius etincidunt. Sed eius neque dolor consectetur.,https://picsum.photos/724/?random,,Numquam dolor velit modi.,,,,
2016,7,,,,,,,July 2016,Ut dolore quaerat labore ut quisquam neque etincidunt.,Sed porro est quiquia sit. Adipisci sit quaerat neque quisquam dolore. Modi velit modi porro amet. Porro dolore adipisci tempora tempora. Modi est ipsum consectetur est. Sit magnam modi sit dolor. Dolorem voluptatem aliquam adipisci etincidunt labore dolore aliquam. Sed quiquia labore quisquam etincidunt dolorem neque eius.,https://picsum.photos/725/?random,,Adipisci sed numquam eius.,,,,
2003,10,,,,,,,October 2003,Ipsum dolore velit labore eius labore velit.,Porro est aliquam consectetur magnam dolorem quiquia. Amet amet magnam aliquam. Dolorem modi ipsum eius adipisci numquam est. Magnam consectetur quisquam quaerat neque etincidunt aliquam. Est aliquam non neque aliquam. Est magnam amet ut quiquia ut. Adipisci non etincidunt consectetur. Eius velit quiquia dolorem etincidunt.,https://picsum.photos/726/?random,,Sed modi magnam labore eius.,,,,
1980,1,,,,,,,January 1980,Porro non dolorem amet est.,Ipsum adipisci ipsum modi ut labore voluptatem voluptatem. Voluptatem modi etincidunt consectetur voluptatem voluptatem. Porro non consectetur adipisci tempora. Dolore numquam neque ipsum. Dolorem magnam amet eius quaerat aliquam. Est numquam dolorem etincidunt modi consectetur sit. Porro tempora eius non. Aliquam sed dolore quaerat.,https://picsum.photos/727/?random,,Dolore eius voluptatem dolor magnam non.,,,,
1982,4,,,,,,,April 1982,Ut modi est dolore.,Sed consectetur sit neque. Ut dolor dolore labore etincidunt quisquam consectetur velit. Voluptatem eius consectetur quaerat. Dolor consectetur eius est consectetur sit magnam eius. Dolore modi labore quiquia magnam quaerat. Dolorem neque non sit magnam numquam voluptatem. Voluptatem quisquam ut modi velit eius neque. Consectetur dolore amet neque dolorem dolore porro etincidunt. Sed quaerat neque modi dolore magnam sed dolore. Ut aliquam sed modi.,https://picsum.photos/728/?random,,Etincidunt porro amet amet.,,,,
1997,6,,,,,,,June 1997,Est dolor etincidunt tempora dolore.,Ut quiquia labore adipisci non magnam velit numquam. Adipisci tempora quisquam porro tempora neque amet. Labore adipisci quiquia ut labore quisquam. Velit quaerat voluptatem labore numquam. Etincidunt modi amet ut. Quaerat adipisci non dolorem tempora.,https://picsum.photos/729/?random,,Amet consectetur neque adipisci adipisci dolor aliquam.,,,,
1991,12,,,,,,,December 1991,Aliquam amet sit ipsum porro dolorem sit amet.,Neque aliquam modi voluptatem. Quiquia magnam dolor quisquam dolor quaerat sed. Voluptatem quiquia etincidunt eius tempora amet quaerat quiquia. Quaerat est porro magnam dolorem adipisci. Dolore velit voluptatem dolorem labore. Quiquia aliquam voluptatem quiquia quiquia non non porro.,https://picsum.photos/730/?random,,Aliquam sit voluptatem velit magnam eius.,,,,
1993,8,,,,,,,August 1993,Dolorem dolor labore dolorem est modi amet amet.,Neque quiquia modi etincidunt aliquam ipsum. Numquam etincidunt quaerat aliquam dolore porro labore sed. Consectetur consectetur modi voluptatem quaerat numquam modi. Sit voluptatem amet etincidunt adipisci. Quiquia numquam sed sit.,https://picsum.photos/731/?random,,Dolor ipsum amet labore ut dolor sed.,,,,
2006,9,,,,,,,September 2006,Amet non quaerat consectetur adipisci numquam voluptatem.,Consectetur labore amet quaerat est. Adipisci modi porro porro. Ipsum non eius modi. Magnam amet dolor velit adipisci aliquam sit amet. Quiquia quaerat dolore est. Dolor sit aliquam est est labore neque quaerat. Ipsum dolorem tempora non sed consectetur. Etincidunt adipisci ut aliquam non magnam modi. Sit magnam etincidunt eius voluptatem labore. Quiquia consectetur dolorem porro tempora.,https://picsum.photos/732/?random,,Quiquia neque ut adipisci eius.,,,,
2002,4,,,,,,,April 2002,Consectetur est modi tempora consectetur ut.,Numquam tempora numquam quiquia. Quisquam porro sed etincidunt. Etincidunt dolorem quaerat consectetur voluptatem dolorem magnam. Ut sit dolore non. Etincidunt quiquia velit non sit sed modi. Sed labore aliquam voluptatem velit tempora. Labore velit ipsum velit. Magnam porro magnam magnam quisquam quisquam dolore numquam.,https://picsum.photos/733/?random,,Neque dolor sed voluptatem non amet quaerat sit.,,,,
1985,11,,,,,,,November 1985,Ipsum ut dolore quisquam aliquam.,Est quiquia quisquam non. Adipisci tempora magnam ipsum etincidunt sed. Etincidunt sed dolore neque. Dolorem dolorem neque adipisci adipisci est. Sed etincidunt velit quaerat numquam velit sit. Dolore magnam sed porro neque. Dolor neque tempora est.,https://picsum.photos/734/?random,,Quisquam sit magnam dolor dolor.,,,,
2008,2,,,,,,,February 2008,Quisquam sit quisquam eius dolore.,Numquam etincidunt porro ipsum sed modi amet. Porro amet sed porro sed consectetur etincidunt. Aliquam neque velit tempora dolorem adipisci. Quisquam tempora sit numquam neque magnam non aliquam. Numquam tempora quisquam dolore dolorem dolor labore. Eius ipsum adipisci adipisci etincidunt consectetur.,https://picsum.photos/735/?random,,Neque labore labore sit.,,,,
1980,6,,,,,,,June 1980,Consectetur ut eius non eius.,Numquam magnam adipisci adipisci eius. Magnam modi porro ipsum. Porro non magnam est numquam. Modi eius consectetur amet est ut. Est eius tempora etincidunt eius quiquia dolor aliquam. Magnam numquam dolore porro dolor dolor amet. Sit numquam labore ut aliquam dolore. Labore sed quaerat ipsum modi consectetur consectetur. Aliquam quaerat dolore quiquia eius quaerat. Est tempora ut ut modi magnam porro.,https://picsum.photos/736/?random,,Quiquia etincidunt porro numquam quisquam dolor porro eius.,,,,
1994,4,,,,,,,April 1994,Numquam modi dolore dolorem.,Amet sed ipsum etincidunt. Voluptatem quisquam tempora sit porro dolore neque. Etincidunt amet sed voluptatem. Etincidunt quisquam quisquam voluptatem. Porro velit amet voluptatem etincidunt.,https://picsum.photos/737/?random,,Labore est ut non.,,,,
1996,8,,,,,,,August 1996,Voluptatem porro dolor quisquam.,Quaerat numquam numquam ipsum amet quisquam porro non. Porro sed labore porro quiquia. Quisquam sit neque est modi ut. Labore consectetur adipisci magnam. Magnam magnam sit ipsum sit quiquia consectetur. Dolore velit aliquam dolorem neque sit aliquam. Ipsum eius voluptatem sed porro velit. Porro neque non neque quisquam sit tempora non. Dolorem ut aliquam dolore eius. Ipsum quisquam dolore quaerat est dolorem magnam quaerat.,https://picsum.photos/738/?random,,Sed neque amet sit quisquam voluptatem.,,,,
1989,10,,,,,,,October 1989,Tempora sed aliquam labore ipsum.,Velit est sit quaerat amet quiquia ut. Amet neque modi labore consectetur amet porro. Magnam sed non tempora. Neque dolor dolorem magnam. Dolor quisquam dolorem aliquam tempora numquam neque. Velit tempora velit quiquia. Etincidunt neque quaerat sit tempora dolorem quiquia non. Eius aliquam quiquia numquam dolor magnam.,https://picsum.photos/739/?random,,Modi consectetur magnam aliquam tempora dolorem voluptatem.,,,,
2013,6,,,,,,,June 2013,Dolor modi modi dolor porro.,Dolorem aliquam modi dolorem etincidunt quaerat neque labore. Est etincidunt quisquam labore voluptatem est. Amet ipsum adipisci dolore. Sed consectetur quisquam ut ipsum numquam. Ut quisquam sed dolor labore amet. Eius amet magnam magnam est modi etincidunt quisquam. Adipisci sed dolore amet. Quiquia magnam adipisci quisquam sit non est. Voluptatem ipsum etincidunt modi amet etincidunt.,https://picsum.photos/740/?random,,Dolor adipisci voluptatem aliquam.,,,,
2010,7,,,,,,,July 2010,Velit non aliquam neque sit ipsum.,Sit tempora voluptatem consectetur quaerat. Ipsum velit dolor est. Labore tempora ipsum quiquia porro. Consectetur neque voluptatem quiquia dolorem. Ipsum consectetur velit modi ut quaerat numquam aliquam. Labore magnam aliquam velit labore sed quaerat quaerat.,https://picsum.photos/741/?random,,Velit modi numquam ipsum voluptatem.,,,,
1984,2,,,,,,,February 1984,Dolore consectetur velit ut dolor eius.,Labore quisquam adipisci non modi. Dolor est eius est. Quaerat est dolorem numquam velit quaerat. Sit tempora sit dolorem. Dolor porro modi quiquia. Neque neque quaerat amet voluptatem numquam etincidunt. Quaerat quaerat numquam amet.,https://picsum.photos/742/?random,,Voluptatem labore magnam etincidunt velit.,,,,
1995,1,,,,,,,January 1995,Dolor etincidunt velit aliquam etincidunt labore consectetur tempora.,Dolor sit quisquam numquam. Consectetur amet labore dolorem quaerat ipsum neque magnam. Est sit dolore voluptatem. Velit quiquia amet velit est. Tempora adipisci numquam est porro. Etincidunt etincidunt quisquam quiquia consectetur adipisci dolorem. Quiquia ut voluptatem ut. Eius non modi velit ipsum dolore modi voluptatem. Sit quaerat non amet etincidunt eius.,https://picsum.photos/743/?random,,Magnam dolorem numquam dolorem adipisci.,,,,
1985,10,,,,,,,October 1985,Dolore aliquam quiquia velit porro quiquia dolore.,Etincidunt non neque consectetur. Est quaerat amet neque porro. Consectetur sit dolore numquam. Est eius sed adipisci. Sit numquam consectetur non adipisci modi ut quiquia. Quiquia est numquam magnam. Dolorem voluptatem sit sit magnam sit.,https://picsum.photos/744/?random,,Porro amet ut quiquia.,,,,
1984,6,,,,,,,June 1984,Magnam tempora neque dolor non sit.,Sit numquam modi ut dolor consectetur. Amet aliquam numquam dolore dolorem. Ipsum etincidunt quisquam ipsum ut voluptatem est. Adipisci quiquia modi eius velit aliquam eius voluptatem. Magnam ipsum dolore ipsum quaerat dolorem magnam. Sed dolor voluptatem voluptatem.,https://picsum.photos/745/?random,,Eius voluptatem neque sed aliquam.,,,,
2017,10,,,,,,,October 2017,Etincidunt porro sit quiquia dolorem quaerat.,Non ipsum voluptatem neque. Voluptatem numquam quaerat velit modi voluptatem ut. Neque ipsum amet tempora. Etincidunt numquam amet quisquam sed etincidunt. Sit quiquia aliquam voluptatem.,https://picsum.photos/746/?random,,Numquam est est ut aliquam.,,,,
2018,1,,,,,,,January 2018,Sit modi etincidunt porro adipisci.,Sed labore numquam sed sit sit numquam. Quisquam eius labore velit. Quiquia dolore ut quisquam adipisci adipisci velit modi. Eius magnam sed neque numquam consectetur dolorem magnam. Neque amet etincidunt ut tempora voluptatem aliquam est. Ut consectetur velit modi. Labore numquam numquam magnam dolorem ipsum sed. Eius dolorem consectetur porro quiquia sit ipsum. Aliquam sed labore eius voluptatem tempora quisquam dolore.,https://picsum.photos/747/?random,,Quaerat quaerat consectetur est etincidunt.,,,,
1999,6,,,,,,,June 1999,Est ipsum sit eius voluptatem.,Eius neque porro aliquam est neque neque sit. Neque non magnam tempora quisquam porro. Aliquam sed quisquam sit est velit dolore etincidunt. Amet quiquia magnam aliquam porro amet dolorem dolore. Ut sit dolor adipisci. Sit sed ipsum dolor voluptatem sit ipsum.,https://picsum.photos/748/?random,,Magnam sit eius est eius modi consectetur.,,,,
2009,12,,,,,,,December 2009,Est modi sit quaerat adipisci modi dolore tempora.,Eius ipsum magnam numquam. Aliquam porro sed voluptatem. Amet porro etincidunt sit dolor quisquam porro. Est dolor ipsum neque labore etincidunt. Dolor quiquia ut sit labore labore labore neque. Adipisci ipsum porro numquam etincidunt. Labore quiquia dolor numquam est. Ut dolorem amet ut ut. Adipisci consectetur sit adipisci etincidunt numquam voluptatem. Neque modi ut tempora quaerat modi dolor quisquam.,https://picsum.photos/749/?random,,Sed non sit ipsum dolore voluptatem est.,,,,
1999,4,,,,,,,April 1999,Dolorem modi amet numquam tempora etincidunt ut ut.,Est dolore neque consectetur dolore. Quiquia sit dolor dolorem quaerat consectetur quaerat. Sit velit dolorem neque. Quaerat eius sed non tempora. Quisquam labore quaerat velit numquam adipisci. Eius dolore sit ut quisquam quisquam amet ipsum. Aliquam ut labore sit magnam modi. Quisquam quisquam sit modi. Modi quaerat quiquia quisquam quaerat eius. Voluptatem amet etincidunt dolor consectetur sit.,https://picsum.photos/750/?random,,Dolorem eius labore numquam est est non aliquam.,,,,
1985,9,,,,,,,September 1985,Labore adipisci labore quiquia quisquam quaerat.,Labore porro dolorem etincidunt dolorem amet sit. Porro non etincidunt sed quiquia. Velit consectetur ut quiquia sit tempora magnam dolor. Quaerat amet sit magnam. Sed ut aliquam aliquam numquam tempora. Est numquam ut voluptatem neque eius. Quiquia quiquia dolor dolore.,https://picsum.photos/751/?random,,Dolorem consectetur eius consectetur velit ut.,,,,
2018,8,,,,,,,August 2018,Dolorem quiquia amet voluptatem labore etincidunt ipsum neque.,Dolore dolorem quisquam quisquam magnam. Neque est quisquam quiquia. Porro dolorem velit etincidunt eius etincidunt amet. Consectetur consectetur quisquam sit dolor. Sed numquam dolore voluptatem. Numquam consectetur amet dolorem tempora dolor ipsum dolor. Voluptatem sed consectetur numquam porro eius ut.,https://picsum.photos/752/?random,,Ipsum quaerat dolorem est voluptatem.,,,,
2018,7,,,,,,,July 2018,Ipsum sit porro labore magnam adipisci.,Dolor modi consectetur quaerat quiquia velit numquam. Non voluptatem velit sed. Est neque modi quiquia labore sed adipisci. Ipsum modi sit non. Quiquia eius consectetur eius labore dolor non. Non sit dolor ipsum non dolorem.,https://picsum.photos/753/?random,,Sit est sed velit modi.,,,,
1990,1,,,,,,,January 1990,Amet quisquam porro quisquam.,Dolore dolore consectetur non quisquam neque aliquam quisquam. Ut magnam neque sit quaerat ut. Numquam amet non etincidunt dolorem. Neque quiquia numquam numquam aliquam. Eius quiquia etincidunt dolore voluptatem voluptatem. Sit quaerat sit numquam ut. Tempora ipsum quaerat quaerat magnam sed.,https://picsum.photos/754/?random,,Labore est velit dolore sit.,,,,
2013,12,,,,,,,December 2013,Amet est sit quisquam velit etincidunt.,Est tempora quaerat amet ipsum. Etincidunt quiquia est magnam ipsum modi dolor. Adipisci sed consectetur consectetur est dolor dolore dolorem. Consectetur dolorem dolore quaerat adipisci dolor magnam. Magnam tempora consectetur dolore. Quaerat velit dolor quaerat labore. Ipsum amet sit est.,https://picsum.photos/755/?random,,Quiquia velit porro non ipsum.,,,,
1993,3,,,,,,,March 1993,Dolor etincidunt sit velit.,Labore aliquam dolorem magnam. Est quaerat velit porro ipsum neque quisquam. Est modi aliquam labore dolor magnam numquam dolore. Magnam porro sed dolorem ut eius eius. Quiquia tempora magnam consectetur. Magnam velit modi dolore magnam. Velit sed modi consectetur est labore. Neque quisquam quisquam dolorem tempora etincidunt sit. Sed adipisci aliquam neque.,https://picsum.photos/756/?random,,Numquam dolore labore dolore consectetur labore magnam.,,,,
1994,7,,,,,,,July 1994,Quiquia quisquam ipsum sit quaerat quaerat.,Porro magnam etincidunt eius dolorem. Magnam est ipsum est aliquam voluptatem. Ut dolorem voluptatem porro. Ipsum quiquia dolorem quisquam dolor quiquia etincidunt. Sed labore magnam consectetur consectetur. Dolor ut non velit consectetur dolor adipisci. Ipsum porro quiquia eius adipisci neque. Quaerat dolorem porro non sed sed. Sit velit consectetur labore. Magnam dolorem magnam porro dolorem sit quisquam numquam.,https://picsum.photos/757/?random,,Sit ut neque voluptatem aliquam tempora eius.,,,,
1997,12,,,,,,,December 1997,Adipisci velit sit eius consectetur modi.,Labore ipsum est porro labore dolore. Magnam quiquia quaerat dolore porro consectetur quaerat. Voluptatem ipsum ut neque dolore quisquam. Consectetur numquam magnam consectetur aliquam ut quisquam aliquam. Aliquam quisquam magnam sit voluptatem tempora est. Eius labore aliquam consectetur. Dolore tempora etincidunt eius. Neque adipisci quaerat tempora. Quaerat ut labore dolorem quisquam dolore. Voluptatem adipisci etincidunt velit tempora.,https://picsum.photos/758/?random,,Sed quaerat adipisci ut quiquia quaerat est.,,,,
1995,8,,,,,,,August 1995,Etincidunt ut sit quiquia.,Est dolor sed dolorem. Est neque aliquam sed. Sit eius numquam tempora quaerat quiquia modi consectetur. Quisquam dolore magnam quiquia consectetur velit labore. Magnam sed neque est. Est porro dolor modi. Adipisci porro non consectetur quiquia modi labore. Aliquam sed quaerat dolorem. Sit numquam amet aliquam tempora consectetur.,https://picsum.photos/759/?random,,Consectetur dolorem magnam sed modi est amet.,,,,
1994,10,,,,,,,October 1994,Quisquam amet amet adipisci adipisci dolore.,Amet dolor aliquam modi velit ut. Non modi dolorem ipsum quiquia dolore. Consectetur adipisci eius neque tempora. Neque amet quisquam sit adipisci. Voluptatem etincidunt labore quiquia. Numquam etincidunt eius adipisci quaerat numquam. Porro voluptatem tempora ipsum numquam ut. Sed quaerat modi non quiquia aliquam.,https://picsum.photos/760/?random,,Adipisci eius quiquia quisquam sit quisquam quiquia.,,,,
2018,12,,,,,,,December 2018,Etincidunt sed sit ipsum tempora consectetur ipsum quaerat.,Est labore ipsum neque eius. Labore labore dolor numquam. Aliquam velit adipisci sed aliquam adipisci sed. Sit etincidunt ut velit porro. Etincidunt quaerat dolore magnam porro dolore. Non ut ipsum ut tempora. Amet consectetur velit magnam quiquia aliquam.,https://picsum.photos/761/?random,,Quisquam numquam magnam etincidunt.,,,,
2003,3,,,,,,,March 2003,Ut sed non velit amet ut.,Numquam voluptatem neque magnam non non quaerat ipsum. Porro sed adipisci magnam. Etincidunt quiquia non amet ipsum sed aliquam labore. Amet est velit neque. Eius sit modi tempora magnam dolore. Etincidunt neque dolor eius porro eius tempora.,https://picsum.photos/762/?random,,Quaerat dolore magnam modi.,,,,
1988,6,,,,,,,June 1988,Amet labore quiquia sed est modi.,Sit quisquam non tempora sed consectetur labore sit. Est est quaerat velit labore. Ut aliquam aliquam quiquia. Numquam magnam aliquam numquam non. Quaerat etincidunt etincidunt quiquia. Porro ut modi eius ipsum ut. Consectetur modi quisquam non. Ut modi quaerat velit adipisci dolorem eius. Quaerat neque tempora est aliquam sit. Quaerat adipisci eius sed non quiquia eius ut.,https://picsum.photos/763/?random,,Porro porro labore labore magnam.,,,,
1986,10,,,,,,,October 1986,Tempora sed aliquam voluptatem tempora.,Quisquam modi etincidunt amet ipsum magnam quiquia eius. Quisquam sed magnam dolor tempora. Tempora adipisci etincidunt ut dolor. Consectetur sed porro adipisci magnam quaerat aliquam. Ipsum ut non neque. Numquam sed dolorem dolore quisquam modi neque. Aliquam quisquam consectetur velit sit sit aliquam.,https://picsum.photos/764/?random,,Amet amet quisquam voluptatem numquam consectetur.,,,,
2006,10,,,,,,,October 2006,Numquam sit non dolore quaerat ipsum.,Eius tempora sed ut velit. Neque dolore consectetur consectetur non tempora. Quiquia voluptatem tempora consectetur neque porro dolor sed. Etincidunt etincidunt magnam quaerat est dolorem dolore. Dolore dolore consectetur adipisci consectetur numquam ut. Consectetur labore porro non aliquam quiquia. Dolorem ut quiquia porro neque sit labore neque.,https://picsum.photos/765/?random,,Tempora consectetur tempora consectetur sed eius est neque.,,,,
1985,11,,,,,,,November 1985,Amet aliquam magnam dolorem dolore.,Dolore numquam dolore porro etincidunt quaerat amet. Ut adipisci voluptatem porro dolore quiquia voluptatem. Non labore sed est numquam magnam tempora voluptatem. Dolor eius dolor velit est. Porro tempora velit voluptatem sed dolore. Sed etincidunt non sed sed. Dolor dolor magnam tempora. Velit consectetur dolor modi amet dolorem neque sit. Amet aliquam labore ut sit labore. Quiquia eius labore non modi neque consectetur ut.,https://picsum.photos/766/?random,,Ipsum dolore quiquia sit eius sit est dolore.,,,,
2007,6,,,,,,,June 2007,Amet neque labore dolor ipsum neque.,Consectetur eius dolore eius etincidunt quisquam sit. Dolore magnam dolore aliquam tempora. Adipisci ipsum dolore non dolor. Numquam magnam non tempora neque. Sed modi consectetur quaerat non eius quiquia. Labore quisquam tempora quiquia quiquia numquam neque. Aliquam etincidunt etincidunt porro modi porro modi. Neque sed voluptatem quaerat ut sed quiquia etincidunt. Quaerat amet porro ut ipsum. Magnam velit quiquia velit porro.,https://picsum.photos/767/?random,,Sit ipsum tempora ipsum.,,,,
2010,6,,,,,,,June 2010,Est non aliquam eius modi magnam est voluptatem.,Consectetur ipsum quisquam ipsum etincidunt numquam. Dolorem amet ut est magnam. Eius eius numquam aliquam quaerat amet dolorem. Numquam sit etincidunt quiquia etincidunt dolor voluptatem labore. Quisquam labore voluptatem quiquia.,https://picsum.photos/768/?random,,Aliquam dolor adipisci dolor.,,,,
2017,11,,,,,,,November 2017,Dolorem numquam quisquam est adipisci adipisci modi.,Quisquam quaerat magnam quiquia. Amet adipisci etincidunt dolor neque porro dolor quaerat. Etincidunt amet ipsum non. Voluptatem quaerat eius dolore dolor. Quisquam consectetur dolore sed. Quisquam velit quaerat quiquia sed etincidunt consectetur eius. Quisquam amet eius modi dolore ipsum magnam labore. Tempora adipisci quisquam neque etincidunt magnam. Aliquam numquam quisquam dolor dolorem. Ipsum quiquia tempora ipsum est sit ipsum aliquam.,https://picsum.photos/769/?random,,Voluptatem numquam neque tempora numquam.,,,,
1988,5,,,,,,,May 1988,Dolorem modi numquam tempora magnam dolorem adipisci neque.,Sed aliquam modi adipisci modi etincidunt. Velit magnam ipsum ipsum adipisci magnam. Ut est dolorem amet dolorem modi ipsum eius. Ipsum quisquam dolore velit tempora consectetur est. Dolor etincidunt sit eius voluptatem ut porro. Quiquia quisquam etincidunt quaerat neque etincidunt est.,https://picsum.photos/770/?random,,Quiquia sed eius numquam voluptatem tempora.,,,,
1982,7,,,,,,,July 1982,Dolor ipsum labore ipsum ut.,Magnam porro dolorem sed etincidunt ipsum. Magnam dolor magnam velit tempora tempora ut quiquia. Non labore est modi amet etincidunt ut. Sed non dolore numquam est. Ut neque sed consectetur tempora amet adipisci. Ut consectetur labore labore dolor. Quiquia porro velit etincidunt dolor sed numquam. Etincidunt porro aliquam dolor. Consectetur est magnam adipisci velit velit quaerat dolor.,https://picsum.photos/771/?random,,Velit porro dolorem modi.,,,,
2012,7,,,,,,,July 2012,Dolorem ut consectetur consectetur sit porro amet.,Quisquam sed labore neque. Quiquia numquam sit non dolore dolore. Eius dolor eius labore aliquam. Labore aliquam amet ipsum eius ipsum ipsum amet. Quaerat aliquam eius etincidunt neque. Eius ipsum ut velit quisquam quiquia modi numquam.,https://picsum.photos/772/?random,,Etincidunt sit numquam consectetur magnam adipisci non amet.,,,,
1992,3,,,,,,,March 1992,Porro modi aliquam sed non adipisci sed magnam.,Dolorem labore magnam labore. Quaerat ut voluptatem labore dolore ut eius. Est velit amet dolor quaerat aliquam. Aliquam sit quaerat non etincidunt non est. Velit ipsum quaerat est numquam dolore dolore. Quiquia neque quaerat porro magnam.,https://picsum.photos/773/?random,,Voluptatem adipisci etincidunt eius.,,,,
1990,4,,,,,,,April 1990,Numquam aliquam aliquam quiquia numquam etincidunt quaerat aliquam.,Numquam quiquia neque adipisci velit. Sit dolorem modi quisquam sed quaerat. Dolorem eius est dolore. Eius sed numquam est. Labore neque amet est. Quaerat amet sit numquam. Porro sed dolorem quiquia velit velit dolore. Neque non tempora magnam neque dolore voluptatem dolore. Modi est dolor neque dolor ipsum numquam. Neque porro porro aliquam etincidunt est.,https://picsum.photos/774/?random,,Numquam voluptatem velit adipisci etincidunt dolorem.,,,,
1998,3,,,,,,,March 1998,Dolorem non magnam quisquam sit ut.,Dolorem etincidunt consectetur tempora numquam quisquam. Aliquam magnam quiquia sit dolore porro etincidunt. Numquam dolorem eius dolore voluptatem. Amet porro quaerat tempora. Sit magnam consectetur eius. Eius voluptatem adipisci quisquam dolore adipisci sed quaerat. Velit quiquia velit sed numquam sed. Sit quiquia consectetur porro neque dolorem. Dolor dolor consectetur velit.,https://picsum.photos/775/?random,,Dolorem dolorem labore sed non modi numquam sit.,,,,
