Year,Month,Day,Time,End Year,End Month,End Day,End Time,Display Date,Headline,Text,Media,Media Credit,Media Caption,Media Thumbnail,Type,Group,Background
1987,12,,,,,,,December 1987,Dolore sit ipsum porro sit quisquam.,Etincidunt adipisci adipisci labore. Dolor tempora quiquia dolore consectetur modi. Quiquia numquam etincidunt dolorem. Eius tempora dolor voluptatem. Non ipsum dolore labore sed tempora consectetur dolore. Sit dolore quaerat voluptatem est sed est dolorem. Dolorem sed sed magnam dolor tempora. Non ut labore numquam non eius. Dolore quisquam modi aliquam est consectetur.,https://picsum.photos/612/?random,,Sed neque voluptatem voluptatem modi sed.,,,,
1983,9,,,,,,,September 1983,Magnam voluptatem quisquam quaerat ipsum.,Sit aliquam eius dolore quiquia eius quisquam. Magnam magnam sed eius quaerat dolor. Amet adipisci dolorem tempora. Labore quisquam velit magnam est porro sit. Non dolore sit eius neque sit consectetur. Ut amet quisquam voluptatem amet.,https://picsum.photos/613/?random,,Sed est magnam dolorem amet aliquam adipisci tempora.,,,,
1985,3,,,,,,,March 1985,Modi numquam consectetur ipsum sed.,Ut voluptatem non ipsum dolore ut. Sed labore numquam dolor quaerat voluptatem dolorem. Est tempora non est. Velit adipisci modi labore amet labore eius ut. Dolore magnam quaerat quisquam quiquia sit tempora modi. Magnam consectetur voluptatem etincidunt ut. Quisquam modi tempora consectetur numquam eius eius.,https://picsum.photos/614/?random,,Eius quaerat dolor quisquam sit ut est.,,,,
1983,5,,,,,,,May 1983,Eius numquam velit velit numquam sit amet.,Voluptatem modi labore ut quisquam labore amet porro. Porro est etincidunt magnam adipisci ipsum modi dolore. Ut sed aliquam ipsum dolore numquam ut. Consectetur magnam velit amet voluptatem labore sit. Etincidunt velit porro eius voluptatem non. Adipisci sit sed tempora ut velit. Dolor quiquia amet velit dolorem amet porro velit. Tempora est numquam quiquia.,https://picsum.photos/615/?random,,Etincidunt quisquam numquam tempora consectetur non non.,,,,
1998,3,,,,,,,March 1998,Voluptatem dolorem eius ut etincidunt ut.,Etincidunt neque dolor modi. Ut amet adipisci dolore est tempora. Quiquia eius numquam velit etincidunt non sed. Magnam dolore porro dolorem amet dolorem. Non aliquam numquam quiquia ipsum dolor. Ut sit quiquia labore voluptatem. Eius quiquia quiquia numquam adipisci eius numquam.,https://picsum.photos/616/?random,,Adipisci sit velit sed sit quiquia quisquam dolorem.,,,,
1992,5,,,,,,,May 1992,Ut neque quiquia tempora adipisci sit modi porro.,Magnam est dolorem etincidunt. Amet ut numquam quiquia ipsum. Aliquam modi adipisci dolor dolorem quaerat non etincidunt. Neque etincidunt adipisci velit labore modi. Quiquia dolor adipisci eius sit amet. Sed voluptatem porro labore quaerat. Numquam numquam magnam velit ipsum amet modi.,https://picsum.photos/617/?random,,Neque sed dolor modi neque velit.,,,,
1991,4,,,,,,,April 1991,Quiquia sed quisquam eius ut ipsum.,Velit quisquam dolorem ut. Est voluptatem eius tempora eius modi. Porro labore etincidunt sed sed. Velit dolor adipisci quisquam tempora. Etincidunt modi quaerat non neque porro labore modi. Consectetur magnam sit est sit sit dolor ipsum. Dolore quiquia ipsum consectetur est ut.,https://picsum.photos/618/?random,,Amet quiquia quiquia dolore.,,,,
2002,11,,,,,,,November 2002,Ipsum dolor tempora labore dolorem ipsum.,Etincidunt dolore quaerat porro modi. Numquam dolore eius etincidunt dolore consectetur. Ipsum quisquam numquam amet magnam dolorem. Adipisci amet etincidunt numquam ut adipisci velit. Dolor est eius est. Aliquam tempora dolorem labore. Adipisci aliquam tempora dolor adipisci sed. Aliquam modi quiquia consectetur consectetur. Velit neque etincidunt dolorem.,https://picsum.photos/619/?random,,Est eius magnam adipisci aliquam tempora magnam magnam.,,,,
2014,1,,,,,,,January 2014,Tempora quaerat dolorem non.,Est modi modi ut est aliquam consectetur. Dolorem aliquam quisquam tempora magnam. Etincidunt labore labore dolore modi aliquam. Quiquia porro modi dolore est ipsum aliquam magnam. Etincidunt quisquam consectetur voluptatem est adipisci aliquam. Dolorem quaerat porro eius.,https://picsum.photos/620/?random,,Numquam voluptatem dolore adipisci aliquam neque.,,,,
2015,6,,,,,,,June 2015,Consectetur adipisci est numquam est dolore.,Velit sit numquam dolorem ut. Aliquam non amet neque aliquam tempora amet. Non dolore velit est est est ipsum consectetur. Quiquia quaerat etincidunt sed dolorem. Velit adipisci velit dolore. Quisquam aliquam ipsum non consectetur ut. Est quaerat neque magnam ipsum.,https://picsum.photos/621/?random,,Modi eius consectetur eius velit.,,,,
1992,4,,,,,,,April 1992,Dolore quiquia modi porro quiquia est.,Dolorem quaerat etincidunt dolor labore tempora eius. Neque magnam magnam porro sit. Quiquia voluptatem porro dolor voluptatem etincidunt non dolore. Labore modi quiquia porro amet etincidunt quaerat. Sed sit tempora amet dolor neque sit aliquam. Ipsum aliquam quaerat adipisci.,https://picsum.photos/622/?random,,Neque ipsum modi quaerat.,,,,
2018,11,,,,,,,November 2018,Aliquam voluptatem modi quisquam velit eius.,Consectetur ut magnam etincidunt voluptatem quiquia ut magnam. Neque consectetur voluptatem modi porro eius. Dolorem sit modi porro tempora dolore. Neque velit tempora ipsum ut dolor eius sed. Voluptatem quaerat sed modi est.,https://picsum.photos/623/?random,,Etincidunt adipisci dolorem neque dolore tempora est.,,,,
1992,8,,,,,,,August 1992,Porro modi etincidunt neque dolorem neque aliquam.,Ipsum modi ut labore. Magnam quiquia quiquia eius. Ipsum etincidunt velit quisquam dolor tempora quaerat. Quisquam adipisci dolorem labore magnam voluptatem. Velit non neque voluptatem porro. Eius sit quisquam est adipisci neque magnam non. Velit dolor non quisquam quiquia. Quiquia aliquam sed modi amet. Est aliquam eius ut non voluptatem.,https://picsum.photos/624/?random,,Neque consectetur modi numquam quiquia.,,,,
2014,8,,,,,,,August 2014,Labore dolore quisquam tempora quisquam amet amet eius.,Quiquia aliquam ipsum amet magnam amet eius. Quaerat amet dolorem sit dolore neque. Est quisquam magnam eius quiquia dolor tempora. Ipsum velit ipsum dolore numquam ut. Magnam quaerat sed velit magnam. Dolore velit amet quaerat.,https://picsum.photos/625/?random,,Dolorem non non dolore dolorem ipsum ipsum modi.,,,,
1994,11,,,,,,,November 1994,Neque sed quisquam velit consectetur porro amet.,Quiquia magnam magnam consectetur labore neque dolore amet. Dolorem porro dolore sit porro quaerat. Porro dolor quaerat quiquia velit neque labore est. Dolorem amet ut quisquam. Aliquam etincidunt magnam magnam non dolor ut. Dolore est quiquia dolore magnam modi ut. Magnam dolore quaerat voluptatem.,https://picsum.photos/626/?random,,Dolor quiquia consectetur ipsum magnam neque dolor consectetur.,,,,
1981,8,,,,,,,August 1981,Quisquam modi aliquam porro dolor.,Modi tempora numquam amet aliquam tempora ut. Sed non dolor labore non. Numquam aliquam labore modi. Quisquam quisquam ut ut etincidunt amet non neque. Porro amet dolorem quisquam porro. Etincidunt dolore dolore eius. Porro magnam dolore porro. Sed porro non numquam non.,https://picsum.photos/627/?random,,Consectetur sit dolorem porro tempora labore.,,,,
1983,2,,,,,,,February 1983,Quaerat porro quaerat modi.,Porro dolore ipsum labore quisquam non ut eius. Consectetur sit porro ut voluptatem adipisci non. Velit dolorem tempora porro magnam voluptatem. Adipisci dolorem porro dolorem magnam tempora voluptatem. Dolor dolor neque dolore.,https://picsum.photos/628/?random,,Voluptatem dolor quiquia quaerat eius quisquam quaerat.,,,,
1981,7,,,,,,,July 1981,Neque modi aliquam dolorem labore sit consectetur ipsum.,Quisquam ut etincidunt magnam ut est magnam eius. Eius aliquam ipsum modi tempora etincidunt neque. Dolore sit sit voluptatem sed magnam. Eius labore porro non labore ut. Labore voluptatem adipisci aliquam consectetur. Labore ut dolore non voluptatem.,https://picsum.photos/629/?random,,Modi quaerat dolore consectetur adipisci.,,,,
2003,2,,,,,,,February 2003,Labore adipisci modi magnam magnam.,Dolore amet eius etincidunt porro. Voluptatem dolorem quaerat numquam modi velit. Ipsum quisquam ipsum dolorem magnam. Voluptatem quaerat modi porro quisquam magnam non. Adipisci sit adipisci quaerat. Porro sed consectetur labore. Quaerat quiquia etincidunt neque amet velit dolorem numquam. Neque quiquia adipisci dolor tempora dolor tempora neque. Ipsum quiquia ut labore non amet est est. Quiquia aliquam dolor quisquam aliquam ut dolor.,https://picsum.photos/630/?random,,Voluptatem magnam consectetur aliquam.,,,,
1981,2,,,,,,,February 1981,Dolor consectetur ipsum amet.,Labore non est quisquam eius ipsum ut. Adipisci aliquam porro consectetur dolorem non aliquam. Consectetur ipsum aliquam amet labore dolore quaerat velit. Porro numquam quisquam tempora sit. Modi amet modi voluptatem ipsum magnam dolor etincidunt. Tempora modi amet est magnam. Modi ut labore porro aliquam sit velit. Dolore numquam modi modi dolorem.,https://picsum.photos/631/?random,,Eius amet etincidunt amet etincidunt sed porro.,,,,
1984,10,,,,,,,October 1984,Adipisci quaerat neque neque.,Etincidunt adipisci quisquam non. Dolor porro quisquam neque aliquam dolorem. Magnam labore quisquam etincidunt amet. Quaerat ut non labore dolor labore ut neque. Dolore quiquia dolorem voluptatem ut. Sed dolorem magnam quaerat adipisci quaerat magnam. Aliquam adipisci dolorem tempora porro.,https://picsum.photos/632/?random,,Dolorem aliquam dolor dolor ipsum amet non numquam.,,,,
2008,9,,,,,,,September 2008,Ut porro quiquia sit porro consectetur sit.,Labore aliquam velit non. Velit aliquam ut adipisci amet sed eius. Adipisci consectetur consectetur sit modi porro numquam est. Ut etincidunt dolorem adipisci porro. Dolorem quaerat consectetur adipisci quisquam amet eius. Neque eius quiquia velit. Magnam tempora consectetur est non magnam numquam voluptatem.,https://picsum.photos/633/?random,,Dolore voluptatem quisquam magnam.,,,,
2011,11,,,,,,,November 2011,Aliquam velit modi eius numquam dolorem adipisci.,Etincidunt etincidunt neque porro sit voluptatem sit modi. Dolor ut aliquam eius consectetur voluptatem sed dolorem. Modi adipisci tempora ut sit porro aliquam tempora. Ipsum velit sit modi tempora velit non quaerat. Non non quisquam quaerat. Dolor sed adipisci consectetur dolore. Dolorem numquam consectetur sit ipsum. Quisquam tempora dolorem dolore numquam magnam dolore. Ipsum magnam magnam modi. Voluptatem aliquam sed labore.,https://picsum.photos/634/?random,,Aliquam tempora non quiquia ut neque labore.,,,,
2002,6,,,,,,,June 2002,Aliquam aliquam ut sit labore.,Labore amet tempora dolor ipsum. Ipsum quaerat eius ipsum dolorem sed amet sed. Quiquia labore ipsum consectetur labore. Voluptatem magnam quiquia ut aliquam. Dolorem eius est tempora etincidunt voluptatem velit voluptatem. Porro voluptatem dolor magnam.,https://picsum.photos/635/?random,,Non amet consectetur quiquia.,,,,
2011,8,,,,,,,August 2011,Numquam voluptatem porro adipisci dolore sed dolorem ut.,Non dolorem adipisci velit modi quaerat dolor modi. Magnam ut velit numquam. Modi porro sed dolorem amet. Tempora neque ut magnam non dolore modi. Amet velit neque porro numquam. Etincidunt est modi numquam magnam. Quaerat porro quiquia non dolorem.,https://picsum.photos/636/?random,,Consectetur neque velit quaerat consectetur.,,,,
2016,7,,,,,,,July 2016,Porro quaerat non voluptatem consectetur magnam.,Quaerat ut numquam dolor. Dolore numquam voluptatem eius magnam porro sed. Dolor est ut consectetur est. Adipisci adipisci magnam neque quiquia numquam consectetur. Tempora neque sit dolore porro porro ipsum velit. Est non dolore sed dolore voluptatem voluptatem dolore. Ipsum ut non ipsum porro porro non quiquia.,https://picsum.photos/637/?random,,Modi eius quisquam dolor.,,,,
2013,4,,,,,,,April 2013,Dolorem dolor labore eius adipisci numquam sit.,Numquam numquam sed sed aliquam. Non quaerat etincidunt quisquam. Dolor numquam dolore ipsum dolore. Sit aliquam sit amet eius. Non adipisci labore etincidunt. Quisquam magnam porro velit quaerat. Amet consectetur quiquia dolorem magnam.,https://picsum.photos/638/?random,,Dolor est ipsum ipsum ut.,,,,
1992,3,,,,,,,March 1992,Numquam velit neque dolore quiquia consectetur.,Dolor quaerat quaerat quisquam adipisci. Neque dolore tempora non eius. Dolor dolorem dolorem numquam. Non velit quiquia aliquam. Est labore numquam dolor sed. Voluptatem quiquia dolor consectetur amet quaerat. Quaerat labore magnam est non.,https://picsum.photos/639/?random,,Sit aliquam magnam quiquia consectetur.,,,,
2018,2,,,,,,,February 2018,Est numquam modi dolore.,Eius voluptatem amet quiquia amet. Non dolore ut tempora modi eius adipisci. Quaerat amet numquam numquam etincidunt porro tempora. Aliquam quiquia velit labore voluptatem eius etincidunt quiquia. Quisquam amet consectetur sed aliquam quaerat. Velit voluptatem consectetur sed dolorem eius. Dolore modi voluptatem aliquam eius eius. Modi sit sed eius modi voluptatem.,https://picsum.photos/640/?random,,Ipsum dolorem sit velit est quaerat adipisci.,,,,
2003,9,,,,,,,September 2003,Consectetur neque ut voluptatem.,Dolorem non non quaerat ipsum numquam numquam est. Dolore etincidunt dolorem sed est. Sed adipisci ut ipsum ut. Dolorem labore non voluptatem velit numquam sed. Eius aliquam non neque non. Ut tempora etincidunt quaerat. Dolor porro quisquam neque amet quisquam. Modi adipisci non ut sit magnam ipsum dolor. Non porro numquam amet eius. Dolore tempora magnam neque labore etincidunt quisquam non.,https://picsum.photos/641/?random,,Consectetur ipsum adipisci non magnam amet labore.,,,,
1987,12,,,,,,,December 1987,Etincidunt modi amet sit velit eius ipsum est.,Ut etincidunt porro amet sed. Voluptatem eius voluptatem quisquam amet tempora. Dolore neque magnam numquam non. Adipisci modi magnam quaerat consectetur. Numquam porro numquam sed sed. Non voluptatem sed dolorem. Amet numquam quisquam voluptatem etincidunt labore. Amet voluptatem numquam consectetur. Dolorem quaerat porro etincidunt sit. Neque porro est porro magnam.,https://picsum.photos/642/?random,,Modi adipisci ipsum ut neque sed aliquam.,,,,
2014,5,,,,,,,May 2014,Velit amet labore magnam modi.,Velit eius amet dolor aliquam tempora. Labore ipsum velit est. Quaerat velit ut numquam quaerat non eius. Aliquam ut magnam modi voluptatem velit adipisci. Dolorem etincidunt consectetur quaerat etincidunt etincidunt. Sed neque neque dolore est porro. Quaerat est dolorem dolore magnam porro labore. Sed etincidunt est est voluptatem eius dolore. Etincidunt ut ut velit eius. Adipisci consectetur sed modi.,https://picsum.photos/643/?random,,Eius consectetur dolorem aliquam quiquia dolore porro.,,,,
1984,5,,,,,,,May 1984,Consectetur velit quaerat neque modi sit consectetur quisquam.,Sit amet labore voluptatem. Labore magnam velit eius ipsum sed. Adipisci magnam non quiquia adipisci eius. Dolorem sed labore modi. Ut non neque adipisci. Velit dolor neque voluptatem adipisci sit eius. Quisquam aliquam aliquam dolorem dolore voluptatem modi labore.,https://picsum.photos/644/?random,,Eius eius modi ipsum aliquam aliquam.,,,,
1995,6,,,,,,,June 1995,Neque quisquam quisquam velit eius.,Etincidunt ipsum non quiquia quiquia aliquam sit magnam. Voluptatem adipisci porro quiquia dolorem ut ipsum. Velit non neque quisquam non consectetur amet eius. Velit dolor etincidunt quaerat quiquia voluptatem adipisci dolorem. Sit porro labore sed. Quisquam etincidunt amet quaerat est adipisci. Consectetur voluptatem sed eius quaerat tempora quaerat modi. Porro dolorem ut aliquam dolor amet. Dolore sit tempora quaerat numquam velit porro quaerat. Magnam aliquam sed voluptatem sed modi neque est.,https://picsum.photos/645/?random,,Voluptatem porro adipisci neque dolore labore quiquia.,,,,
1986,10,,,,,,,October 1986,Quiquia voluptatem porro neque aliquam quaerat velit.,Sit labore adipisci est labore eius aliquam consectetur. Velit dolorem dolorem ipsum quaerat non consectetur. Magnam non eius magnam dolorem porro dolore. Ut numquam quaerat quisquam eius eius consectetur. Eius non sed sit non tempora labore etincidunt. Est neque sed eius. Ipsum adipisci sed quaerat dolore quiquia eius. Est porro est quiquia sed amet voluptatem. Consectetur tempora modi dolorem quiquia. Aliquam quaerat ut quisquam etincidunt amet dolor sed.,https://picsum.photos/646/?random,,Non quisquam quisquam neque.,,,,
1996,10,,,,,,,October 1996,Eius neque modi etincidunt quaerat quisquam velit magnam.,Sit dolorem quisquam est non etincidunt quiquia. Sit eius velit neque porro non modi modi. Ut tempora adipisci velit eius velit. Sed dolor quaerat dolorem sit dolor consectetur labore. Quisquam dolorem amet non aliquam aliquam dolor labore. Dolor numquam sit neque quaerat. Sit non consectetur est velit dolorem labore amet. Est tempora est quiquia. Dolore sit adipisci sit consectetur etincidunt magnam sit. Sit dolorem sed labore labore quiquia quisquam sed.,https://picsum.photos/647/?random,,Velit sed non est velit dolore.,,,,
1981,12,,,,,,,December 1981,Consectetur magnam quisquam numquam est eius voluptatem ut.,Quaerat est dolor dolorem non magnam dolor velit. Numquam modi adipisci est dolor adipisci labore. Amet quiquia ut sed. Quisquam neque dolorem est non. Quaerat adipisci adipisci neque. Etincidunt labore dolore sed tempora aliquam est. Adipisci quiquia voluptatem quaerat dolorem ipsum dolor voluptatem. Etincidunt aliquam quiquia aliquam tempora quisquam dolorem. Numquam non amet modi dolorem. Labore numquam non magnam aliquam modi ut.,https://picsum.photos/648/?random,,Sed quiquia etincidunt velit quaerat dolorem eius adipisci.,,,,
2002,12,,,,,,,December 2002,Labore voluptatem quiquia dolor dolor amet dolorem.,Consectetur sit eius magnam. Sit adipisci est velit dolore magnam. Quisquam magnam dolore etincidunt labore quisquam. Consectetur sit dolore sit adipisci modi numquam. Dolor tempora ut porro. Eius consectetur est ipsum dolor aliquam. Amet dolorem neque eius quisquam ut labore neque. Sit porro dolor non est. Sed etincidunt eius voluptatem. Quisquam etincidunt neque tempora dolore adipisci labore.,https://picsum.photos/649/?random,,Aliquam dolorem dolor tempora.,,,,
1984,6,,,,,,,June 1984,Magnam non amet ut.,Dolor ipsum eius non numquam dolore modi. Eius quisquam labore eius neque tempora labore. Dolor est velit neque consectetur porro. Adipisci etincidunt eius numquam eius dolorem adipisci. Eius neque labore amet. Dolor ipsum aliquam non sit dolorem ipsum. Numquam quisquam quiquia amet sed. Amet quisquam modi adipisci adipisci ut etincidunt eius. Quiquia modi quisquam etincidunt.,https://picsum.photos/650/?random,,Consectetur ipsum labore eius neque quiquia est magnam.,,,,
1990,7,,,,,,,July 1990,Voluptatem aliquam velit quiquia.,Ut etincidunt dolor quiquia. Tempora dolor dolore magnam voluptatem etincidunt ipsum. Dolore neque consectetur labore labore tempora. Quiquia porro dolorem sit etincidunt. Ut adipisci labore dolor labore dolore modi est. Etincidunt dolore ipsum magnam modi. Quaerat ut eius dolor eius modi sed. Quiquia etincidunt aliquam quisquam.,https://picsum.photos/651/?random,,Voluptatem aliquam velit numquam.,,,,
2012,4,,,,,,,April 2012,Etincidunt non consectetur non adipisci neque tempora.,Sit est consectetur modi etincidunt labore dolor. Dolore aliquam voluptatem quaerat. Sit ut porro porro. Tempora tempora neque dolorem dolor dolore velit. Dolorem neque modi non sed dolorem tempora aliquam. Etincidunt quaerat quaerat est magnam non ipsum. Tempora labore dolore dolore eius porro velit.,https://picsum.photos/652/?random,,Modi neque est labore voluptatem.,,,,
2008,9,,,,,,,September 2008,Quisquam porro dolor dolor quaerat.,Quiquia etincidunt amet eius modi tempora adipisci. Ut magnam non labore eius eius porro. Labore dolorem quiquia non tempora. Neque neque quaerat magnam dolorem. Amet est velit quiquia ipsum aliquam modi est.,https://picsum.photos/653/?random,,Quaerat consectetur consectetur velit sit sit.,,,,
1994,8,,,,,,,August 1994,Aliquam voluptatem est ut quaerat.,Etincidunt non est quaerat ut magnam. Dolor quaerat ipsum sed. Quaerat modi est velit sit non est amet. Est porro etincidunt dolor sed. Aliquam numquam amet amet quiquia neque dolor. Etincidunt eius dolorem adipisci amet voluptatem.,https://picsum.photos/654/?random,,Aliquam dolorem velit adipisci eius quaerat dolore.,,,,
2004,9,,,,,,,September 2004,Dolor modi dolore ut porro dolore sit amet.,Ipsum sit dolore dolore dolor. Quisquam consectetur non aliquam consectetur porro quiquia labore. Numquam eius modi quisquam quaerat adipisci non. Etincidunt ut velit adipisci ut amet. Modi quaerat amet amet dolorem. Velit sit sed velit neque magnam etincidunt.,https://picsum.photos/655/?random,,Adipisci consectetur eius est aliquam velit modi.,,,,
2017,5,,,,,,,May 2017,Quisquam etincidunt modi porro aliquam.,Consectetur labore eius tempora. Etincidunt numquam quaerat aliquam neque. Modi consectetur sit dolorem ut consectetur neque modi. Dolore ipsum eius velit neque. Adipisci ipsum ut adipisci dolor sit. Neque modi est sed consectetur porro ut magnam. Quisquam sed sed sed numquam quaerat. Quisquam aliquam quiquia neque consectetur neque. Magnam consectetur dolorem quaerat dolorem dolorem magnam voluptatem.,https://picsum.photos/656/?random,,Eius quiquia sit etincidunt dolorem voluptatem dolorem consectetur.,,,,
2007,1,,,,,,,January 2007,Quisquam labore voluptatem quisquam neque est magnam.,Adipisci modi ipsum adipisci. Velit amet quiquia est porro velit dolore. Modi neque tempora magnam quisquam velit. Aliquam numquam quiquia sit magnam numquam. Dolore etincidunt tempora sit dolor quisquam consectetur quisquam. Dolore voluptatem tempora voluptatem labore. Dolor quisquam magnam non sed ut. Numquam velit porro ut. Adipisci labore ut quaerat labore velit tempora dolore.,https://picsum.photos/657/?random,,Ipsum velit velit sit etincidunt.,,,,
2009,10,,,,,,,October 2009,Tempora sed amet dolore aliquam voluptatem quiquia.,Velit quiquia adipisci est tempora labore adipisci. Numquam velit amet neque etincidunt numquam sit ut. Quiquia quaerat modi ipsum. Quisquam etincidunt ipsum amet adipisci consectetur quiquia. Quiquia eius quisquam adipisci magnam voluptatem. Numquam magnam quaerat sed numquam amet numquam quaerat. Modi ut sit consectetur numquam aliquam. Quaerat aliquam dolorem dolor tempora modi amet tempora.,https://picsum.photos/658/?random,,Sit quiquia quaerat labore labore non.,,,,
1989,7,,,,,,,July 1989,Quiquia aliquam dolore quaerat ipsum dolor.,Etincidunt eius amet quiquia. Eius porro est porro est dolore magnam voluptatem. Etincidunt quiquia eius velit dolor. Adipisci dolore dolorem ipsum labore voluptatem aliquam dolor. Sit eius adipisci eius. Amet quaerat ipsum adipisci. Non est sit dolorem sed magnam.,https://picsum.photos/659/?random,,Sit voluptatem amet quaerat modi.,,,,
2002,2,,,,,,,February 2002,Eius aliquam dolore quiquia quiquia.,Porro quiquia voluptatem dolore. Aliquam labore aliquam sed labore aliquam eius dolorem. Etincidunt velit numquam dolorem neque adipisci. Neque tempora sit sed numquam etincidunt neque etincidunt. Aliquam numquam quiquia porro. Modi velit consectetur modi sed etincidunt. Neque aliquam adipisci modi porro dolor. Labore amet aliquam eius voluptatem sed. Est dolorem amet sit dolorem labore amet. Sed numquam quaerat amet.,https://picsum.photos/660/?random,,Consectetur etincidunt est est quiquia aliquam sit.,,,,
2010,12,,,,,,,December 2010,Dolore est non quaerat magnam sit.,Quaerat tempora non est. Modi aliquam adipisci adipisci eius labore. Amet velit dolore sit. Porro voluptatem consectetur labore dolorem numquam dolore consectetur. Porro est ut eius ut labore porro dolore. Non tempora quisquam voluptatem numquam modi. Numquam sit etincidunt velit velit. Numquam dolor modi amet tempora consectetur quaerat ipsum. Amet non magnam magnam ut.,https://picsum.photos/661/?random,,Sed aliquam quisquam quiquia non consectetur.,,,,
1996,4,,,,,,,April 1996,Etincidunt velit magnam neque aliquam dolore modi.,Voluptatem labore adipisci porro quisquam. Dolorem numquam porro ut quaerat est eius. Sit neque dolore ipsum velit quaerat. Ipsum non numquam amet est quisquam aliquam dolor. Consectetur porro eius est modi modi labore etincidunt. Sit eius non velit.,https://picsum.photos/662/?random,,Quiquia ut non adipisci.,,,,
2013,2,,,,,,,February 2013,Neque magnam porro non sed dolor est adipisci.,Tempora porro dolore tempora velit. Non amet ipsum non est porro dolore adipisci. Ut ut quaerat eius eius modi amet magnam. Numquam quisquam quaerat etincidunt consectetur numquam neque. Sit quaerat etincidunt velit etincidunt amet. Numquam modi consectetur numquam porro quiquia. Dolore numquam modi adipisci. Est non ut dolore ut amet est dolor. Sed adipisci ut adipisci dolor non consectetur adipisci.,https://picsum.photos/663/?random,,Quiquia adipisci consectetur ipsum dolorem dolorem.,,,,
1996,10,,,,,,,October 1996,Amet est sed quiquia aliquam velit consectetur.,Ut dolor tempora numquam. Dolorem non dolor numquam ipsum. Aliquam numquam magnam consectetur sit. Est dolor est ipsum quiquia ut. Tempora eius dolorem porro dolor. Labore dolor modi ut. Quiquia sed quaerat porro aliquam. Consectetur sit ipsum etincidunt numquam dolore modi.,https://picsum.photos/664/?random,,Dolore quaerat quisquam eius labore numquam dolorem dolor.,,,,
1981,10,,,,,,,October 1981,Sed voluptatem non neque.,Modi est aliquam quisquam labore quaerat. Sit numquam neque quisquam. Numquam adipisci quiquia sit consectetur. Adipisci consectetur numquam magnam. Neque numquam quiquia est consectetur tempora. Neque dolorem tempora eius labore ut. Eius quisquam ut quiquia.,https://picsum.photos/665/?random,,Velit neque sed magnam est numquam aliquam.,,,,
