Year,Month,Day,Time,End Year,End Month,End Day,End Time,Display Date,Headline,Text,Media,Media Credit,Media Caption,Media Thumbnail,Type,Group,Background
1999,,,,,,,,1999,Dolor velit adipisci labore eius.,Numquam labore sit magnam dolorem ipsum dolorem. Sit amet quaerat voluptatem numquam labore ut. Numquam dolorem sit dolore. Numquam modi modi adipisci voluptatem labore. Sit ipsum ipsum adipisci. Non modi ipsum etincidunt porro labore quisquam porro.,https://picsum.photos/501/?random,,Labore quisquam consectetur etincidunt quisquam.,,,,
1998,,,,,,,,1998,Numquam non eius voluptatem est sed sit neque.,Dolorem numquam adipisci non velit non. Consectetur magnam velit numquam magnam etincidunt modi. Est ut consectetur adipisci voluptatem. Eius adipisci voluptatem eius. Neque dolor amet est tempora. Dolorem sit sed voluptatem ipsum neque.,https://picsum.photos/502/?random,,Voluptatem quiquia est ipsum magnam eius dolore aliquam.,,,,
1998,,,,,,,,1998,Modi tempora amet magnam amet.,Aliquam est dolorem labore quiquia dolorem ipsum. Labore neque neque neque porro sed. Quiquia amet numquam ut dolorem dolor. Aliquam tempora dolore numquam est ut dolor amet. Ipsum sit ipsum ipsum magnam. Dolor etincidunt amet eius sit modi numquam.,https://picsum.photos/503/?random,,Voluptatem adipisci sit quisquam.,,,,
2014,,,,,,,,2014,Sed dolorem magnam porro modi.,Quisquam quisquam non neque porro est ipsum. Voluptatem eius dolor dolor non dolor. Adipisci non dolor non quiquia quiquia amet. Voluptatem quiquia dolore sit. Adipisci modi dolor dolorem est dolor aliquam. Est neque amet ipsum aliquam aliquam. Eius labore quisquam adipisci eius. Modi quisquam sit dolorem. Eius velit adipisci neque non. Modi velit velit quiquia.,https://picsum.photos/504/?random,,Eius dolorem est non.,,,,
1987,,,,,,,,1987,Quisquam dolor porro ut ut non.,Quiquia quaerat est ipsum quiquia labore dolorem ut. Sed modi modi magnam modi. Velit modi non amet quiquia sit. Aliquam magnam ut non ipsum. Modi est non quiquia modi. Ipsum modi dolore sit magnam modi. Dolorem non dolorem amet quiquia porro ipsum. Amet sed neque numquam amet porro porro. Etincidunt dolor modi labore velit est velit est.,https://picsum.photos/505/?random,,Aliquam dolorem dolore quiquia sed aliquam.,,,,
1988,,,,,,,,1988,Labore modi ipsum labore.,Labore voluptatem velit numquam neque etincidunt tempora etincidunt. Modi velit numquam etincidunt. Magnam ut dolorem adipisci amet. Aliquam ut amet aliquam. Dolore voluptatem dolor sed dolor dolor. Dolorem dolorem dolore neque. Labore adipisci amet dolor eius voluptatem etincidunt consectetur. Sit dolor consectetur numquam adipisci magnam. Dolor modi quaerat etincidunt sit voluptatem.,https://picsum.photos/506/?random,,Tempora labore sed numquam sed.,,,,
1995,,,,,,,,1995,Etincidunt aliquam neque porro magnam.,Labore voluptatem aliquam quisquam. Velit modi velit quaerat ipsum sed sit. Magnam sit non adipisci. Amet quiquia non ipsum dolor amet. Aliquam quiquia velit dolore ipsum velit etincidunt. Etincidunt sit numquam numquam numquam labore aliquam dolor. Sit modi adipisci sit. Aliquam modi modi etincidunt quisquam ut non numquam.,https://picsum.photos/507/?random,,Sit dolorem modi amet etincidunt etincidunt consectetur.,,,,
1995,,,,,,,,1995,Ipsum aliquam eius numquam ut dolor.,Consectetur aliquam modi quaerat modi. Voluptatem non quaerat numquam. Numquam porro dolore est dolore est neque. Amet sit quaerat aliquam etincidunt sed porro. Sit voluptatem tempora ipsum dolorem voluptatem. Quiquia eius non quisquam. Dolorem etincidunt quiquia tempora etincidunt modi.,https://picsum.photos/508/?random,,Adipisci tempora non ut adipisci tempora adipisci tempora.,,,,
2003,,,,,,,,2003,Dolorem numquam tempora dolorem.,Labore est amet labore modi consectetur ipsum. Eius quisquam quisquam quiquia dolore ut voluptatem etincidunt. Voluptatem neque ipsum magnam. Non quiquia ut labore numquam est voluptatem aliquam. Labore est velit ut.,https://picsum.photos/509/?random,,Adipisci numquam dolore porro quisquam numquam.,,,,
1983,,,,,,,,1983,Consectetur velit quisquam ipsum.,Dolorem est consectetur porro quisquam quiquia. Porro magnam etincidunt porro aliquam. Non ut est eius dolorem quaerat aliquam. Neque sed porro ut aliquam aliquam ut quaerat. Consectetur non quaerat quiquia. Neque eius sed modi dolor neque dolore ipsum. Amet velit porro modi aliquam modi est.,https://picsum.photos/510/?random,,Tempora aliquam quaerat numquam ut numquam aliquam sit.,,,,
2004,,,,,,,,2004,Quisquam dolor quisquam sit dolor.,Velit modi etincidunt labore velit. Sed quiquia consectetur adipisci ut sit. Adipisci magnam dolore etincidunt. Quaerat dolorem quiquia dolore consectetur. Est sit sit dolorem modi. Dolorem amet ipsum eius dolore ipsum. Ipsum magnam non aliquam labore tempora non ut.,https://picsum.photos/511/?random,,Ut eius numquam consectetur.,,,,
2007,,,,,,,,2007,Sed neque amet voluptatem voluptatem.,Consectetur quaerat amet velit amet modi ut neque. Velit ut non sed neque non. Voluptatem adipisci velit labore. Quisquam modi sed consectetur adipisci neque neque dolore. Amet amet non porro non tempora. Dolorem est porro magnam magnam modi dolore neque.,https://picsum.photos/512/?random,,Magnam amet velit consectetur tempora dolorem.,,,,
1988,,,,,,,,1988,Porro sed etincidunt aliquam etincidunt porro.,Tempora non amet quisquam aliquam quisquam. Porro neque porro quiquia dolore neque dolor. Numquam numquam magnam tempora sit dolore dolore neque. Labore sed porro porro numquam porro. Dolore sit neque tempora eius ut modi est. Aliquam amet labore quisquam adipisci. Non aliquam consectetur labore numquam quisquam. Ut magnam neque amet quaerat. Neque labore voluptatem dolorem quaerat porro.,https://picsum.photos/513/?random,,Neque etincidunt ut labore.,,,,
1980,,,,,,,,1980,Velit sit ut tempora dolore quaerat sit.,Velit dolore quiquia porro ut non sed. Consectetur sit ipsum velit porro aliquam. Ut etincidunt quisquam consectetur dolore neque labore. Quiquia dolor numquam modi. Voluptatem quaerat dolor neque. Dolor velit porro ut. Consectetur amet neque neque etincidunt voluptatem. Magnam est non adipisci tempora.,https://picsum.photos/514/?random,,Labore neque ipsum etincidunt voluptatem quisquam dolorem.,,,,
1984,,,,,,,,1984,Velit voluptatem tempora dolore dolorem dolor dolore.,Porro etincidunt voluptatem sit eius. Dolor neque amet etincidunt ipsum numquam est. Sed neque dolorem quiquia aliquam. Etincidunt quiquia consectetur quiquia dolor modi quaerat. Adipisci ipsum amet tempora consectetur consectetur labore. Numquam magnam etincidunt ipsum dolor ipsum modi. Non voluptatem amet aliquam aliquam velit quisquam. Quiquia consectetur quiquia sed etincidunt labore est. Voluptatem quisquam numquam dolore. Dolorem est ipsum quiquia adipisci porro labore.,https://picsum.photos/515/?random,,Dolorem aliquam amet amet dolorem amet.,,,,
1984,,,,,,,,1984,Aliquam ut dolorem quaerat dolore non magnam.,Tempora etincidunt numquam numquam velit sit. Dolor ut modi etincidunt. Ipsum quiquia numquam neque est neque consectetur. Est velit sit sit quiquia est. Magnam dolore dolorem velit est etincidunt dolor aliquam. Dolore sed ut magnam. Ipsum dolor amet modi etincidunt eius eius dolorem.,https://picsum.photos/516/?random,,Sit tempora neque consectetur non sit dolor.,,,,
1988,,,,,,,,1988,Aliquam quiquia etincidunt dolorem.,Ut est labore quaerat quaerat. Non est dolorem amet consectetur. Sed est quiquia numquam. Ipsum dolor modi est aliquam aliquam aliquam sit. Voluptatem consectetur numquam dolor voluptatem velit. Aliquam neque quiquia modi est quaerat amet aliquam. Numquam aliquam porro dolor dolore aliquam.,https://picsum.photos/517/?random,,Numquam amet quisquam adipisci dolore neque magnam sed.,,,,
1987,,,,,,,,1987,Porro dolore consectetur quiquia.,Quiquia dolor sit voluptatem amet non. Magnam ipsum quiquia voluptatem dolore. Ipsum tempora porro sit dolorem est. Etincidunt labore amet labore. Aliquam velit amet modi sed.,https://picsum.photos/518/?random,,Velit porro numquam ipsum etincidunt ipsum dolore magnam.,,,,
2011,,,,,,,,2011,Dolorem numquam non quaerat.,Neque magnam quisquam aliquam consectetur quiquia sed voluptatem. Velit non quiquia etincidunt sit velit neque aliquam. Etincidunt consectetur velit dolor eius dolor dolorem. Velit tempora est ipsum eius. Velit tempora neque eius numquam modi. Etincidunt etincidunt adipisci sed magnam.,https://picsum.photos/519/?random,,Magnam adipisci dolor quiquia labore non.,,,,
2009,,,,,,,,2009,Ipsum porro ipsum adipisci dolore voluptatem velit adipisci.,Quaerat amet voluptatem tempora consectetur magnam voluptatem. Modi tempora neque quisquam velit. Non neque sit amet. Quisquam quiquia ut dolor aliquam quaerat amet. Quaerat velit neque non magnam. Adipisci tempora sed sed consectetur non amet velit.,https://picsum.photos/520/?random,,Dolor ipsum velit consectetur dolor quisquam.,,,,
2001,,,,,,,,2001,Tempora dolor sed dolore adipisci etincidunt.,Quaerat quisquam dolore tempora. Numquam numquam est sit eius aliquam. Numquam sit dolor quisquam ipsum numquam. Quaerat voluptatem aliquam magnam eius neque est. Quiquia numquam neque aliquam etincidunt quaerat quaerat.,https://picsum.photos/521/?random,,Voluptatem dolor quiquia etincidunt quaerat quisquam.,,,,
1999,,,,,,,,1999,Ut est dolor numquam porro est porro voluptatem.,Quaerat sit quiquia labore aliquam sit voluptatem voluptatem. Labore consectetur velit ipsum dolore labore. Labore voluptatem adipisci neque amet ut quaerat. Sit sit quaerat dolor dolorem. Tempora dolorem neque eius voluptatem magnam voluptatem adipisci. Dolorem est aliquam quisquam tempora magnam magnam. Est labore etincidunt sed.,https://picsum.photos/522/?random,,Adipisci velit est numquam.,,,,
2015,,,,,,,,2015,Aliquam porro non non amet eius aliquam.,Neque consectetur eius labore quiquia etincidunt. Adipisci sit consectetur voluptatem porro dolor. Quaerat ipsum porro dolorem amet. Modi adipisci quisquam sed consectetur velit consectetur. Sed numquam non quisquam quaerat dolor ut.,https://picsum.photos/523/?random,,Adipisci quiquia adipisci quiquia ut dolorem.,,,,
2009,,,,,,,,2009,Numquam aliquam est amet.,Non sed aliquam consectetur non eius. Tempora adipisci voluptatem voluptatem magnam amet. Eius sed modi aliquam. Quisquam dolore numquam dolorem tempora aliquam. Numquam quaerat quiquia tempora aliquam. Voluptatem adipisci dolore ut tempora. Ut est amet aliquam.,https://picsum.photos/524/?random,,Dolorem quisquam dolore neque numquam modi adipisci tempora.,,,,
2005,,,,,,,,2005,Quiquia est aliquam voluptatem numquam eius.,Dolorem dolor magnam consectetur non eius sit etincidunt. Labore numquam quisquam quaerat porro amet sit est. Numquam dolorem voluptatem neque. Sit amet dolore neque dolor. Adipisci quiquia ipsum adipisci.,https://picsum.photos/525/?random,,Labore etincidunt modi ut ipsum quiquia.,,,,
1985,,,,,,,,1985,Quaerat sed quisquam etincidunt.,Quisquam quiquia dolore sit porro non. Quiquia sit amet quiquia voluptatem sed consectetur tempora. Aliquam quisquam quaerat porro amet neque. Sed dolor adipisci tempora modi dolor ipsum non. Aliquam non adipisci ut porro ut tempora. Sed sed amet aliquam sed tempora numquam. Labore ipsum labore velit tempora ut neque. Voluptatem dolorem velit ipsum est consectetur. Dolore tempora labore labore ipsum sed amet eius.,https://picsum.photos/526/?random,,Sed est dolor amet ut non labore ut.,,,,
1999,,,,,,,,1999,Tempora sed porro aliquam.,Sit adipisci non quiquia est voluptatem adipisci. Voluptatem magnam velit consectetur ut. Ut quaerat quisquam numquam dolorem numquam. Non voluptatem etincidunt tempora adipisci dolorem ut neque. Neque non consectetur voluptatem voluptatem tempora est. Consectetur ut etincidunt eius sit dolore. Est eius velit porro voluptatem etincidunt voluptatem adipisci. Velit velit non eius numquam velit tempora. Tempora magnam numquam amet. Dolorem porro est dolore.,https://picsum.photos/527/?random,,Sit porro aliquam aliquam sed.,,,,
2015,,,,,,,,2015,Modi voluptatem ipsum neque neque.,Ut numquam dolorem neque. Porro consectetur ut quisquam voluptatem. Voluptatem neque dolore porro velit ipsum quisquam tempora. Quisquam dolorem labore quaerat etincidunt dolorem dolor magnam. Adipisci etincidunt porro quisquam velit aliquam dolore tempora. Etincidunt consectetur quisquam ut. Modi sit ut sit consectetur numquam labore tempora. Dolorem est est labore est adipisci eius.,https://picsum.photos/528/?random,,Adipisci quiquia neque non numquam consectetur amet velit.,,,,
2000,,,,,,,,2000,Sit quisquam dolore numquam amet.,Sit ipsum est porro porro magnam dolore quiquia. Eius etincidunt sed adipisci ipsum quisquam. Non tempora labore etincidunt. Dolorem aliquam voluptatem labore velit adipisci dolor neque. Dolore porro ipsum amet dolorem aliquam. Ipsum sit amet neque.,https://picsum.photos/529/?random,,Tempora quaerat sed voluptatem etincidunt eius quiquia.,,,,
1995,,,,,,,,1995,Ut ipsum sit aliquam.,Quiquia consectetur etincidunt modi. Numquam voluptatem sed magnam. Velit modi consectetur adipisci numquam numquam. Dolorem sed adipisci ut eius. Quiquia non quisquam neque etincidunt etincidunt non amet. Modi numquam ut non tempora. Dolor magnam porro ut numquam.,https://picsum.photos/530/?random,,Sed eius amet quiquia.,,,,
2002,,,,,,,,2002,Quisquam ipsum consectetur magnam.,Modi non porro quiquia. Aliquam dolore modi voluptatem non adipisci consectetur ut. Porro sit velit tempora non labore voluptatem. Sed amet sed aliquam neque aliquam quiquia. Numquam eius eius voluptatem quaerat dolor sit quaerat.,https://picsum.photos/531/?random,,Neque adipisci tempora magnam dolorem quaerat ut quisquam.,,,,
1995,,,,,,,,1995,Magnam numquam voluptatem non.,Dolore porro tempora dolor consectetur aliquam. Quisquam voluptatem numquam consectetur amet labore. Sed dolorem amet etincidunt porro quiquia tempora. Modi adipisci tempora tempora dolore. Eius modi neque etincidunt. Labore velit non magnam.,https://picsum.photos/532/?random,,Amet etincidunt aliquam amet ipsum consectetur.,,,,
1995,,,,,,,,1995,Quisquam porro aliquam dolor dolorem.,Ut amet quaerat quisquam. Etincidunt velit quiquia aliquam tempora quisquam adipisci quiquia. Dolorem sit voluptatem quiquia tempora labore voluptatem ipsum. Amet dolor tempora aliquam numquam sed dolorem aliquam. Tempora sed quaerat quiquia adipisci.,https://picsum.photos/533/?random,,Sit tempora tempora dolor magnam quaerat sit.,,,,
2005,,,,,,,,2005,Consectetur voluptatem ut ut.,Etincidunt quaerat non est tempora etincidunt. Labore consectetur eius modi numquam consectetur consectetur adipisci. Ut numquam est quaerat quaerat neque. Neque amet adipisci dolorem labore. Velit dolorem tempora consectetur est non. Eius labore dolor dolor ut dolorem porro dolorem. Porro tempora ut sed dolorem non sed aliquam. Non modi voluptatem consectetur adipisci. Sit dolore non aliquam tempora adipisci numquam sed.,https://picsum.photos/534/?random,,Dolorem voluptatem velit consectetur ipsum labore quiquia non.,,,,
1996,,,,,,,,1996,Sit neque quiquia quiquia non neque non.,Est etincidunt sed eius magnam. Modi ut quisquam est consectetur sed. Eius dolor magnam velit aliquam dolor quiquia. Quisquam quisquam quisquam porro tempora. Amet voluptatem dolore dolor dolorem neque. Ipsum modi numquam adipisci modi. Quiquia dolorem est dolorem dolore tempora dolorem aliquam. Ut non est quisquam voluptatem consectetur. Aliquam quaerat aliquam porro sit amet amet numquam. Eius est tempora aliquam labore.,https://picsum.photos/535/?random,,Tempora modi labore modi.,,,,
2012,,,,,,,,2012,Sit dolorem dolorem eius.,Est eius ipsum sed dolore dolor. Ipsum dolore magnam consectetur dolor etincidunt etincidunt sed. Tempora est porro sit modi ipsum. Voluptatem voluptatem eius aliquam quiquia. Velit amet neque etincidunt aliquam quiquia. Consectetur ipsum non labore modi. Velit aliquam dolore quiquia porro eius numquam. Voluptatem dolor quiquia amet quisquam. Sit dolor etincidunt adipisci etincidunt est labore.,https://picsum.photos/536/?random,,Dolor etincidunt quisquam aliquam.,,,,
1997,,,,,,,,1997,Amet ut porro sed labore magnam non sit.,Velit amet ipsum etincidunt adipisci. Dolore dolorem modi amet ut voluptatem. Quaerat non labore quiquia dolorem quiquia etincidunt eius. Eius magnam sed ut. Labore quiquia adipisci numquam voluptatem. Dolorem modi voluptatem porro. Magnam consectetur dolorem non ut. Sed non porro consectetur eius numquam quisquam. Magnam consectetur consectetur est voluptatem ut dolorem ipsum.,https://picsum.photos/537/?random,,Porro porro consectetur amet ut amet amet eius.,,,,
2007,,,,,,,,2007,Voluptatem est ipsum etincidunt magnam.,Non dolorem voluptatem quaerat ut modi dolore porro. Quisquam est aliquam dolor velit amet velit numquam. Quiquia voluptatem dolorem ipsum est consectetur numquam quisquam. Consectetur numquam quisquam ipsum numquam ipsum tempora porro. Aliquam porro magnam eius ipsum ipsum. Neque est etincidunt velit velit dolorem. Etincidunt dolor quiquia amet modi quisquam etincidunt quisquam. Non non consectetur sed amet quisquam eius sed.,https://picsum.photos/538/?random,,Amet sed quiquia magnam porro neque consectetur.,,,,
1982,,,,,,,,1982,Non etincidunt magnam voluptatem aliquam adipisci eius quaerat.,Amet labore sed eius. Numquam ipsum quisquam ipsum numquam consectetur ut sit. Tempora magnam ut ut aliquam velit. Dolor voluptatem neque amet. Eius numquam sed voluptatem. Labore numquam ipsum eius aliquam numquam. Eius eius quaerat neque sed sed eius. Adipisci sit consectetur ipsum. Quiquia non dolorem amet eius.,https://picsum.photos/539/?random,,Quisquam ipsum etincidunt tempora non aliquam.,,,,
1982,,,,,,,,1982,Labore modi ipsum ipsum.,Dolorem sed ut quisquam ipsum quaerat labore sit. Consectetur dolore quaerat numquam labore quisquam eius. Tempora velit quaerat quisquam. Eius sed modi neque. Numquam adipisci quisquam magnam non numquam etincidunt non. Etincidunt velit est velit. Est ipsum non sed dolore. Porro porro ut magnam ut labore modi.,https://picsum.photos/540/?random,,Est est ipsum aliquam labore est consectetur ut.,,,,
1980,,,,,,,,1980,Etincidunt tempora neque quaerat sed sed est.,Velit neque dolorem dolorem ut quaerat sit modi. Adipisci dolor dolore neque sed. Labore non modi dolore dolore numquam. Aliquam ipsum quiquia neque adipisci dolor. Non tempora amet dolor magnam neque numquam magnam. Est tempora amet dolore etincidunt tempora quiquia. Est aliquam sed tempora labore quiquia velit sit.,https://picsum.photos/541/?random,,Sit non sed dolor etincidunt magnam.,,,,
1987,,,,,,,,1987,Dolore magnam sed voluptatem dolor ut dolorem.,Sed magnam amet magnam quisquam. Sit eius aliquam etincidunt. Quisquam numquam sed adipisci neque ipsum etincidunt aliquam. Neque amet est ipsum modi sit. Amet est amet aliquam porro magnam. Quisquam labore dolor modi ut. Amet tempora numquam dolorem amet dolor labore tempora. Velit consectetur ipsum numquam non dolore ut. Est velit neque porro tempora ipsum porro.,https://picsum.photos/542/?random,,Etincidunt adipisci dolore adipisci.,,,,
1993,,,,,,,,1993,Aliquam quisquam consectetur eius tempora aliquam sit.,Sed modi dolore sed dolor etincidunt etincidunt. Non numquam quisquam consectetur etincidunt neque. Magnam magnam quisquam quiquia sed voluptatem. Neque dolore quiquia dolore numquam amet voluptatem quisquam. Tempora quaerat velit voluptatem adipisci quisquam quiquia est. Dolorem tempora ipsum modi ut magnam. Tempora voluptatem modi labore amet tempora.,https://picsum.photos/543/?random,,Dolore adipisci eius labore.,,,,
2011,,,,,,,,2011,Voluptatem etincidunt neque voluptatem.,Dolorem quisquam quisquam aliquam est modi. Dolore ut porro magnam. Porro modi etincidunt eius quisquam aliquam dolor. Adipisci neque amet tempora quaerat ipsum aliquam non. Porro etincidunt magnam numquam quisquam est etincidunt. Numquam porro voluptatem numquam. Labore consectetur neque dolore etincidunt. Est velit eius etincidunt dolorem. Quaerat ut sit etincidunt magnam ipsum. Sit quisquam dolor adipisci.,https://picsum.photos/544/?random,,Aliquam ut quaerat ut non dolorem.,,,,
2009,,,,,,,,2009,Dolore non dolor porro est.,Tempora amet magnam est labore modi. Porro consectetur modi amet. Ut eius quaerat ipsum non non quisquam etincidunt. Sit est etincidunt dolore quisquam adipisci modi. Dolore eius modi sit sed.,https://picsum.photos/545/?random,,Magnam etincidunt adipisci numquam sit.,,,,
2000,,,,,,,,2000,Ut quisquam est voluptatem eius dolor.,Velit dolor est magnam non velit sit. Tempora sit dolore labore dolorem velit. Modi non consectetur voluptatem numquam dolore eius. Eius labore quisquam velit dolor quisquam. Labore tempora dolor voluptatem. Sed aliquam porro magnam sit ipsum neque ut.,https://picsum.photos/546/?random,,Voluptatem adipisci quisquam quiquia neque dolor.,,,,
2007,,,,,,,,2007,Quiquia voluptatem etincidunt velit magnam voluptatem dolore amet.,Quiquia labore sed sed ipsum magnam magnam. Dolor etincidunt modi neque. Dolorem quaerat consectetur ut. Neque magnam modi magnam ipsum non. Tempora aliquam tempora velit dolor. Dolore sed consectetur eius tempora. Dolore sed tempora aliquam tempora magnam. Velit dolore ut neque magnam est modi sed. Neque adipisci aliquam consectetur voluptatem consectetur consectetur dolore.,https://picsum.photos/547/?random,,Quiquia voluptatem amet sit ipsum dolorem.,,,,
1982,,,,,,,,1982,Non dolore non voluptatem dolorem.,Quisquam eius est magnam tempora magnam ipsum aliquam. Modi non adipisci aliquam voluptatem quisquam. Tempora tempora neque ipsum dolorem tempora. Quisquam consectetur quiquia amet quiquia dolor adipisci non. Adipisci quisquam est quisquam adipisci. Velit velit etincidunt ut. Aliquam dolor velit est quiquia. Quaerat ut magnam amet. Magnam modi ut sed.,https://picsum.photos/548/?random,,Neque tempora dolore tempora.,,,,
2011,,,,,,,,2011,Adipisci non ipsum dolorem voluptatem dolore.,Amet labore sed quaerat etincidunt porro. Labore aliquam voluptatem aliquam velit quaerat. Est sed velit dolor labore dolore. Quisquam quaerat aliquam velit ipsum amet voluptatem. Aliquam modi quiquia dolor porro modi non. Neque quisquam numquam non modi. Non dolor modi neque ipsum voluptatem.,https://picsum.photos/549/?random,,Ipsum aliquam quisquam est sed est sit.,,,,
1985,,,,,,,,1985,Quaerat porro porro sit tempora quiquia dolore voluptatem.,Dolor eius ipsum dolore amet etincidunt modi. Dolor dolor adipisci non amet dolor. Dolor tempora ipsum numquam velit ut non. Modi dolore labore aliquam ut dolore. Modi consectetur velit ut numquam numquam modi magnam. Numquam dolorem neque sed ipsum. Dolor voluptatem quisquam sed velit modi consectetur.,https://picsum.photos/550/?random,,Numquam velit quiquia quaerat etincidunt etincidunt dolorem.,,,,
1980,,,,,,,,1980,Ut labore modi velit eius quaerat.,Est ipsum quisquam sit ut tempora ut. Numquam dolore dolorem numquam dolor porro. Tempora amet labore ut. Porro porro porro quaerat consectetur numquam adipisci. Adipisci sit numquam amet neque. Neque aliquam dolore quaerat magnam quiquia ipsum. Dolorem amet quiquia ipsum neque etincidunt porro. Amet tempora eius adipisci dolorem sit etincidunt sit. Sit quisquam ut est quaerat tempora.,https://picsum.photos/551/?random,,Magnam etincidunt quisquam magnam eius porro.,,,,
1988,,,,,,,,1988,Ut velit est dolorem ut eius.,Quaerat quisquam amet neque. Etincidunt dolor tempora tempora quiquia etincidunt voluptatem labore. Quaerat eius porro voluptatem. Sit quaerat quiquia labore consectetur. Eius voluptatem dolor numquam. Quisquam consectetur velit tempora magnam ut sit.,https://picsum.photos/552/?random,,Tempora quiquia tempora dolore aliquam modi sit.,,,,
1987,,,,,,,,1987,Ipsum consectetur consectetur labore.,Adipisci non modi aliquam voluptatem est eius tempora. Porro est quisquam aliquam consectetur. Magnam eius dolor adipisci numquam quiquia. Sed numquam labore adipisci labore. Quiquia magnam voluptatem ipsum. Non ipsum porro quiquia. Velit sed labore consectetur quiquia voluptatem.,https://picsum.photos/553/?random,,Quisquam quisquam quisquam etincidunt porro quiquia modi eius.,,,,
1997,,,,,,,,1997,Ipsum voluptatem tempora dolor dolore tempora ipsum.,Numquam velit tempora numquam. Velit ut velit dolore. Quisquam adipisci ut non non aliquam modi tempora. Eius est neque magnam. Sit amet eius ipsum sit magnam amet aliquam. Sed est neque quaerat dolore quisquam dolorem dolor. Eius non amet est labore aliquam quiquia tempora. Quisquam labore magnam porro velit est labore. Magnam non ut est aliquam est aliquam ipsum. Numquam aliquam quiquia voluptatem ipsum dolor etincidunt.,https://picsum.photos/554/?random,,Numquam porro neque quisquam numquam numquam aliquam numquam.,,,,
2007,,,,,,,,2007,Quaerat eius dolorem porro non.,Tempora dolor sed est magnam. Amet dolorem neque amet dolore tempora. Dolorem numquam adipisci consectetur adipisci etincidunt neque. Porro numquam sed sit quisquam tempora tempora. Ut ipsum tempora velit dolore quaerat modi eius. Porro magnam quiquia sit sit amet amet velit. Dolorem ut quiquia quiquia porro velit dolorem quaerat. Aliquam porro porro eius. Sit ipsum neque porro. Labore sit quisquam porro dolor velit neque non.,https://picsum.photos/555/?random,,Quisquam eius velit etincidunt dolore.,,,,
1988,,,,,,,,1988,Sit magnam ipsum velit voluptatem etincidunt.,Porro quaerat magnam dolorem modi numquam. Consectetur magnam non tempora. Amet neque eius eius. Sed aliquam ipsum quiquia. Sit consectetur tempora numquam dolorem numquam quaerat adipisci. Dolore ut sed ut dolor adipisci. Dolore numquam amet sit numquam magnam est. Dolore consectetur sed ut dolor.,https://picsum.photos/556/?random,,Porro consectetur sit amet.,,,,
