Year,Month,Day,Time,End Year,End Month,End Day,End Time,Display Date,Headline,Text,Media,Media Credit,Media Caption,Media Thumbnail,Type,Group,Background
2017,9,,,,,,,September 2017,Quiquia dolore non sed sed.,Modi quiquia dolorem sed adipisci ipsum adipisci. Tempora amet dolor neque labore. Labore neque tempora neque ipsum numquam eius ipsum. Adipisci amet ipsum consectetur eius consectetur. Numquam quiquia quiquia quaerat amet. Quaerat sed quisquam sed ut quaerat adipisci quiquia.,https://picsum.photos/885/?random,,Ipsum dolorem eius modi.,,,,
2018,11,,,,,,,November 2018,Est ut est non modi etincidunt quiquia voluptatem.,Magnam quiquia numquam quaerat quiquia amet. Voluptatem modi amet ipsum quisquam consectetur ipsum sed. Dolor porro amet est. Quisquam voluptatem tempora consectetur ut ipsum. Consectetur dolor dolor quiquia.,https://picsum.photos/886/?random,,Numquam dolorem dolore labore.,,,,
1980,10,,,,,,,October 1980,Labore quisquam ipsum neque.,Ut ut porro numquam. Labore neque quisquam ut voluptatem velit. Adipisci quaerat porro dolor. Quaerat tempora amet quisquam aliquam voluptatem consectetur dolore. Voluptatem numquam sit dolor quisquam ipsum etincidunt velit. Quaerat tempora ipsum quisquam. Eius consectetur dolor quaerat tempora. Sit ut aliquam sit dolor. Amet ut aliquam tempora eius dolor. Quisquam voluptatem est non labore consectetur.,https://picsum.photos/887/?random,,Adipisci adipisci quisquam ut ipsum.,,,,
2006,8,,,,,,,August 2006,Quaerat quisquam tempora velit.,Numquam eius aliquam amet numquam. Dolor adipisci quiquia tempora magnam eius dolor. Sed quiquia dolore dolorem porro eius voluptatem eius. Numquam etincidunt quiquia magnam eius aliquam. Sit quiquia dolore eius dolorem. Non voluptatem modi modi eius ipsum sit.,https://picsum.photos/888/?random,,Eius quaerat voluptatem quisquam est sed dolore aliquam.,,,,
2012,7,,,,,,,July 2012,Tempora voluptatem dolor ut velit ut.,Modi quisquam dolorem non labore. Eius tempora sed magnam ut est. Est adipisci etincidunt sed numquam. Ipsum sit magnam dolorem modi. Quaerat ipsum quiquia amet tempora. Consectetur consectetur amet non magnam modi. Dolorem labore sit labore numquam.,https://picsum.photos/889/?random,,Velit velit ipsum dolore.,,,,
2012,9,,,,,,,September 2012,Etincidunt quiquia consectetur quaerat.,Quaerat velit adipisci amet etincidunt sed. Amet eius velit dolorem aliquam amet aliquam. Etincidunt sed porro ut est. Aliquam aliquam ipsum quisquam magnam labore. Magnam eius sed quisquam. Velit quaerat etincidunt est neque non.,https://picsum.photos/890/?random,,Adipisci dolor eius porro adipisci tempora.,,,,
1990,10,,,,,,,October 1990,Quiquia neque est dolorem quaerat eius sed.,Numquam dolorem labore labore porro numquam ipsum. Voluptatem magnam sit non numquam. Non amet quisquam sit porro. Sed labore velit tempora non neque quaerat. Quiquia numquam sit consectetur quaerat. Quisquam ipsum tempora numquam ipsum. Neque neque porro adipisci. Quiquia dolor adipisci porro porro quaerat. Sit etincidunt sit ipsum quisquam quisquam labore numquam.,https://picsum.photos/891/?random,,Ipsum numquam eius velit voluptatem labore.,,,,
2007,12,,,,,,,December 2007,Magnam dolore numquam neque quiquia est.,Modi ipsum ipsum magnam aliquam dolor labore adipisci. Ipsum adipisci ut neque tempora aliquam. Ut quisquam dolore etincidunt. Non quisquam amet amet labore quiquia. Sit numquam quiquia voluptatem quisquam consectetur etincidunt quisquam. Consectetur non neque aliquam voluptatem. Tempora quisquam quaerat est modi numquam consectetur quiquia. Quiquia sed velit aliquam dolore. Modi quiquia porro ipsum consectetur ipsum.,https://picsum.photos/892/?random,,Ut modi magnam dolorem sed labore sit.,,,,
1998,4,,,,,,,April 1998,Ut eius modi labore.,Numquam dolorem ipsum quisquam. Consectetur sit aliquam modi eius ut eius. Etincidunt non ipsum dolor. Magnam consectetur est neque. Non ut dolorem dolor. Non est magnam neque labore. Modi velit amet quiquia dolore labore adipisci.,https://picsum.photos/893/?random,,Est velit ut adipisci est porro.,,,,
2001,1,,,,,,,January 2001,Voluptatem eius ipsum porro quiquia aliquam dolor porro.,Dolor neque quiquia dolore ut est aliquam. Aliquam aliquam etincidunt labore magnam dolore voluptatem quisquam. Adipisci tempora quaerat amet est sit dolor sit. Non sed neque labore sit est sed. Aliquam etincidunt tempora aliquam. Quiquia dolore aliquam adipisci numquam quisquam.,https://picsum.photos/894/?random,,Labore est est porro velit.,,,,
2013,9,,,,,,,September 2013,Sed dolore adipisci dolore numquam dolorem.,Labore quaerat quiquia dolorem ipsum. Magnam quiquia dolorem voluptatem. Quaerat est sit voluptatem sit dolorem modi. Amet quaerat etincidunt sit neque amet. Quisquam est aliquam dolor dolor magnam.,https://picsum.photos/895/?random,,Quaerat aliquam velit tempora dolor magnam aliquam.,,,,
1995,12,,,,,,,December 1995,Labore aliquam est labore sed.,Modi adipisci est eius. Labore numquam neque aliquam amet tempora. Ut etincidunt non etincidunt velit non magnam velit. Ipsum non ipsum tempora. Porro etincidunt adipisci quaerat porro. Numquam etincidunt tempora est ipsum est. Numquam dolor magnam numquam. Non sed ut dolor quisquam tempora neque.,https://picsum.photos/896/?random,,Consectetur neque dolore adipisci numquam.,,,,
1997,9,,,,,,,September 1997,Dolore eius consectetur dolore neque consectetur neque.,Dolorem dolorem amet est numquam eius non dolor. Est velit ipsum adipisci. Labore consectetur dolorem amet. Velit sed ipsum consectetur. Magnam ipsum ut non. Amet etincidunt dolor numquam modi velit labore non. Velit consectetur modi ut sit. Dolore numquam velit numquam quiquia velit quisquam modi. Quisquam quisquam est ut.,https://picsum.photos/897/?random,,Dolorem magnam dolor labore amet consectetur.,,,,
1988,1,,,,,,,January 1988,Amet adipisci numquam ut eius numquam tempora dolore.,Etincidunt velit quaerat labore adipisci. Quaerat dolor est quisquam. Tempora amet quisquam voluptatem neque neque quiquia etincidunt. Modi ut ut dolor. Labore est porro velit magnam labore dolore. Quaerat dolor numquam quaerat etincidunt etincidunt. Velit modi ut porro voluptatem. Dolorem consectetur quisquam dolore porro amet dolore porro. Dolor dolor voluptatem dolorem sed tempora eius magnam.,https://picsum.photos/898/?random,,Amet porro numquam quaerat porro ipsum etincidunt.,,,,
2008,5,,,,,,,May 2008,Sed dolorem tempora quiquia magnam neque porro ipsum.,Dolore etincidunt quaerat ut. Modi dolorem sed dolor neque porro magnam tempora. Velit est magnam numquam adipisci porro etincidunt. Tempora aliquam etincidunt dolore consectetur. Modi sit amet numquam neque.,https://picsum.photos/899/?random,,Consectetur amet quisquam sed dolorem quisquam velit.,,,,
2008,3,,,,,,,March 2008,Dolorem labore etincidunt quaerat sed.,Velit labore non voluptatem quiquia est. Ipsum numquam amet consectetur sit porro consectetur quaerat. Dolorem sed magnam ut. Ipsum dolore dolor quaerat labore quisquam est voluptatem. Non voluptatem est velit. Etincidunt est velit est aliquam ut eius. Etincidunt consectetur voluptatem dolorem. Magnam modi numquam velit ut.,https://picsum.photos/400/?random,,Voluptatem sit dolorem consectetur numquam.,,,,
1989,5,,,,,,,May 1989,Non neque ut dolor tempora.,Neque numquam voluptatem eius sit ipsum sed. Porro etincidunt est sit neque sit tempora eius. Adipisci dolore modi eius labore eius sed. Tempora aliquam modi porro. Amet non neque est. Consectetur quiquia quaerat amet sed. Adipisci ipsum adipisci ipsum non. Ipsum quaerat aliquam velit. Adipisci amet quisquam quiquia consectetur labore magnam dolore.,https://picsum.photos/401/?random,,Etincidunt voluptatem dolor velit neque.,,,,
1988,10,,,,,,,October 1988,Amet tempora non voluptatem dolore quiquia quaerat quisquam.,Modi etincidunt quaerat dolor. Dolorem amet porro ipsum numquam. Aliquam quaerat eius voluptatem. Dolor voluptatem consectetur ipsum neque sit. Dolorem consectetur porro voluptatem non dolorem ut. Neque quisquam tempora etincidunt neque labore magnam. Dolorem ipsum numquam dolor non ipsum quiquia modi. Numquam eius dolore ipsum. Labore modi tempora quiquia adipisci modi. Magnam non non modi dolorem dolorem neque.,https://picsum.photos/402/?random,,Adipisci sit est voluptatem quaerat quiquia ipsum.,,,,
1998,3,,,,,,,March 1998,Eius modi tempora ut.,Quaerat ut adipisci voluptatem. Porro ipsum quiquia numquam. Eius non eius dolore. Quiquia quisquam sed ut porro non. Ipsum quisquam tempora ipsum dolorem. Aliquam sit quisquam dolorem dolorem ut. Numquam numquam dolore voluptatem est est amet neque.,https://picsum.photos/403/?random,,Numquam etincidunt modi aliquam modi est.,,,,
1989,2,,,,,,,February 1989,Ut quisquam dolor voluptatem non est.,Etincidunt est dolorem ipsum modi dolor eius amet. Dolor porro quaerat etincidunt aliquam velit aliquam. Labore ipsum est dolor consectetur modi magnam labore. Ipsum neque quiquia tempora velit. Sit velit modi numquam. Tempora voluptatem velit amet sed. Modi velit quiquia consectetur etincidunt modi non. Sed quisquam tempora sed dolorem tempora sit amet.,https://picsum.photos/404/?random,,Etincidunt ipsum quaerat tempora quisquam dolore labore.,,,,
1997,11,,,,,,,November 1997,Ut voluptatem numquam adipisci numquam quiquia tempora consectetur.,Quiquia sit dolore adipisci. Consectetur magnam est sed ut ipsum amet dolore. Dolore voluptatem etincidunt voluptatem modi dolor. Numquam non adipisci quiquia ipsum. Etincidunt est etincidunt velit adipisci amet adipisci ipsum. Velit labore dolor aliquam. Eius voluptatem eius porro dolorem porro. Etincidunt quiquia etincidunt modi velit amet dolorem. Quiquia etincidunt velit voluptatem non sed dolor.,https://picsum.photos/405/?random,,Est est porro ut.,,,,
1996,12,,,,,,,December 1996,Dolore porro dolor voluptatem consectetur.,Quaerat modi quisquam quiquia dolore quiquia consectetur. Etincidunt adipisci ut neque modi neque sit ipsum. Dolor dolor neque sed velit sed. Velit sit porro dolor voluptatem. Dolor dolore modi etincidunt numquam.,https://picsum.photos/406/?random,,Sit non adipisci non quaerat ut eius porro.,,,,
1989,6,,,,,,,June 1989,Dolorem numquam tempora adipisci quaerat.,Quisquam modi dolorem porro magnam dolore etincidunt. Consectetur dolorem labore tempora quaerat voluptatem consectetur. Ut dolorem quisquam ipsum. Numquam etincidunt ut sit velit. Consectetur sit velit etincidunt non numquam. Sit quaerat dolore modi.,https://picsum.photos/407/?random,,Sit magnam modi amet sed ipsum quisquam.,,,,
1995,12,,,,,,,December 1995,Dolore dolore numquam adipisci.,Ipsum ut est ut. Sit quaerat quaerat ipsum dolore modi. Amet non neque amet dolorem voluptatem numquam. Eius eius consectetur neque. Dolorem dolorem eius quiquia adipisci est. Neque aliquam quiquia non. Etincidunt labore etincidunt sit aliquam quisquam. Ipsum ut aliquam ut non est consectetur.,https://picsum.photos/408/?random,,Velit labore porro sit modi ipsum sit ipsum.,,,,
1993,5,,,,,,,May 1993,Eius dolorem velit labore amet adipisci eius etincidunt.,Sit dolore modi dolore quiquia aliquam. Amet neque etincidunt quaerat etincidunt numquam ut. Porro numquam sed ipsum. Ut est neque amet eius etincidunt numquam. Quiquia porro voluptatem aliquam modi quaerat sit dolorem. Velit velit adipisci adipisci magnam.,https://picsum.photos/409/?random,,Consectetur ipsum labore magnam quaerat eius dolor.,,,,
1986,1,,,,,,,January 1986,Dolore modi dolore dolorem ut est labore.,Dolor dolore magnam sit non ipsum. Magnam aliquam porro ut tempora. Quisquam quisquam velit sed dolore est aliquam quiquia. Tempora aliquam quaerat sed magnam est etincidunt. Etincidunt porro non quisquam.,https://picsum.photos/410/?random,,Modi ipsum etincidunt modi aliquam sit ipsum.,,,,
2002,8,,,,,,,August 2002,Dolorem labore numquam non.,Tempora ipsum dolorem modi. Est porro neque tempora dolore velit amet etincidunt. Eius ipsum neque neque numquam dolore. Ipsum non velit neque dolorem. Velit modi velit dolore etincidunt velit etincidunt ut. Labore est numquam magnam modi dolor tempora. Ut est ipsum dolorem velit porro quiquia.,https://picsum.photos/411/?random,,Dolore aliquam aliquam labore magnam sed.,,,,
1983,10,,,,,,,October 1983,Quaerat est est modi quaerat neque ipsum eius.,Velit dolor amet non. Dolorem labore sit sit tempora ipsum etincidunt. Magnam porro quaerat sit neque sed. Amet est tempora dolor neque ipsum quaerat quiquia. Dolor aliquam numquam etincidunt porro quaerat dolor. Aliquam consectetur ipsum dolor.,https://picsum.photos/412/?random,,Tempora adipisci ipsum voluptatem voluptatem aliquam sit sit.,,,,
1995,4,,,,,,,April 1995,Numquam consectetur dolor tempora.,Sed adipisci modi quiquia velit eius. Quaerat ut porro etincidunt adipisci. Eius adipisci tempora etincidunt. Adipisci est voluptatem eius. Est consectetur est sit. Etincidunt non etincidunt dolorem numquam dolor. Consectetur quiquia sed consectetur magnam consectetur. Etincidunt aliquam adipisci consectetur ut aliquam ipsum.,https://picsum.photos/413/?random,,Quaerat quiquia voluptatem ipsum labore.,,,,
2008,6,,,,,,,June 2008,Neque magnam voluptatem est eius consectetur neque.,Magnam magnam etincidunt neque. Sit quisquam consectetur sit eius tempora dolore. Ut ipsum adipisci dolorem ut sed. Quiquia dolor est eius quiquia. Adipisci tempora aliquam ut neque. Sed quisquam amet eius.,https://picsum.photos/414/?random,,Sed tempora velit dolore dolor modi adipisci.,,,,
1993,11,,,,,,,November 1993,Magnam adipisci dolore dolore numquam est neque consectetur.,Consectetur aliquam velit velit labore. Dolorem dolorem quiquia modi porro sit. Magnam eius eius quiquia quiquia. Tempora adipisci non aliquam dolore quaerat. Eius modi ipsum magnam numquam est quaerat. Etincidunt amet ut dolorem quiquia quaerat sed amet. Velit dolore porro quiquia consectetur neque. Porro dolorem neque labore quiquia est. Sed modi dolorem sit dolorem voluptatem. Adipisci ut sed voluptatem consectetur ipsum.,https://picsum.photos/415/?random,,Aliquam quaerat dolorem aliquam quaerat.,,,,
1996,6,,,,,,,June 1996,Non dolorem velit quisquam sit.,Porro consectetur ut adipisci adipisci. Voluptatem etincidunt neque dolorem aliquam. Ipsum velit consectetur ipsum porro quaerat dolor. Amet ipsum dolore amet neque ut. Adipisci dolor magnam dolorem etincidunt non dolor. Porro tempora etincidunt neque. Dolorem magnam consectetur est.,https://picsum.photos/416/?random,,Velit ut non magnam quiquia.,,,,
1984,2,,,,,,,February 1984,Labore adipisci neque porro amet.,Ipsum quaerat dolore dolorem consectetur numquam. Quisquam modi consectetur numquam tempora. Non porro dolorem dolor. Magnam ut sed est. Magnam quaerat neque voluptatem dolore quaerat. Porro dolorem quaerat ut magnam dolorem etincidunt dolore. Magnam magnam porro non adipisci porro. Est est est velit dolorem ipsum numquam.,https://picsum.photos/417/?random,,Neque neque numquam non dolore.,,,,
1983,9,,,,,,,September 1983,Amet amet magnam tempora.,Quiquia sed numquam amet quisquam velit ut dolorem. Tempora etincidunt sed adipisci consectetur dolor ipsum est. Etincidunt magnam labore quaerat voluptatem amet. Ipsum voluptatem adipisci dolore aliquam est consectetur. Velit numquam consectetur quisquam quaerat dolor modi. Est voluptatem ut modi dolorem. Magnam tempora voluptatem amet dolorem voluptatem quiquia quaerat.,https://picsum.photos/418/?random,,Quiquia dolore non adipisci tempora velit.,,,,
2004,1,,,,,,,January 2004,Ipsum dolorem eius ipsum modi tempora labore.,Ut est modi dolor eius. Consectetur aliquam quaerat labore ut labore eius etincidunt. Quiquia ipsum adipisci labore aliquam dolore voluptatem. Dolore quiquia sit tempora labore dolore dolorem. Tempora eius quaerat adipisci. Amet voluptatem dolor amet dolorem quaerat dolor dolor. Ipsum est numquam quiquia consectetur eius labore. Quisquam non modi quisquam. Aliquam amet sit sit adipisci. Dolorem ipsum amet numquam dolorem.,https://picsum.photos/419/?random,,Porro neque numquam tempora numquam labore.,,,,
1995,12,,,,,,,December 1995,Modi numquam labore sed.,Quisquam neque tempora est quisquam tempora dolor. Etincidunt voluptatem ut consectetur porro est. Consectetur quaerat ipsum quaerat. Est ipsum sit dolor dolore consectetur. Labore eius est etincidunt magnam numquam. Sed voluptatem sed velit labore quaerat. Non labore labore quiquia porro.,https://picsum.photos/420/?random,,Numquam amet dolore porro numquam quiquia aliquam.,,,,
2007,1,,,,,,,January 2007,Est aliquam quaerat velit non aliquam.,Non dolore voluptatem eius. Sit est quaerat sed modi. Tempora labore consectetur porro sit magnam. Amet quaerat labore quaerat modi dolore quisquam. Etincidunt porro quaerat ipsum neque etincidunt. Quaerat neque quiquia tempora est dolor. Modi ipsum consectetur etincidunt quisquam. Quisquam amet tempora non magnam. Dolor amet quisquam dolorem etincidunt dolore.,https://picsum.photos/421/?random,,Labore numquam voluptatem modi dolor.,,,,
2007,6,,,,,,,June 2007,Adipisci ipsum magnam magnam.,Sed eius magnam magnam quisquam tempora quiquia. Est quaerat quisquam modi quiquia sed. Consectetur quisquam magnam quiquia. Sit numquam porro dolorem adipisci ut sit. Labore porro numquam etincidunt. Dolorem neque ut eius ut.,https://picsum.photos/422/?random,,Dolore velit sit quaerat sed.,,,,
1988,7,,,,,,,July 1988,Eius velit magnam ipsum dolor dolorem magnam dolor.,Consectetur est porro numquam ipsum consectetur porro. Dolor dolorem quaerat sed modi ut aliquam. Porro sed ipsum sed. Sit etincidunt etincidunt non velit porro amet. Modi ut adipisci porro aliquam labore. Ipsum voluptatem consectetur dolor eius.,https://picsum.photos/423/?random,,Adipisci eius velit eius velit dolore.,,,,
2014,6,,,,,,,June 2014,Consectetur velit non quaerat.,Quaerat dolor non quiquia. Dolore velit quisquam labore non adipisci magnam. Neque etincidunt dolorem tempora. Amet tempora voluptatem tempora dolore sed. Porro sit dolore tempora sed eius. Numquam dolore velit aliquam. Dolor modi sit ut dolore. Quaerat etincidunt adipisci etincidunt velit. Consectetur dolor quiquia sed velit etincidunt labore tempora. Dolore quiquia modi etincidunt etincidunt amet.,https://picsum.photos/424/?random,,Velit velit quisquam consectetur modi.,,,,
1989,2,,,,,,,February 1989,Ut dolor quisquam ut quiquia.,Etincidunt dolorem sit neque est voluptatem. Quiquia modi quaerat adipisci voluptatem velit numquam est. Eius tempora quaerat amet dolor dolore amet tempora. Numquam porro modi non tempora. Etincidunt amet porro est dolorem quisquam non etincidunt. Labore dolor dolor etincidunt sed. Ut etincidunt eius eius sit amet. Dolore sit labore tempora non sit. Quisquam quisquam adipisci labore neque voluptatem voluptatem modi.,https://picsum.photos/425/?random,,Aliquam magnam dolore modi ut amet porro magnam.,,,,
1993,9,,,,,,,September 1993,Eius amet dolorem tempora labore.,Voluptatem porro est ut numquam. Quaerat dolor consectetur labore. Sed quiquia dolor dolorem magnam. Magnam numquam est neque ipsum dolore est. Consectetur etincidunt modi dolor non aliquam porro etincidunt. Velit consectetur velit eius quisquam. Modi eius sit dolorem. Labore velit quisquam numquam eius.,https://picsum.photos/426/?random,,Quiquia non quiquia non dolor.,,,,
1998,6,,,,,,,June 1998,Neque sed modi non consectetur.,Velit porro est quaerat velit porro. Dolorem velit amet dolore neque est. Ipsum quisquam non dolor porro quisquam voluptatem. Quiquia aliquam ipsum porro ut labore numquam. Sit tempora amet amet etincidunt porro ipsum porro. Sed etincidunt dolorem numquam. Dolore modi ut magnam numquam numquam numquam. Numquam ut adipisci consectetur. Quiquia labore adipisci quiquia. Etincidunt tempora quaerat dolorem tempora.,https://picsum.photos/427/?random,,Velit modi dolor labore magnam quiquia.,,,,
2017,1,,,,,,,January 2017,Neque tempora amet modi.,Modi dolor numquam consectetur eius aliquam porro. Voluptatem est porro tempora labore. Aliquam dolor est quiquia voluptatem sit. Velit porro quiquia ipsum sit quaerat magnam. Numquam adipisci ipsum sit dolorem etincidunt sed quaerat. Quaerat amet labore ipsum sit. Neque labore porro amet.,https://picsum.photos/428/?random,,Velit ipsum dolore ut labore ipsum porro neque.,,,,
2003,4,,,,,,,April 2003,Dolore labore etincidunt eius magnam sit quaerat dolore.,Consectetur sit amet quiquia tempora amet ipsum voluptatem. Aliquam consectetur ipsum dolorem sit numquam. Non dolorem aliquam dolorem quisquam dolor velit. Numquam porro quaerat porro quiquia ipsum. Eius ut velit dolorem. Dolor eius labore velit ut. Neque amet non eius. Consectetur magnam porro amet ut modi tempora. Est quiquia dolor dolor ipsum.,https://picsum.photos/429/?random,,Dolor adipisci labore quisquam.,,,,
1986,6,,,,,,,June 1986,Neque voluptatem magnam ut.,Velit sit consectetur consectetur. Tempora ut velit eius dolore. Amet neque voluptatem sed modi modi voluptatem neque. Tempora tempora velit adipisci velit sed. Non quisquam eius magnam velit est dolorem. Velit etincidunt sed quaerat adipisci quaerat. Sit quiquia etincidunt magnam magnam.,https://picsum.photos/430/?random,,Dolorem quiquia quisquam aliquam etincidunt quisquam.,,,,
1992,6,,,,,,,June 1992,Adipisci consectetur ipsum neque est quisquam.,Sit numquam numquam aliquam velit dolore adipisci. Porro neque ipsum dolore porro dolor quaerat. Porro sed dolore sit numquam sed quisquam dolor. Neque consectetur sit quaerat quisquam. Quisquam velit velit quiquia.,https://picsum.photos/431/?random,,Consectetur non etincidunt voluptatem numquam sed ut sed.,,,,
1980,9,,,,,,,September 1980,Tempora numquam eius etincidunt aliquam quiquia amet voluptatem.,Neque tempora adipisci adipisci. Voluptatem etincidunt numquam est. Ut velit magnam labore dolor amet quaerat. Ipsum numquam labore adipisci sit modi. Sit sit labore dolor magnam sed sed non. Dolorem etincidunt labore dolorem quisquam porro voluptatem eius. Dolore ipsum eius non labore velit non.,https://picsum.photos/432/?random,,Ut porro neque non labore ipsum.,,,,
1996,11,,,,,,,November 1996,Voluptatem quisquam ipsum quisquam non ipsum consectetur.,Ut velit quaerat quaerat quaerat. Quaerat dolore dolor neque quisquam. Quisquam labore labore sit dolore labore consectetur consectetur. Labore neque labore dolor magnam velit eius. Adipisci magnam aliquam non ipsum tempora. Amet eius dolorem dolorem est est porro ipsum. Magnam quiquia adipisci porro neque labore dolore tempora. Neque sit amet numquam consectetur quaerat aliquam. Numquam adipisci numquam magnam quisquam modi porro.,https://picsum.photos/433/?random,,Modi sed neque voluptatem.,,,,
1994,6,,,,,,,June 1994,Sed amet dolor consectetur sed aliquam aliquam.,Velit numquam velit tempora est ut ut numquam. Modi consectetur dolore sed. Etincidunt non magnam eius eius est consectetur. Dolor est sit est consectetur. Tempora tempora dolor amet etincidunt dolore est amet. Est dolor sed quisquam. Magnam modi ut magnam.,https://picsum.photos/434/?random,,Magnam dolor dolore magnam.,,,,
1998,3,,,,,,,March 1998,Dolorem ut velit ut.,Aliquam porro est labore velit. Neque porro tempora non sed ut. Dolor quiquia aliquam labore sed. Quisquam tempora ut numquam aliquam dolore aliquam etincidunt. Sed voluptatem dolor etincidunt dolorem. Adipisci modi dolorem dolorem. Modi labore amet est quiquia. Neque non sed sed velit porro. Neque aliquam dolor modi ipsum modi neque velit. Sed ipsum adipisci quisquam sed porro neque.,https://picsum.photos/435/?random,,Est dolorem numquam porro dolor consectetur.,,,,
1983,2,,,,,,,February 1983,Sit est etincidunt porro sed dolorem porro dolorem.,Eius sed voluptatem adipisci ipsum tempora. Sit dolor porro porro magnam. Tempora quiquia quiquia porro non velit etincidunt. Numquam adipisci dolor non consectetur dolor. Tempora est dolorem ipsum amet est modi. Quaerat etincidunt dolorem modi tempora dolore ut eius.,https://picsum.photos/436/?random,,Magnam voluptatem consectetur magnam est tempora.,,,,
1999,4,,,,,,,April 1999,Ut neque eius dolore.,Dolor quaerat voluptatem voluptatem labore ipsum consectetur. Aliquam ut porro sit magnam ipsum. Etincidunt voluptatem quiquia adipisci modi. Aliquam dolore modi sit voluptatem sit. Neque porro ut aliquam numquam quisquam dolor quaerat. Adipisci sit etincidunt labore amet sit modi. Sit eius non labore. Dolor voluptatem ipsum quiquia neque ipsum dolor ipsum.,https://picsum.photos/437/?random,,Voluptatem aliquam voluptatem numquam est.,,,,
1987,11,,,,,,,November 1987,Sed non porro ut.,Non eius ut dolore. Quaerat dolor dolore porro amet. Ipsum adipisci voluptatem labore. Amet tempora labore dolor quisquam porro magnam. Etincidunt sit ut magnam amet. Sit amet eius porro quiquia. Sed dolore dolore eius. Numquam sed quaerat voluptatem. Quiquia velit quaerat numquam quaerat quaerat.,https://picsum.photos/438/?random,,Aliquam eius non eius labore amet neque.,,,,
1993,2,,,,,,,February 1993,Quaerat etincidunt amet consectetur labore eius.,Amet velit modi non velit aliquam sed ipsum. Amet sed ut modi. Sit etincidunt ipsum dolorem. Sed magnam adipisci quisquam numquam ut eius. Dolorem dolore numquam sed.,https://picsum.photos/439/?random,,Sit dolor sed modi velit.,,,,
2012,10,,,,,,,October 2012,Numquam voluptatem quisquam eius tempora labore.,Quiquia neque consectetur sed consectetur. Quiquia eius sed sed ut. Quiquia non velit voluptatem sit adipisci. Porro aliquam dolore velit eius voluptatem ut adipisci. Labore quaerat est adipisci est ut. Ut sit etincidunt neque amet. Etincidunt ipsum porro etincidunt. Numquam porro quaerat sed. Numquam dolore numquam voluptatem.,https://picsum.photos/440/?random,,Sed labore est tempora ut quaerat.,,,,
